201947,Remove dependency on org eclipse core resources from org eclipse emf validation, Build ID  I20070625 1500The org emf validation plugin currently requires org eclipse core resources as a dependency   This should be made optional  as was done in other emf plugins in order for Validation to be used within an RCP application  ,3
330579, director  Allow for incomplete version numbers to be specified on the command line, I m trying this on top of Eclipse 3 6 0 Fails eclipse  application org eclipse equinox p2 director  repository   installIU org eclipse wst jsdt feature feature group 1 2 2Succeeds eclipse  application org eclipse equinox p2 director  repository   installIU  org eclipse wst jsdt feature feature group 1 2 2 v201008170101 7C78FGMF9JgLWLMUUEMtXcI only want to install JSDT 1 2 2  instead of 1 2 0  but it s not easy without knowing exact qualifier number it d be utterly cool to get rid of qualifiers  and just use 3 part version numbers  ,3
535685, Migration  Unify Template Model and View Model Migration, The template model and view model migration should be refactored to use common functionality from common migration bundles Currently  the view model and the template model migration are completely separated from each other  Additionally  the template model migration is only based on string substitution  Furthermore  classes like TemplateModelMigrationUtil or TemlateModelWorkspaceMigrator are part of the view migrator bundle   gt  The migration should be refactored to have a common Edapt based migrator and  if necessary  subclasses with specific details for view and template models  The basic Edapt migrator should be located in a common migration bundle  For this  most functionality should also be present in the EdaptViewModelMigrator Currently  the logic for checking for migrating files in the workspace is duplicated between the view and the template editor  except forsearching for model files  this is in WorkspaceUtil in the ide util bundle    gt  The workspace migration should be centralized in a common workspace migration bundle and check for all  EMF Forms  models  currently viewand template   This includes the dialogs prompted to the user as well as executing the migration  ,3
508341,Git s default repository folder gets reset every time, Ubuntu 16 04Eclupse 4 6 2 RC1I tried to set the EGit s default repository Window    gt  Preferences    gt  Team    gt  Git  and then reset the  Default repository folder  However  every time I restart Eclipse  the setting goes back to its default   home  lt username gt  git   How do I fix it  or can I manually edit the setting file  which one   ,3
282729,Coretools runtime spy should analyze target runtimes without extra dependencies, The current version of core tools seems to require all manner of additonal bundles from JDT to LTK to IDE  This is very problematic for someone trying to understand why their RCP or Equinox application is starting slowly  Not sure if Equinox is managing the core tools work these days   At least the th  Perhaps in the incubator  ,3
257801,Provided Capability Metadata for Bundles that contain Actions and Touchpoints,   It would be helpful if bundles thIf we can get to the level of knowing wh ,3
388770,Provide a lazy adapting ChangeRecorder, Provide a ChangeRecorder th   A org eclipse emf ecore change util ChangeRecorder cannot be used together with partly loaded CDO models since the self adapting mechanism follows all references recursively until the whole containment graph has been loaded into memory CDO provides a CDOLazyContentAdapter thIt would be favourable if the proposed  lazy  ChangeRecorder was compatible with the existing org eclipse emf ecore change util ChangeRecorder and so also with ChangeCommand  But ChangeCommand  ChangeRecorder and its adaption mechanism are currently  soldered  together in a way thIdeas   Make org eclipse emf ecore change util ChangeRecorder delegate the object adaption to a pluggable adapter  let it default to current behaviour   In this way a CDOLazyContentAdapter can be used when needed and all related EMF functionality can be reused by CDO models   IF the org eclipse emf common notify Adapter interface doesn t provide enough functionality for the ChangeRecorder  maybe a new interface with the functionality needed by a pluggable adapter can be introduced and then be implemented by CDOLazyContentAdapter There may be similarities with this bug   ,3
294852, SVN Change Sets  model does not always display date and author information, In the Synchronize View   Incoming changes  SVN Change Sets enabledsome change sets do not contain neither date nor author  but display  6955  no date   no author   Looking at the specific change set in more details   File 1  deleted  date and author available from the last version   File 2  added  here both date and author are available So I guess somehow the information from File 2 is not taken for the change set date and author tags What happens if only deleted files are in change set  Is it possible to get date and author information then h1  Steps to reproduce  At revision 4241    directories  dir1 dir2   and  dir1 dir3    Create  file 1 txt    Delete  file 1 txt   outside Eclipse in another workspace  Create  file 2 txt   outside Eclipse in another workspace  Commit both changes outside Eclipse in another workspace with comment  XXX   Synchronize in Eclipse  Go to incoming changes  Switch to SVN Changesets modelbc  4242  no date   no author  XXX   dir1     dir2      lt   file 1 txt 4241     dir3      lt   file 2 txth1  Version DetailsVersion 0 7 8 I20091106 1900SVN Client org eclipse team svn connector svnkit15 2 2 1 I20091106 1700 SVN 1 5 6 SVNKit 1 2 3    r5745JVM Properties  java vendor Sun Microsystems Inc   osgi bundles defaultStartLevel 4  org osgi supports framework extension true  sun management compiler HotSpot Client Compiler  eclipse p2 profile epp package jee  os name Linux  org eclipse mylyn internal wikitext ui editor syntax FastMarkupPartitioner debug true  osgi ws gtk  java vm specification vendor Sun Microsystems Inc   java runtime version 1 6 0 11 b03  osgi instance area file  export home joerg macd workspace   user name joerg  osgi framework extensions reference file javax transaction 1 1 1 v200909161740 jar reference file org eclipse persistence jpa equinox weaving 1 1 2 v20090612 r4475 jar  eclipse launcher  opt Eclipse 3 5 1 Galileo 2009 10 31 TasktopPro eclipse eclipse  org osgi framework language en  osgi frameworkClassPath    file  opt Eclipse 3 5 1 Galileo 2009 10 31 TasktopPro eclipse plugins javax transaction 1 1 1 v200909161740 jar  file  opt Eclipse 3 5 1 Galileo 2009 10 31 TasktopPro eclipse plugins org eclipse persistence jpa equinox weaving 1 1 2 v20090612 r4475 jar  user language en  org osgi framework processor x86  osgi syspath  opt Eclipse 3 5 1 Galileo 2009 10 31 TasktopPro eclipse plugins  sun boot library path  LOCAL COPY fileserver export opt2 JavaCentral linux jdk1 6 0 11 jre lib i386  osgi manifest cache  opt Eclipse 3 5 1 Galileo 2009 10 31 TasktopPro eclipse configuration org eclipse osgi manifests  org eclipse swt internal gtk disablePrinting   java version 1 6 0 11  org osgi framework os name Linux  user timezone Europe Berlin  java net preferIPv4Stack true  sun arch data model 32  java endorsed dirs  LOCAL COPY fileserver export opt2 JavaCentral linux jdk1 6 0 11 jre lib endorsed  osgi tracefile  export home joerg macd workspace  metadata trace log  sun cpu isalist   sun jnu encoding ISO 8859 1  eclipse application org eclipse ui ide workbench  file encoding pkg sun io  org osgi framework vendor Eclipse  file separator    java specification name Java Platform API Specification  java class version 50 0  user country US  org eclipse equinox launcher splash location  opt Eclipse 3 5 1 Galileo 2009 10 31 TasktopPro eclipse  plugins org eclipse platform 3 3 201 v200909170800 splash bmp  java home  LOCAL COPY fileserver export opt2 JavaCentral linux jdk1 6 0 11 jre  osgi os linux  eclipse commands  os linux  ws gtk  arch x86  showsplash  opt Eclipse 3 5 1 Galileo 2009 10 31 TasktopPro eclipse  plugins org eclipse platform 3 3 201 v200909170800 splash bmp  launcher  opt Eclipse 3 5 1 Galileo 2009 10 31 TasktopPro eclipse eclipse  name Eclipse   launcher library  opt Eclipse 3 5 1 Galileo 2009 10 31 TasktopPro eclipse  plugins org eclipse equinox launcher gtk linux x86 1 0 200 v20090520 eclipse 1206 so  startup  opt Eclipse 3 5 1 Galileo 2009 10 31 TasktopPro eclipse  plugins org eclipse equinox launcher 1 0 201 R35x v20090715 jar  product org eclipse epp package jee product  keyring  export home joerg  eclipse keyring  keyring  vm  LOCAL COPY fileserver export opt2 JavaCentral linux jdk1 6 0 11 bin    jre lib i386 client libjvm so   java vm info mixed mode  osgi splashLocation  opt Eclipse 3 5 1 Galileo 2009 10 31 TasktopPro eclipse  plugins org eclipse platform 3 3 201 v200909170800 splash bmp  os version 2 6 24 24 generic  osgi arch x86  path separator    java vm version 11 0 b16  org osgi supports framework fragment true  osgi framework shape jar  osgi instance area default file  export home joerg macd workspace   java awt printerjob sun print PSPrinterJob  sun io unicode encoding UnicodeLittle  org osgi framework version 1 5 0  osgi install area file  opt Eclipse 3 5 1 Galileo 2009 10 31 TasktopPro eclipse   osgi framework file  opt Eclipse 3 5 1 Galileo 2009 10 31 TasktopPro eclipse plugins org eclipse osgi 3 5 1 R35x v20090827 jar  user home  export home joerg  org eclipse equinox simpleconfigurator configUrl file org eclipse equinox simpleconfigurator bundles info  org eclipse mylyn context core context active true  osgi bundlestore  opt Eclipse 3 5 1 Galileo 2009 10 31 TasktopPro eclipse configuration org eclipse osgi bundles  osgi splashPath platform  base plugins org eclipse platform  osgi nl en US  java specification vendor Sun Microsystems Inc   java library path  LOCAL COPY fileserver export opt2 JavaCentral linux jdk1 6 0 11 jre lib i386 client  LOCAL COPY fileserver export opt2 JavaCentral linux jdk1 6 0 11 jre lib i386  usr lib xulrunner addons  usr lib xulrunner addons  usr java packages lib i386  lib  usr lib  java vendor url  ,3
410721, no repository found containing  when trying to update to Eclipse 4 3RC4, I have two virtually identical Eclipse 4 3RC installations on the same machine in similar directories  I have the Eclipse 4 3 Milestones update site registered  One of the two installations updated just fine by going to Help Check for Updates  The other installation refuses to update and gives the following error An error occurred while collecting items to be installedsession context was  profile SDKProfile  phase org eclipse equinox internal p2 engine phases Collect  operand   action   No repository found containing  osgi bundle com ning async http client 1 6 5 20130531 2315No repository found containing  osgi bundle org eclipse datatools connectivity 1 2 8 v201305301230No repository found containing  osgi bundle org eclipse emf codegen 2 9 0 v20130603 0742No repository found containing  osgi bundle org eclipse emf common ui 2 8 0 v20130603 0742No repository found containing  osgi bundle org eclipse emf ecore edit 2 8 0 v20130603 0742No repository found containing  osgi bundle org eclipse emf edit 2 9 0 v20130603 0742No repository found containing  osgi bundle org eclipse emf edit ui 2 9 0 v20130603 0742No repository found containing  osgi bundle org eclipse epp mpc core 1 2 0 I20130605 1345No repository found containing  osgi bundle org eclipse epp mpc help ui 1 2 0 I20130605 1345No repository found containing  osgi bundle org eclipse epp mpc ui 1 2 0 I20130605 1345No repository found containing  osgi bundle org eclipse jst j2ee 1 1 700 v201306041830No repository found containing  osgi bundle org eclipse jst j2ee core 1 3 0 v201306042200No repository found containing  osgi bundle org eclipse jst j2ee jca 1 1 700 v201305311500No repository found containing  osgi bundle org eclipse jst j2ee web 1 1 700 v201305311500No repository found containing  osgi bundle org eclipse m2e archetype common 1 4 0 20130531 2315No repository found containing  osgi bundle org eclipse m2e core 1 4 0 20130601 0317No repository found containing  osgi bundle org eclipse m2e core ui 1 4 0 20130601 0317No repository found containing  osgi bundle org eclipse m2e discovery 1 4 0 20130601 0317No repository found containing  osgi bundle org eclipse m2e editor 1 4 0 20130601 0317No repository found containing  osgi bundle org eclipse m2e editor xml 1 4 0 20130601 0317No repository found containing  osgi bundle org eclipse m2e jdt 1 4 0 20130601 0317No repository found containing  osgi bundle org eclipse m2e launching 1 4 0 20130601 0317No repository found containing  osgi bundle org eclipse m2e lifecyclemapping defaults 1 4 0 20130601 0317No repository found containing  osgi bundle org eclipse m2e maven indexer 1 4 0 20130531 2315No repository found containing  osgi bundle org eclipse m2e maven runtime 1 4 0 20130531 2315No repository found containing  osgi bundle org eclipse m2e model edit 1 4 0 20130601 0317No repository found containing  osgi bundle org eclipse m2e refactoring 1 4 0 20130601 0317No repository found containing  osgi bundle org eclipse m2e scm 1 4 0 20130601 0317No repository found containing  osgi bundle org eclipse m2e wtp 1 0 0 20130604 1618No repository found containing  osgi bundle org eclipse m2e wtp overlay 1 0 0 20130604 1618No repository found containing  osgi bundle org eclipse m2e wtp overlay ui 1 0 0 20130604 1618No repository found containing  osgi bundle org eclipse wst server discovery 1 0 400 v20130529 1709No repository found containing  osgi bundle org eclipse wst web 1 1 700 v201305311600No repository found containing  osgi bundle org eclipse xsd 2 9 0 v20130603 0742No repository found containing  osgi bundle org eclipse xsd edit 2 6 0 v20130603 0742No repository found containing  osgi bundle org jboss netty 3 2 5 Final 20130531 2315No repository found containing  org eclipse update feature org eclipse epp mpc 1 2 0 I20130605 1345No repository found containing  org eclipse update feature org eclipse jst enterprise core feature 3 5 0 v201303132100 52FXNAkF7BG7QBHAJ77No repository found containing  org eclipse update feature org eclipse jst enterprise ui feature 3 5 0 v201303132100 7b7KIaeFSK2WQtQTAGyA7QXyUmRmNo repository found containing  org eclipse update feature org eclipse m2e feature 1 4 0 20130601 0317No repository found containing  org eclipse update feature org eclipse m2e wtp feature 1 0 0 20130604 1618No repository found containing  org eclipse update feature org eclipse wst server ui feature 3 3 203 v20130413 1400 7B7AFO9AtNdu xdIf1JkOkC8EABNo repository found containing  org eclipse update feature org eclipse wst web core feature 3 5 0 v201209252144 7E7KFYxAJz0mwD584sMRRsRid0oqjcalNo repository found containing  org eclipse update feature org eclipse wst web ui feature 3 5 0 v201209252144 7O7QG 6EMkBQ3BbbkeW0v80T4Kg8QYEUELicbYyfI have removed and re added the Eclipse 4 3 Milestones update site URL  to no avail  ,3
401960,Provide better way to describe repositories, When it comes to dealing with repositories  p2 offers a lot of flexibility thSuch things include  associated repositories  mirror URLs  download stats URL  nested categories  uncategorized content  etc In attempt to overcome those limitations  and to learn XText  I created last summer the attached grammar which provides the basis for a repository DSL  Put in action  this DSL allows things like the following example  which I hope is sufficiently self explanatory repoName   My tools referenceRepo     as  Juno  enabled hidden category   Tools iu  org eclipse code recomenders    1 0 0    2 0 0  feature  org eclipse pde category   Maven tools iu  org eclipse m2e endenduncategorizedContent feature   someStuffThatNeedToBeInTheRepo iu   org eclipse p2 endAs you can see the approach is fairly simple  describe wh   How will people work with this This file will be used to replace site xml and category xml  People will be able to edit it using the Xtext generated editor  which includes all the bells and whistles an editor needs    see below on addition completion for the various IDs    or alternatively they should be able to edit it with a simple text editor or other more automation oriented tools    What is missing Though I m happy with the way things look  neither the grammar nor the editor are production ready  and we don t even have the p2 publisher bit thOn the grammar side the following things need to be added   Inclusion mode  This element would allow to describe whether just the IU  its slice or resolved dependencies should be included in the IU   Edition context  This element which should be located   Stats tracker URL  The URL against which to report download stats   Mirror list  The list of mirrors   More simple format  I m wondering if a Yaml like formOn the editor side  the completion logic needs to be added    Where will the project be hosted Though the  prototype is currently on my personal bitbucket account   ,3
533869,Provide org eclipse gef mvc tests fx via separate mvc test support feature, Currently  when writing tests for an MVC FX application  the utility classes provided by org eclipse gef mvc tests fx  i e  FXApplicationThreadRule and FXNonApplicationThreadRule  have to be copied from the source code  e g  GitHub  since they are not provided as part of the published artefacts  i e  you cannot download them from any update site  We should provide a separate mvc test support feature th ,3
59506, browser  applets and flash plugin issues when running inside JVM,  reported crashes when trying to run certain activeX controls from within IE from within a Java VM  These were workarouned v gt 20040421 by disabling all activeX in the Browser on IE This PR is a placeholder to test future JVM s and try to identify better workarounds   maybe only disallow known plugins that cause trouble  best way to do this    find a way to get these plugins to work ,3
200103, GraphLayout  Consider changing DirectedGraphLayout steps to protected,  ,3
525809,Allow Jasper 8 for org eclipse equinox jsp jasper, Currently the range on org apache jasper servlet is  0 8  that exclude jasper 8 the only bundle th There are other bundles providing jasper  in jetty for example   thx anyway it makes sense to support jasper 8  and maybe 9  as jasper 7 is outdated and support will be canceled soon ,3
264676,Provide SnapToGeometry support for all EditPart containers, The current SnapToHelperUtil getSnapHelper GraphicalEditPart editPart  only supports containers of type ISurfaceEditPart  diagrams and compartments  getSnapHelper GraphicalEditPart editPart          GraphicalEditPart parent   editPart   while  parent    null  amp  amp    parent instanceof ISurfaceEditPart        parent    GraphicalEditPart  parent getParent            It would be useful to support all kinds of containers  This includes ShapeNodeEditParts too  ,3
250667,Repository submission view,  ,3
515847,Provide an ability to do conservative updates, Currently directory planner will attempt to update all dependent uiif you install something  our customers would like to have abilityto preserve their existing installation as much as possible unless theyspecifically request an update  or its mandatory by other requirements Example I have two units a and b  and b requires a  unversioned I have installed a 1 and b 1  1 is version   and group of a and b is the root  Now I want to install b 2  so I should be able to just install b 2 and not a 2 But currently it won t let me  It will attempt to pull a 2 as well I don t want to mark a 1 as root  but the only other way is to fixoptimization function Pascal suggested to provide a profile property indicating level of concervativeness th ,3
515158, client  reporting errors caused by IDE shutdowns, I reported this problem against the platform  The bottom line is th For example  this problem  i e   Display getDefault needing to create a display  could only happen if the display has been destroyed  which only happens on shutdown Because the destroy could happen after I call Display getDefault but before it locks and checks the state of the variable  I cannot prevent this exception Similarly for  where the field that s null can only be null because the bundle s stop method has set it to null List of similar reported problems in AERI  ,3
511954,Reentrant call in Open Type Dialog, What steps will reproduce the problem 1   Open Open Type Dialog2   Type something CamelCasey3   The warning pops up  which causes the Open Type Dialog to lose focus   unfortunately  not 100  reproducible  but really really often Happens all the time  and losing the focus is extremely annoying when you want to open something quick    Error Details   Date  Thu Feb 09 08 53 19 CET 2017Message  Ignored reentrant call while viewer is busy  This is only logged once per viewer instance  but similar calls will still be ignored Severity  WarningProduct  Eclipse 4 6 2 20161208 0625  org eclipse epp package java product Plugin  org eclipse jfaceException Stack Trace java lang RuntimeExceptionjava 761 java 1003 java 2795 java 82 java 84 java 5227 java 1340 java 1366 java 1349 java 270 java 209 java 809  gtk list store set Native Method java 9413 java 1302 java 114 java 159 java 1676 java 141 java 382 java 474 java 42 java 50 java 173 java 1559 java 1006 java 2795 java 486 java 457 java 1041 java 1229 java 1258 java 242 java 236 java 405 java 84 java 5227 java 1340 java 1366 java 1349 java 1134 java 968 java 1393 java 97 java 35 java 182 java 4536 java 4154 java 818 java 794 java 471 java 80 java 167 java 291 java 90 invoke Unknown Source java 43 java 498 java 55 java 282 java 264 java 132 java 152 java 494 java 488 java 210 java 286 java 507 java 558 java 378 java 324 java 86 java 84 java 1605 java 1339 java 1366 java 1349 java 1378 java 764 java 3465 java 801 java 2000 java 5827 java 5498  gtk main do event Native Method java 9545 java 1275  g main context iteration Native Method java 2495 java 4149 java 1121 java 336 java 1022 java 150 java 693 java 336 java 610 java 148 java 138 java 196 java 134 java 104 java 388 java 243 invoke0 Native Method java 62 java 43 java 498 java 673 java 610 java 1519 java 1492  ,3
415398, ui  missing sortable software identifier column, Hello for a long time I really wonder why there is no column for the software identifier in the  Available Software  page  accessed via the menu  Help    gt   Install New Software      To give you some example use cases where such a sortable column would be very helpful The update site    contains many versions for a lot of different extensions  But not a few of them have the same name but a different identifier and vice versa so it is hard to say which software you are actually looking at E g  software with the name  MoDisco Java Feature  Incubation   is listed with the following IDs  org eclipse modisco java feature feature grouporg eclipse gmt modisco java feature grouporg eclipse gmt modisco java source feature grouporg eclipse gmt modisco java features feature groupFurthermore if you would like to have a look at all the available versions of a particular extension they may be not grouped together because of different names which makes it hard to actually find them  org eclipse gmt modisco java source feature group 0 9 0 v201106080847  is named  MoDisco Java Feature  Incubation   all the other versions of thSo I would be very pleased if you would add a column with the software identifier thIf it is too hard to add such a column to the  Available Software  dialog directly it would also be fine for me if you would just make the table within  Install Details  sortable  Then one just would have to select all the features in the  Available Software  Dialog and hit the  Next  gt   button to get a view of all the software IDs  the column is already there  and the  nowadays outstanding  sorting ability Thanks a lot  ,3
191352,Provide Tag selector component, Dreamweaver has an excellent tag selector component thI m pasting a link to see screenshots but I don t know for how long they will be up  Also MS s Expression Web will have a similar component but I haven t seen it in action yet  you can find screenshots on the web  On a side note it would be nice to have these shortcuts in the classic outline but I m afraid this comment might get lost in the bugs  ,3
