445703, Unit Test Failure  org eclipse emf facet efacet sdk tests internal EFacetTests, Failed to execute runnable  org eclipse swt SWTException  Widget is disposed Stacktraceorg eclipse swt SWTException  Failed to execute runnable  org eclipse swt SWTException  Widget is disposed java 4441 java 4356 java 209 java 156 java 4602 java 853 invoke0 Native Method java 39 java 25 java 597 java 47 java 12 java 44 java 24 java 309 java 127 java 26 java 238 java 63 java 236 java 53 java 229 java 309 java 53 java 123 java 104 invoke0 Native Method java 39 java 25 java 597 java 164 java 110 java 175 java 123 java 86 java 44 java 73 java 662 Caused by  org eclipse swt SWTException  Widget is disposedjava 4441 java 4356 java 4327 java 476 java 413 java 2475 java 160 java 207 java 98 java 84 java 4464 java 1388 java 1412 java 1397 java 649 java 645 java 869 java 35 java 136 java 3778 java 3416 java 1151 java 337 java 1032 java 148 java 637 java 337 java 580 java 150 java 141 java 31 java 114 java 37 java 196 java 134 java 104 java 380 java 235 invoke0 Native Method java 39 java 25 java 597 java 648 java 603 java 1465 java 1438  ,1
357806,Need to decide and implement how user will get samples, How will user get the EDT sample projects into their workspace some choices1  click get samples from welcome page2  do it like CE  whenever user creates a web project  they will get the sample projects3  do it like RBD  user get it from Help  ,1
195463,No completions provided for Ruby call when following line has arguments, Build ID  I20070625 1500Steps To Reproduce 1  Create an Empty Ruby Script2  Add the following contents  lt pre gt String new abc   String new  test  lt  pre gt 3  Place the cursor at the end of the first line4  Invoke completion  Ctrl Space    Note that no proposals are providedMore information Note  if you remove  test  from the second line  completion will work as expected As far as I can tell  this is caused by ASTUtils findMinimalNode   failing to resolve the CallExpression  instead returning the ModuleDeclaration   Further  it looks like the parser considers  abc   from the second line to be a continuation of the first line  ,1
443455,modal dialog shown when task list index is corrupt, In the task list view  whenever I type something  an Eclipse error dialog pops up  Stack trace below In my   metadata  mylyn  taskListIndex  folder  I have a file named  segments toolcita2 gen   I guess this file got created automatically by MS OneDrive when there was a conflict between it and the same file on another one of my systems  Deleting the file solves the problem I would expect Mylyn to function correctly even in the presence of unexpected files                      eclipse buildId 4 4 0 I20140606 1215java version 1 8 0 20java vendor Oracle CorporationBootLoader constants  OS win32  ARCH x86 64  WS win32  NL en USFramework arguments    product org eclipse epp package rcp productCommand line arguments    os win32  ws win32  arch x86 64  product org eclipse epp package rcp productjava lang NumberFormatException  For input string   toolcita2 gen forInputString Unknown Source parseLong Unknown Source java 226 java 161 java 644 java 75 java 462 java 322 java 772 java 569 java 47 java 243 java 138 java 121 java 262 java 243 java 149 java 51 java 89 java 909 java 617 java 2649 java 1918 java 684 java 1893 java 1850 java 1528 java 1436 java 366 java 1397 java 1525 java 533 java 1292 java 1481 java 1280 java 528 java 97 java 35 java 136 java 4147 java 3764 java 1151 java 332 java 1032 java 148 java 636 java 332 java 579 java 150 java 135 java 196 java 134 java 104 java 382 java 236 invoke0 Native Method invoke Unknown Source invoke Unknown Source invoke Unknown Source java 648 java 603 java 1465 java 1438  ,2
437435,Provide a Logback to Bugzilla Appender, It would be gre What I have in mind is something along these lines Whenever an error is logged and the plug in id starts with  org eclipse recommenders     a browser should be opened thFor usability reasons  this appender needs a little UI th The appender could be placed in  2  and make use of the Java 7 Desktop class  3  1   2   3   ,2
199377, formatting  Make xml beautifier usable from outside, It would be really very helpful to use the xml beautifier from another application or an other bundle in eclipse As far as i have seen If possible  please make the xml beautifier usable with as less dependencies as possible ,2
208185, terminal   serial  terminal can hang the UI when text is entered while the backend side is not reading characters,   connect to a pseudo terminal  the other side is not yet connected   type some characters  gt  UI blocks ,2
496611,Improve validation and error reporting for non executable Processes, process 1 bpmnI think there is a problem with the validation of BPMN models Attached I give an example of a very simple BPMN model containing a intermediate message catch event  process 1 bpmn   The BPMN2 modeller plugin indicates an error  Intermediate Catch Event 1 has no Message definition I don t think thI saw th0 Validation When I disable this all validations are disabled  This is great    But now also useful validations like a wrong sequence flow from a catch event are ignored  This validation is very useful in general because this indicates a general  runtime independent  model error   see example  process 2 bpmn  Can we split the validation rules in runtime specific and runtime independent rule  ,2
354822,IdentityMapManager does not find cached  inherited objects if querying for the object s interface alias, Build Identifier  2 2 0The fix for  does not work properly if interface aliases are configured for the persistent classes  Consider e g  the classes A and B with  B extends A  and their interface aliases IA and IB If I make a query for IB and an instance of B is found  the following expression in IdentityMapManager evaluates to false boolean readSubclassesOrNoInheritance     descriptor hasInheritance     descriptor getInheritancePolicy   shouldReadSubclasses    descriptor is here the class descriptor of B  with   hasInheritance   is true  since an InheritancePolicy instance is available  shouldReadSubclasses   is false  since there are no further subclasses of BLater in the same method  readSubclassesOrNoInheritance is used like this if   object getClass      theClass      readSubclassesOrNoInheritance  amp  amp  theClass isInstance object      We now have the issue thclass  while theClassis IB class  Since readSubclassesOrNoInheritance is false  the isInstance check IB class isInstance B class  would have evaluated to true  does not cover theinterface alias  as it did before this fix was applied Reproducible  AlwaysSteps to Reproduce 1  Create two inherited entities A and B  where B extends A  Let B have an interface alias IB 2  Create an instance of B with some data  so th3  Run a query for IB with an expression matching the data of the newly created B instance  The expected behaviour is th ,2
347987,primaryKeyUpdateDisallowedException on Embedded Class if attributeOverride name is equal to owner pk name, Build Identifier  When the name of the AttributeOverride name id  for an Embedded configuration is eqal to the Id of the Owner a primaryKeyUpdateDisallowedException is thrown if the field of the embedded object is updated even though this should be possible If the field of the Embedded object is renamed to sg else  e g  name someId  all works as expected Reproducible  AlwaysSteps to Reproduce 1  create an entity with an id 2  create an embeddable with a field called the same as the owner entity id field 3  create an embedded field in the entity with an attributeOverrid for the field of the embedded entity 4  In a UnitTest create and save an instance of entity with an instance of the embedded entity5  change the field of the embedded entity to sg else6  update the owner entity with the change in the embedded entity ,2
394899,Collection of embeddable inside embeddable object   Missing mapping for field   lt entity id field gt   , Full stack trace of the exceptionHaving an  ElementCollection mapping for a collection of complex typeinside an  Embeddable object throws an exception when persisting Here is my exact use case     Entity   public class A            Id  GeneratedValue      public int id           Embedded      public E1 embedded            Embeddable   public class E1            ElementCollection      public Collection lt E2 gt  embeddedCollection            Embeddable   public class E2           Basic      public String embeddedField    embeddedValue      When trying to persist an entity A whose E1 contains one or more E2 a DescriptorException is thrown   Missing mapping for field  A ID      A a   new A      a embedded   new E1      a embedded embeddedCollection   new ArrayList lt E2 gt       a embedded embeddedCollection add new E2       em persist a  Full stack trace attached Doesn t happen if    the element collection is inside entity A   E2 is replaced by a built in type  String  Integer       the element collection is replaced by an unidirectional one to many   to some other entity ,2
375866,The CPP package content description  feature list  is outdated since Juno, CPP package contents as per About in Juno M6 Build ID  Juno M6Looking org downloads packages eclipse ide cc developers junom6the package contents is outdated   Linuxtools stuff all missing  Marketplace client not explicitly highlighted    epp common feature  is misleading The correct contents as per  help  gt  About  in CPP Juno M6 is in attached GIF  ,2
469150, Unit Test Failure  org eclipse modisco kdm uml2converter tests KdmToUml2WithTracesConverterTest testValidationOfConvertedSourceUmlModel, The test org eclipse modisco kdm uml2converter tests KdmToUml2WithTracesConverterTest testValidationOfConvertedSourceUmlModel fails with different error message depending of the target platform Target platform   release train  Mars  org eclipse emf ecore resource impl ResourceSetImpl 1DiagnosticWrappedException  org eclipse emf ecore xmi UnresolvedReferenceException  Unresolved reference   2 WModel    bundleresource   666 fwk702282179 org eclipse modisco kdm uml2converter internal resources metamodels mmw traceability ecore  6  81 java 319 java 278 java 406 java 209 java 126 java 184 java 173 java 115 java 75 java 229 java 254 Target platform   Heliosjava lang IllegalArgumentException  The feature  Model  is not a valid featurejava 739 java 557 java 782 java 758 java 1139 java 1228 java 737 java 516 java 808 java 737 java 119 java 1205 java 522 java 395 java 181 java 180 java 1494 java 1282 java 255 java 270 java 397 java 209 java 126 java 184 java 173 java 115 java 75 java 229 java 254  ,2
224911, api  provide method for getting new task wizard,  ,2
279842,consider calling updateTaskFromTaskData   in TasksUiInternal createAndOpenNewTask     ,  ,2
408614,expanding the resources tree node in the working set editor causes an exception, To reproduce   open the working set editor  and edit a working set  expand the  Resources  node in the tree  observe the error log entry and the resources node does not expand   Error Details   Date  Tue May 21 10 45 09 PDT 2013Message  Unhandled event loop exceptionSeverity  ErrorProduct  Eclipse Platform 4 2 2 v201302041200  org eclipse platform ide Plugin  org eclipse uiSession Data eclipse buildId M20130204 1200java version 1 7 0 17java vendor Oracle CorporationBootLoader constants  OS macosx  ARCH x86 64  WS cocoa  NL en USException Stack Trace java lang IllegalArgumentException  Comparison method violates its general contract java 868 java 485 java 426 java 223 java 173 java 659 java 187 java 643 java 820 java 70 java 797 java 644 java 768 java 1500 java 952 java 1511 java 132 java 84 java 4136 java 1458 java 1481 java 1466 java 1025 java 1248 java 5762 objc msgSendSuper Native Method java 221 java 1093 java 2052 java 1085 java 2538 java 2007 java 5495 objc msgSendSuper Native Method java 221 java 2102 java 2299 java 5559 objc msgSendSuper Native Method java 5004 java 5153 objc msgSend Native Method java 128 java 3618 java 825 java 801 java 157 java 365 java 192 java 84 java 4136 java 1458 java 1481 java 1466 java 1271 java 3982 java 3621 java 1053 java 332 java 942 java 86 java 588 java 332 java 543 java 149 java 124 java 196 java 110 java 79 java 353 java 180 invoke0 Native Method java 57 java 43 java 601 java 629 java 584 java 1438 java 1414 Workaround for comparator violation   set system property java util Arrays useLegacyMergeSort true  use a 1 6 JRE message  Comparison method violates its general contract this  org eclipse mylyn internal tasks ui workingsets TaskWorkingSetPage CustomSortercomparator  java text RuleBasedCollator ,2
525502,Enable debugger inside electron,  ,2
329657,An active build blocks user task  like save , Build Identifier  M20100909 0800If a build or validation  especially Spring XML JSP  runs  Any user action issued  like save file will be blocked till the build finished  Then after the save the build validation starts again  Which is a waste of time and bad UX I typically using save after editing each file in case of an edit requires modification in multiple files Reproducible  AlwaysSteps to Reproduce 1  Have a large project  which takes sufficiently long time to build 2  While the build is in progress try to edit and save a file  ,2
88314,VE needs to use the Compiler setting for the IDE level, VE version  1 0 2Eclipse Version 3 01  eclipse buildId M200409161125 JDK version  1 4 2 07Get an exception when attempting to add event handler from design view Suspect thVerified thjava lang UnsupportedClassVersionError org eclipse ve internal java codegen jjet util AnonymousEventTemplate Unsupported major minor version 49 0 defineClass0 Native Method java 539 java 123 java 251 java 55 java 194 doPrivileged Native Method java 187 java 289 java 575 java 235 atorg eclipse ve internal java vce templates JavaObjectEmiter getExistingClass JavaObjectEmiter java 246 atorg eclipse ve internal java vce templates JavaObjectEmiter generateObjectFromExisting JavaObjectEmiter java 392 atorg eclipse ve internal java vce templates TemplateObjectEmitter getObject TemplateObjectEmitter java 217 atorg eclipse ve internal java vce templates TemplateObjectFactory getClassInstance TemplateObjectFactory java 113 atorg eclipse ve internal java codegen util AnonymousEventSrcGenerator getEventTemplate AnonymousEventSrcGenerator java 77 atorg eclipse ve internal java codegen util AnonymousEventSrcGenerator generateEvent AnonymousEventSrcGenerator java 108 atorg eclipse ve internal java codegen java EventDecoderHelper generate EventDecoderHelper java 383 atorg eclipse ve internal java codegen java AbstractEventDecoder generate AbstractEventDecoder java 292 atorg eclipse ve internal java codegen model CodeEventRef generateSource CodeEventRef java 182 atorg eclipse ve internal java codegen model EventRefFactory createFromJVEModel EventRefFactory java 115 atorg eclipse ve internal java codegen java BeanDecoderAdapter addEventElement BeanDecoderAdapter java 335 atorg eclipse ve internal java codegen java BeanDecoderAdapter notifyChanged BeanDecoderAdapter java 443 atorg eclipse emf common notify impl BasicNotifierImpl eNotify BasicNotifierImpl java 225 atorg eclipse emf common notify impl NotificationChainImpl dispatch NotificationChainImpl java 113 atorg eclipse emf common notify impl NotificationChainImpl dispatch NotificationChainImpl java 101 atorg eclipse emf common notify impl NotifyingListImpl addUnique NotifyingListImpl java 288 java 599 atorg eclipse ve internal java core JavaBeanEventUtilities addCallback JavaBeanEventUtilities java 308 atorg eclipse ve internal java core JavaBeanEventUtilities addCallback JavaBeanEventUtilities java 290 atorg eclipse ve internal java core JavaBeanEventUtilities addCallback JavaBeanEventUtilities java 265 atorg eclipse ve internal java core JavaBeanEventsObjectActionDelegate 5 run JavaBeanEventsObjectActionDelegate java 180 atorg eclipse ve internal java codegen editorpart JavaVisualEditorModelChangeController run JavaVisualEditorModelChangeController java 93 atorg eclipse ve internal java core JavaBeanEventsObjectActionDelegate 4 widgetSelected JavaBeanEventsObjectActionDelegate java 177 java 89 java 82 java 796 java 2772 java 2431 java 1377 java 1348 java 254 java 141 java 96 atorg eclipse core internal runtime PlatformActivator 1 run PlatformActivator java 335 java 273 java 129 invoke0 Native Method java 39 atsun reflect DelegatingMethodAccessorImpl invoke DelegatingMethodAccessorImpl java 25 java 324 java 185 java 704 java 688  ,2
507301,Error org eclipse equinox p2 core  Adding a profile with duplicate id  during install, If you try to install in the same location  you ll get a weird error Step by step Run oopmh once to install Eclipse Neon in C  tools eclipse Run it again and try to install into C  tools eclipse java latest released   i e  into the folder which Oomph just created  the one which contains a folder eclipse   You ll get an error from P2 saying  Adding a profile with duplicate id There are two problems here 1  I couldn t find a way make Oomph forget about C  tools eclipse   for example  when I delete or rename the previous install  2  The error message is confusing  Please check whether someone tries to install inside of an existing Eclipse installation and reject that  ,2
474269,NullPointerException in DebugContextManager addDebugContextListener  189 , The following incident was reported via the automated error reporting     code                    0    plugin                  org eclipse ui 3 107 0 v20150507 1945    message                 Unhandled event loop exception    fingerprint             f6830291    exception class         org eclipse swt SWTException    exception message       Failed to execute runnable  java lang NullPointerException     number of children      0        org eclipse swt SWTException  Failed to execute runnable  java lang NullPointerException     java 4491     java 4406     java 138     java 4155     java 3772     java 1127     java 337     java 1018     java 156     java 654     java 337     java 598     java 150     java 139     java 196     java 134     java 104     java 380     java 235     invoke0 null  2     invoke null  1     invoke null  1     invoke null  1     java 669     java 608     java 1515     java 1488 caused by  java lang NullPointerException  null    java 189     java 69     java 68     java 77     java 35     java 135     java 4155     java 3772     java 1127     java 337     java 1018     java 156     java 654     java 337     java 598     java 150     java 139     java 196     java 134     java 104     java 380     java 235     invoke0 null  2     invoke null  1     invoke null  1     invoke null  1     java 669     java 608     java 1515     java 1488      General Information     reported by           anonymous id      6f797541 1c34 4741 8e63 2989da870a88    eclipse build id  4 5 0 I20150603 2000    eclipse product   org eclipse epp package jee product    operating system  Windows8 6 3 0  x86 64    win32    jre version       1 8 0 45 b15The following plug ins were present on the execution stack         1  org eclipse core databinding observable 1 5 0 v20150422 0725    2  org eclipse core databinding 1 5 0 v20150422 0725    3  org eclipse core runtime 3 11 0 v20150405 1723    4  org eclipse debug ui 3 11 0 v20150514 0917    5  org eclipse e4 ui workbench 1 3 0 v20150531 1948    6  org eclipse e4 ui workbench swt 0 13 0 v20150504 0621    7  org eclipse equinox app 1 3 300 v20150423 1356    8  org eclipse equinox launcher 1 3 100 v20150511 1540    9  org eclipse jdt debug ui 3 7 0 v20150505 1916    10  org eclipse jdt debug 3 9 0 v20150528 1838    11  org eclipse jdt 3 11 0 v20150603 2000    12  org eclipse swt 3 104 0 v20150528 0211    13  org eclipse ui 3 107 0 v20150507 1945    14  org eclipse ui ide application 1 1 0 v20150422 0725    15  org eclipse ui ide 3 11 0 v20150510 1749Please note that   Messages  stacktraces  and nested status objects may be shortened   Bug fields like status  resolution  and whiteboard are sent  back to reporters   The list of present bundles and their respective versions was  calculated by package naming heuristics  This may or may not reflect reality Other Resources   Report      Manual  Thank you for your assistance Your friendly error reports inbox  ,3
204234, javadoc  AccessRestriction compiler error in JavaDoc, Build ID  3 3Steps To Reproduce 1  Create a new bundle project  target Equinox  create Activator  The bundle manifest includes imports from org osgi framework2  Add for Activator a javadoc for class  Add within JavaDoc a    link org osgi service http HttpService   reference  Everything is fine3  Now add to bundle an import for  org osgi service log  Now I will get an AccessRestriction compiler error for org osgi service http HttpService More information I think wrong JavaDoc entries  even when classes are not visible should be acceptable  And if there are no additional imports  it seems to work as I would expect  ,3
475227,Data race on org eclipse jdt internal core JavaModelManager PerProjectInfo preferences, Here is the race report given by a dynamic race detector Data race on field org eclipse jdt internal core JavaModelManager PerProjectInfo preferences         Concurrent write in thread T1  locks held   Monitor 40866d39        gt   java 1492         java 1657         java 1747         java 118         java 783         java 3097         java 3059         java 3112         java 166         java 54         java 86         java 176         java 141         java 122         java 142         java 125         java 129         java 252         java 247         java 252         java 247         java 692         java 319         java 197         java 35         java 135           locked Monitor 40866d39 java 131          java 3794         java 3433         java 1127         java 336         java 1018         java 157         java 654         java 336         java 598         java 150         java 139         java 140         java 62         java 212         java 196         java 134         java 104         java 388         java 243         java 669         java 608         java 1515         java 1488         java 34     T1 is the main thread    Concurrent write in thread T30  locks held           gt   java 1492         java 1657         java 1041         java 979         java 898         java 862         java 3208         java 46         java 32         java 260         java 83         java 42         java 367         java 349         java 367         java 327         java 55     T30 is created by T29        java 148    Two threads are writing to this field concurrently  ,3
464561, DOM AST  IAE in ASTNode setSourceRange  2845 , The following incident was reported via the automated error reporting     code                    4    plugin                  org eclipse jdt core 3 10 0 v20140604 1726    message                 source file contents removed    fingerprint             2fe53a85    exception class         java lang IllegalArgumentException    exception message            number of children      0        java lang IllegalArgumentException  null    java 2845     java 1571     java 258     java 3187     java 2894     java 2726     java 635     java 195     java 2958     java 1374     java 292     java 1209     java 809     java 544     java 42     java 537     java 480     java 128     java 170     java 155     java 54      General Information     reported by       David Seide    anonymous id      a648ccd8 dc5d 41ef 8480 42ef10c15824    eclipse build id  4 4 0 I20140606 1215    eclipse product   org eclipse sdk ide    operating system  Windows8 6 3 0  x86 64    win32    jre version       1 8 0 25 b18The following plug ins were present on the execution stack         1  org eclipse core jobs 3 6 0 v20140424 0053    2  org eclipse core runtime 3 10 0 v20140318 2214    3  org eclipse jdt core 3 10 0 v20140604 1726    4  org eclipse jdt 3 10 0 v20140606 1215    5  org eclipse jdt ui 3 10 0 v20140604 1403Please note that   Messages  stacktraces  and nested status objects may be shortened   Bug fields like status  resolution  and whiteboard are sent  back to reporters   The list of present bundles and their respective versions was  calculated by package naming heuristics  This may or may not reflect reality Other Resources   Report      Manual  Thank you for your assistance Your friendly error reports inbox  ,3
209634, DOM  Equal but not identical method bindings with inferred type arguments, HEADimport java util Collections import java util List public class Try  List lt String gt  get boolean b   if  b return Collections  lt String gt emptyList   elsereturn Collections emptyList     The two IMethodBindings for emptyList   are isEqualTo     each other and their keys are the same  but the bindings are not identical  ,3
216277,Factorize JavaCore CompilerOptions constants or else provide a safeguard against potential mismatches, Source based  v 833 When I released the first patch for   it contained a typo for the literal value of JavaCore COMPILER PB UNUSED DECLARED THROWN EXCEPTION INCLUDE UNCHECKED EXCEPTIONS  introducing a mismatch with CompilerOptions OPTION ReportUnusedDeclaredThrownException  and consequently an errant behavior when looked The simplest thing to do would be to initialize one of the constants series from the other s values  Since we do not want compiler to depend upon model  it would have to be the JavaCore constants initialized using the CompilerOptions ones  One issue with this is th ,3
