480931,Consider running jdeps as part of build to uncover use of internal APIs, jdeps is a utility provided with JDK  Java 8 and 9  I believe  thThere are a handful of plug ins on Maven central  ,3
525411, rename  input field should be filled with symbol to rename, When rename is done  the input field is filled with  newName  although it should be filled with symbol which must be renamed A simple solution to get the symbol name  but not perfect  is to find the word from the offset The textDocumentService hover cannot be used for th ,3
133554, api request  AddComponentToEnterpriseApplicationDataModelProvider, In our code we useorg eclipse jst j2ee application internal operations AddComponentToEnterpriseApplicationDataModelProvider org eclipse jst j2ee application internal operations IAddComponentToEnterpriseApplicationDataModelPropertiesto programatically add components to EAR file I think it is a rather common operation and therefore it should be made external ,3
160395, Unsupported color depth  while doing CVS compare of large file, Comparing a large java file with the cvs HEAD versionEvery time a compare pane opens and shows  Unable to create this part due to an internal error  Reason for the failure  Unsupported color depth I am on a two display setup  I upgraded to 3 2 1 last week and have been using it for development and CVS diffs freqently  including diffs of this file a couple hours previously Version  3 2 1Build id  M20060921 0945Web Tools Project distribution  updated this week via Software Updates menu item Java 1 5 org eclipse swt SWTException  Unsupported color depthjava 3374 java 3297 java 3268 java 1232 java 917 java 1000 java 368 java 371 java 497 java 425 java 1124 java 553 java 476 java 265 java 894 java 67 java 929 java 904 java 1111 java 2382 java 1725 java 668 java 565 java 250 java 134 java 300 java 546 java 67 java 541 java 422 java 117 java 187 java 596 java 372 java 566 java 214 java 2595 java 2528 java 2520 java 2505 java 67 java 2500 java 2477 java 447 java 134 java 120 java 151 java 198 java 152 java 28 java 3763 java 192 java 50 java 119 java 70 java 244 java 539 java 488 java 400 java 66 java 928 java 3348 java 2968 java 1914 java 1878 java 419 java 149 java 95 java 78 java 92 java 68 java 400 java 177 invoke0 Native Method invoke Unknown Source invoke Unknown Source invoke Unknown Source java 336 java 280 java 977 java 952  ,3
286642, CSS View  Can t open style when it s in html file  lt style gt  tag, When style is defined in  lt style gt  tag  pressing Open CSS file from context menu throws following exception no protocol  java 567 java 464 java 413 java 767 java 764 java 526 java 228 java 84 java 1002 java 3880 java 3473 java 2405 java 2369 java 2221 java 500 java 332 java 493 java 149 java 113 java 194 java 110 java 79 java 368 java 179 invoke0 Native Method java 39 java 25 java 585 java 559 java 514 java 1311 java 1287  ,3
506045,Can t create an Arduino project  CDT Arduino plugin,    Configuration Details   Product  Eclipse 4 6 1 20160912 1200  org eclipse epp package cpp product Installed Features  org eclipse platform 4 6 1 v20160907 1200Can t tell if this is a bug or a problem in Eclipse installation environment   Each time an attempt is made to create a  new arduino project  when Arduino C   sketch is selected in the second dialog  a loop exception error is logged as follows eclipse buildId 4 6 1 M20160907 1200java version 1 8 0 101java vendor Oracle CorporationBootLoader constants  OS win32  ARCH x86 64  WS win32  NL en USFramework arguments    product org eclipse epp package cpp productCommand line arguments    os win32  ws win32  arch x86 64  product org eclipse epp package cpp productorg eclipse uiErrorSun Oct 16 13 44 43 PDT 2016Unhandled event loop exceptionjava lang ClassCastException  org eclipse cdt arduino ui internal project NewArduinoProjectWizard cannot be cast to org eclipse tools templates ui NewWizardjava 112 java 116 java 1308 java 293 java 84 java 249 java 84 java 4410 java 1079 java 4228 java 3816 java 818 java 794 java 115 java 473 java 565 java 397 java 84 java 4410 java 1079 java 4228 java 3816 java 1121 java 336 java 1022 java 150 java 687 java 336 java 604 java 148 java 138 java 196 java 134 java 104 java 388 java 243 invoke0 Native Method invoke Unknown Source invoke Unknown Source invoke Unknown Source java 673 java 610 java 1519  ,3
277100, BIDI3 5 Web Viewer  is not mirrored when IDE orientation is set to RTL, Build ID  I20090401 1325Steps To Reproduce Platform used   Red Hat Enterprise Linux 5Prerequisite    Switch the Locale of your machine to Arabic  Open eclipse in  RTL  mode  open a terminal  write these 3 commands  exportLANG ar EG UTF8     export LC ALL ar EG UTF8     eclipse  nl ar   1 Open  Report Design  perspective 2 Create a new Report project3 Create  a new RTL report 4 Use the palette to drag and  drop some components5 Save the report6 From BIRT toolbar select  View Report    gt   View Report in Web Viewer Expected Result Web viewer mirrored  having RTL orintation  like the IDE orintation which is RTL in this test case  Actual Result Web viewer is not mirrored  Please refer to the screen shot in the attachment  More information Please refer to  ,3
203537,Provide a resource basename variable for make targets, Build ID  I20070625 1500Steps To Reproduce It would be very useful if the basename  filename without extension  of a resource could be provided as a variable in Project   gt  Properties   gt  C C   Build   gt  Behaviour   gt  Build on resource saveIn the case where a project uses Makefiles th cmake  and don t provide targets with the resource name  this would allow for more flexible creation of targets   resource basename  o with test cpp would become test oThanks FelixMore information  ,3
285924,Source Location Link Folder Exclusion Patterns broken, screenshotI m not certain about any of the attributes above   I used the eclipse cpp galileo win32 zip package  and I  think  this is a CDT problem eclipse IDE build id 20090619 0625CDT version 6 0 0 200906161748I ve linked a directory as follows  go to project properties  C C   General  Paths and Symbols  select the Source Location tab  click  Link Folder  name it   link test   check the  Link to folder in the file system  box  browse to a directory  and hit OK   C  test  as of right now  there are no filters in place and all the files show up  go back to the same screen  and edit the filter under your link   I d give specific directions here  but I don t think I need to  anything you do here won t work   You can use either the  Add  or  Add Multiple  button   You can specify files or use wildcards   One interesting behavior is thThe linked directory is neither a parent nor a child of the eclipse workspace or project directories    Configuration Details   Product  Eclipse 1 2 0 20090611 0950  org eclipse epp package cpp product Installed Features  org eclipse platform 3 5 0 v20090611a 9gEeG1HFtQcmRThO4O3aR fqSMvJR2sJ ,3
331820,Add a mercurial provider, Build Identifier  Request to add a mercurial providerReproducible  Always ,3
538260,Provide an Apogy Product for the Examples, The Project should provide an Apogy Product for the Examples  This would provide   A kick way for user to start an Apogy session to experiment with the Examples   Act as an example to follow for Apogy developers to create their customized version of Apogy  ,3
378807,Closing internal Mozilla Browser throws XPCOMException on Linux 64 bit, Build Identifier  M20120208 0800Closing internal Mozilla browser on 64bit Linux causes XPCOMException  ENTRY org eclipse ui 4 0 2012 05 06 23 48 14 583 MESSAGE The function  removeWebBrowserListener  returned an error condition  0x80004005  STACK 0org mozilla xpcom XPCOMException  The function  removeWebBrowserListener  returned an error condition  0x80004005 callXPCOMMethod Native Method java 143 removeWebBrowserListener Unknown Source java 199 java 646 java 123 java 84 java 1258 java 1282 java 1267 java 1061 java 950 java 84 java 1258 java 1282 java 1263 java 1080 java 3488 java 1294 java 1083 java 3488 java 1294 java 1083 java 3488 java 1294 java 1083 java 3488 java 462 java 180 java 681 java 1797 java 1501 java 1485 java 1459 java 1262 java 1846 java 894 java 1729 java 730 java 715 java 867 java 70 java 865 java 109 java 1114 java 42 java 1111 java 1040 java 1284 java 70 java 1282 java 2292 java 31 java 293 java 476 java 508 java 169 java 241 java 829 java 815 java 805 java 84 java 1258 java 3588 java 3209 java 2701 java 2665 java 2499 java 679 java 332 java 668 java 149 java 123 java 196 java 110 java 79 java 344 java 179 invoke0 Native Method invoke Unknown Source invoke Unknown Source invoke Unknown Source java 622 java 577 java 1410 java 1386 Reproducible  AlwaysSteps to Reproduce 1  On Linux 64bit install ATF  amp  XULRunner  1 9 2  into Eclipse 3 7 2   2  Open Mozilla web browser  i e  create html file  then select  Open with    gt  Browser  3  Close browser 4  Take a look into  log  ,3
368504,hide drill through auto generated hyperlink information on the status bar, Build Identifier  Vesrion 3 7 1I bulided a Drill through BIRT report When I viewed report with frameset servlet in IE8  on mouseover the drill through hyperlink  the detail information will show on the status Such as         Think about security  I want hide some information  for example  ips  port  report template names and so on It seems thMore details please see In my opinion  if the  drill through  supply an option to set hyperlink sdisplay detail would be better    Reproducible  AlwaysSteps to Reproduce 1 build a Drill through BIRT report2 view report with frameset servlet3 mouseover over the hyperlink  and see information on the IE status bar ,3
307264, API  cdt make core  allow to extend GCCSpecsRunSIProvider,  ,3
455014,Ajc parameter   xmlConfigured  is undocumented,  ,3
333199,Crashing error when displaying large chart, Hi all First thanks for all of your hard work on BIRT  It s really improved in terms of how smoothly everything works  lot s of subtle ways  I have a crashing bug in Cocoa thHere s all of the stack trace  etc   from Mac log Process          eclipse  8171 Path              Developer eclipseM4 Eclipse app Contents MacOS eclipseIdentifier       org eclipse eclipseVersion          3 6  3 6 Code Type        X86 64  Native Parent Process        1 Date Time        2010 12 24 15 23 42 554  0800OS Version       Mac OS X 10 6 5  10H574 Report Version   6Interval Since Last Report           248276 secCrashes Since Last Report            1Per App Interval Since Last Report   406966 secPer App Crashes Since Last Report    1Anonymous UUID                       4C6C39A9 EF2D 48B9 8576 64418C83B417Exception Type   EXC BAD ACCESS  SIGSEGV Exception Codes  KERN INVALID ADDRESS at 0x0000000000000000Crashed Thread   0  Dispatch queue  com apple main threadApplication Specific Information Java information  Exception type  Bus Error  0xa  at pc 7fff80f9f298 Java VM  Java HotSpot TM  64 Bit Server VM  17 1 b03 307 mixed mode macosx amd64 Current thread  115000000    JavaThread  main    thread in native  id 1893055648  stack 7fff5f400000 7fff5fc00000  Stack   7fff5f400000 7fff5fc00000 Java frames   J compiled Java code  j interpreted  Vv VM code j  org eclipse swt internal cocoa OS objc msgSend JJJLorg eclipse swt internal cocoa NSPoint Lorg eclipse swt internal cocoa NSSize JJJZ J 0j  org eclipse swt internal cocoa NSView dragImage Lorg eclipse swt internal cocoa NSImage Lorg eclipse swt internal cocoa NSPoint Lorg eclipse swt internal cocoa NSSize Lorg eclipse swt internal cocoa NSEvent Lorg eclipse swt internal cocoa NSPasteboard Lorg eclipse swt internal cocoa id Z V 65j  org eclipse swt dnd DragSource drag Lorg eclipse swt widgets Event  V 310j  org eclipse swt dnd DragSource 1 handleEvent Lorg eclipse swt widgets Event  V 81J  org eclipse swt widgets EventTable sendEvent Lorg eclipse swt widgets Event  Vj  org eclipse swt widgets Display sendEvent Lorg eclipse swt widgets EventTable Lorg eclipse swt widgets Event  V 24j  org eclipse swt widgets Widget sendEvent Lorg eclipse swt widgets Event  V 9J  org eclipse swt widgets Display runDeferredEvents  Zj  org eclipse swt widgets Display readAndDispatch  Z 125j  org eclipse ui internal Workbench runEventLoop Lorg eclipse jface window Window IExceptionHandler Lorg eclipse swt widgets Display  V 9j  org eclipse ui internal Workbench runUI  I 555j  org eclipse ui internal Workbench access 4 Lorg eclipse ui internal Workbench  I 1j  org eclipse ui internal Workbench 7 run  V 55j  org eclipse core databinding observable Realm runWithDefault Lorg eclipse core databinding observable Realm Ljava lang Runnable  V 12j  org eclipse ui internal Workbench createAndRunWorkbench Lorg eclipse swt widgets Display Lorg eclipse ui application WorkbenchAdvisor  I 18j  org eclipse ui PlatformUI createAndRunWorkbench Lorg eclipse swt widgets Display Lorg eclipse ui application WorkbenchAdvisor  I 2j  org eclipse ui internal ide application IDEApplication start Lorg eclipse equinox app IApplicationContext  Ljava lang Object  99j  org eclipse equinox internal app EclipseAppHandle run Ljava lang Object  Ljava lang Object  135j  org eclipse core runtime internal adaptor EclipseAppLauncher runApplication Ljava lang Object  Ljava lang Object  103j  org eclipse core runtime internal adaptor EclipseAppLauncher start Ljava lang Object  Ljava lang Object  29j  org eclipse core runtime adaptor EclipseStarter run Ljava lang Object  Ljava lang Object  149j  org eclipse core runtime adaptor EclipseStarter run  Ljava lang String Ljava lang Runnable  Ljava lang Object  183v   StubRoutines  call stubj  sun reflect NativeMethodAccessorImpl invoke0 Ljava lang reflect Method Ljava lang Object  Ljava lang Object  Ljava lang Object  0j  sun reflect NativeMethodAccessorImpl invoke Ljava lang Object  Ljava lang Object  Ljava lang Object  87j  sun reflect DelegatingMethodAccessorImpl invoke Ljava lang Object  Ljava lang Object  Ljava lang Object  6j  java lang reflect Method invoke Ljava lang Object  Ljava lang Object  Ljava lang Object  161j  org eclipse equinox launcher Main invokeFramework  Ljava lang String  Ljava net URL  V 211j  org eclipse equinox launcher Main basicRun  Ljava lang String  V 126j  org eclipse equinox launcher Main run  Ljava lang String  I 4v   StubRoutines  call stub ,3
359103,Provide easier access to JavaScript functions from Chart scripts, Build Identifier  20110615 0604global JavaScripts in resource script files have to be referenced via syntax similar to icsc getExternalContext   getScriptable   evaluate  getMyValue    rather than just getMyValue   Reproducible  Always ,3
143709,Compartment figure customized by gmf graph should be placed inside compartment instead of beeing compartment s parent, Actually if gmfgraph compartment points to some figure  say ellipse  in the generated code we will have following figures hierarchy  Ellipse   ResizableCompartmentFigure         content pane   child figureInstead consider the way to place generated figure inside the ResizableCompartmentFigure  that is  providing following hierarchy of figures  ResizableCompartmentFigure         content pane    Ellipse   child figure ,3
498360,Provide a tool that performs update site promotions, This tool  initially discussed on cbi dev  1   should be  available on HIPP instances   able to promote update sites from a Hudson job s workspace or archive area to download eclipse org or archive eclipse org   while doing so  insert an appropriate p2 mirrorURL property  2 The simplest solution would be little more than a shell script  but other implementations  Maven or Hudson plugins  are also conceivable  1   lt  gt  2   lt  ,3
185793,DBGP Support incomplete in JavaScript debugger, Build ID  M20070212 1330Steps To Reproduce 1  Set DBGPDebugger host and port to point to third party IDE like Komodo or tsWebEditor2  Run project3  Debugger tries to connect to IDE  but doesn t quite work More information The DBGP support is incomplete I have made some patches to make it partially work but some work still needs to be done  ,3
449549,launch failed binary not found,  ,3
452599,Excel Emitter doesn t take timezone in consideration when exporting data in table or grid, When setting timezone in IRenderTask and generating report in excel format different part of excel behaves in different ways e g Footer is generated with timestamp taking timezone in consideration but the data returned from a DB query and rendered in grid table etc is not showing the column data w r t timezone  ,3
470094,Nullpointer exception when selecting persistence xml, My current properties view displays tabs and when I select the META INF persistence xml I have the following error java lang NullPointerExceptionjava 158 java 65 java 199 java 107 java 99 java 65 java 850 java 754 java 556 java 335 java 237 java 122 java 112 java 80 java 167 java 42 java 164 java 161 java 273 java 56 java 270 java 114 java 341 java 356 java 36 java 132 java 877 java 42 java 50 java 173 java 874 java 1243 java 455 java 1269 java 265 java 259 java 440 java 35 java 135 java 4024 java 3700 java 1127 java 337 java 1018 java 156 java 654 java 337 java 598 java 150 java 139 java 196 java 134 java 104 java 380 java 235 invoke0 Native Method java 62 java 43 java 497 java 669 java 608 java 1515  ,3
327556,weaver should provide information about added types, When using the weaver for load time aspect weaving within an OSGi environment  we need to keep track of references to types thThe easiest way for the OSGi load time weaving implementation would be if the weaver would provide us with the list of added type references right after a class is woven  ,3
248952,CExternalSettingProvider and Managed Build UI problems inconsistencies, Build ID  5 0 1Steps To Reproduce Using the CExternalSettingProvider I am returning an Include path and library path based on some of the configuration s settings However I have noticed a few inconsistencies 1  Creating CLibraryPathEntry and CIncludePathEntry with ICSettingEntry BUILTIN   ICSettingEntry READONLY  The project properties UI doesn t show them as built in or readonly    In C C   General  gt  Includes   Library Paths      The paths appear when  Show built in values  is unchecked    I am able to delete the paths from this page  2  Pressing  Restore Defaults  in C C   Build  gt  Settings makes the externally provided include directories and library paths disappear    Pressing  Restore Defaults  in the C C   General  gt  Paths and Symbols Tab makes them reappear again   More information  ,3
304063,Using headless Buckminster to create p2 reporsitory with multiple versions, Build Identifier  org eclipse buckminster core 1 1 350 r10920 jarI would like it to be possible to create p2 repositories using headless Buckminster containing both old and new versions of plugins and features It should have a similar effect as using the Eclipse IDE in the following way In the Eclipse IDE from the popup of a feature I can selectExport      gt  Plug in Development   gt  Deployable features Then I can select the features  and plug ins  I want to deploy and a destination directory The I get a work p2 repository  than I can use as an update site If I go ahead and change the version on some of the features selected earlierand possibly push the version number to the contained plug ins I can repeat the above procedure  use the same destination directoryand I will now have a p2 repository containing both the old and the new versions See also  amp Reproducible  Always ,3
343260,NPE in SelectionEngine selectFrom     when hovering inheritDoc in Javadoc, HEAD  have this class public class Try        public void m Object o     class Sub extends Try                  inheritDoc            public void m Object o       put caret on commented Try m Object   point the mouse at inheritDoc  press and hold Ctrl  quickly press and release Shift and C  While still holding Ctrl  move the mouse a bit   gt  NPE  ENTRY org eclipse ui 4 0 2011 04 19 14 37 20 604 MESSAGE Unhandled event loop exception STACK 0java lang NullPointerExceptionjava 1127 java 944 java 162 java 377 java 371 java 84 java 80 java 286 java 258 java 462 java 211 java 89 java 1062 java 4163 java 3752 java 2696 java 2660 java 2494 java 674 java 332 java 667 java 149 java 123 java 196 java 110 java 79 java 344 java 179 invoke0 Native Method java 39 java 25 java 597 java 622 java 577 java 1410 java 1386  ,3
342324,Caching of repository meta data,  ,3
323650,Cannot edit view a sqlite3 table using the SQLite JDBC Driver, Build Identifier  20100218 1602I cannot view edit any tables when using the SQLite JDBC Driver  The error message says   Cannot edit table  An unknown or unsupported data type encountered for column type  When I expand the  Column  Node of a table  the data types of the columns are not shown  However  if I disconnect and reconnect to the database  the datatypes of some columns are shown correctly  After interaction with the GUI they are gone again Reproducible  AlwaysSteps to Reproduce 1  Open the Database Development Perspective2  Connect to a sqlite database with the  SQLite JDBC Driver 3  Go to  database name   gt  Schemas   gt  Default   gt  Tables   gt  table name   gt RMB  gt  Data   gt  Edit 4  The error should appear ,3
365844,CR  Provide Save As command for workflows, Build Identifier  0 5 0 v20110623 1252 H77 CI  BPEL visual designer It would be nice to be able to save an existing workflow under a new name Reproducible  AlwaysSteps to Reproduce 1  Open a workflow in the Business Process editor 2  Edit the workflow 3  Try to save the workflow under a new name  File  gt  Save As    gt  Menu item is grayed out  ,3
127958,Enhace property editor saving logic to provide group properties,  ,3
402243,Birt 4 2 2 does no longer work with oracle database  ojdbc6 , Since upgrading to Eclipse 3 8 2  Birt 4 2 2  our report can no longer be executed againt an 10g oracle database using latest ojdbc6 jar driver  It gets me an out of memory error even for a quite trivial report which was  and still is  working without problems on birt 4 2 1I ve attached the report  the jdbc driver used is   ojdbc6 jar  The problem is both within the development env as well as when executing the embedded birt engine  The error occurs on the second SQL Statement  Can I provide any additional logs  Ideally directly from within the Eclipse IDE  HOw would I do that Stacktrace 202990    ModalContext  INFO  biz horus database jpa core ReferenceManagerImpl    User  jmichler starts creating report  Prozesshandbuch HorusMar 03  2013 8 03 13 PM org eclipse birt report engine api impl EngineTask handleFatalExceptionsSEVERE  There is insufficient memory to execute this report 204284    main  ERROR edu karlsruhe horus core exception handler HorusExceptionHandler    java lang OutOfMemoryError  Java heap spaceedu karlsruhe horus core exception HorusException  java lang OutOfMemoryError  Java heap spacejava 99 java 290 java 499 java 508 java 169 java 241 java 241 java 829 java 815 java 805 java 84 java 1053 java 4169 java 3758 java 2701 java 2665 java 2499 java 679 java 332 java 668 java 149 java 67 java 196 java 110 java 79 java 353 java 180 invoke0 Native Method invoke Unknown Source invoke Unknown Source invoke Unknown Source java 629 java 584 java 1438 java 1414 Caused by  java lang OutOfMemoryError  Java heap spacenewArray Native Method newInstance Unknown Source java 226 java 7672 java 1005 java 277 java 146 java 844 java 358 java 192 java 531 java 207 java 884 java 1167 java 1289 java 3584 java 3628 java 1493 java 477 java 420 java 316 java 412 java 379 java 407 java 377 java 347 java 334 java 440 java 355 java 459 java 346 java 455  ENTRY Log4jLogger edu karlsruhe horus core exception handler HorusExceptionHandler 4 0 2013 03 03 20 03 14 017 MESSAGE java lang OutOfMemoryError  Java heap space STACK 0edu karlsruhe horus core exception HorusException  java lang OutOfMemoryError  Java heap spacejava 99 java 290 java 499 java 508 java 169 java 241 java 241 java 829 java 815 java 805 java 84 java 1053 java 4169 java 3758 java 2701 java 2665 java 2499 java 679 java 332 java 668 java 149 java 67 java 196 java 110 java 79 java 353 java 180 invoke0 Native Method invoke Unknown Source invoke Unknown Source invoke Unknown Source java 629 java 584 java 1438 java 1414 Caused by  java lang OutOfMemoryError  Java heap spacenewArray Native Method newInstance Unknown Source java 226 java 7672 java 1005 java 277 java 146 java 844 java 358 java 192 java 531 java 207 java 884 java 1167 java 1289 java 3584 java 3628 java 1493 java 477 java 420 java 316 java 412 java 379 java 407 java 377 java 347 java 334 java 440 java 355 java 459 java 346 java 455  ,3
343910,Inconsistent Project Explorer content provider names, The types of content I can view in my Project Explorer include Java EE Navigator Content EJBJ2EE Application Deployment DescriptorsJ2EE Application Client Deployment DescriptorsJ2EE EJB Deployment DescriptorsJ2EE Web Deployment DescriptorsJava EE Navigator Content WebJava EE Navigator Content Application ClientJava EE Navigator Content EARJava EE Navigator Content ConnectorI m not even sure what that last one is  but shouldn t we at least update them all to properly say Java EE  and hunt down any rogue  JEE s still left in the UI   ,3
259263, Discovery  SLP  jSLP doesn t translate default scope  protocols and naming authority to internal and vice versa, jSLP doesn t translate default scope  protocols and naming authority to internal and vice versa ECF default scope   gt  SLP   default ECF default protocol   gt  SLP   unknown ECF default NA   gt  SLP   iana   non set  ,3
