527256,Conflicting model registrations, M2  When I start JUnit Plugin tests I get Command line arguments    os win32  ws win32  arch x86 64  consoleLog  version 3  port 64385  testLoaderClass org eclipse jdt internal junit4 runner JUnit4TestLoader  loaderpluginname org eclipse jdt junit4 runtime  test org eclipse qvtd xtext qvtcore tests QVTcCompilerTests testQVTcCompiler Forward2Reverse CG  lt plugin gt   application org eclipse pde junit runtime uitestapplication  product org eclipse sdk ide  data E  Development Chital Workspace    junit workspace  dev file E  Development Chital Workspace  metadata  plugins org eclipse pde core pde junit dev properties  os win32  ws win32  arch x86 64  consoleLog  testpluginname org eclipse qvtd all tests ENTRY org eclipse emf ecore 2 0 2017 11 14 13 40 25 090 MESSAGE Both  org eclipse cbi p2repo p2 maven  and  org eclipse m2e model edit  register a package for    ENTRY org eclipse emf ecore 2 0 2017 11 14 13 40 25 091 MESSAGE Both  org eclipse cbi p2repo p2 maven  and  org eclipse m2e model edit  register an extension parser for  pom A   edit plugin should not normally provide model registrations  Please remove the conflicts  ,3
491823,Intermittent failure in ProjectModelOutputTest testListOutputs, Seen atjava lang AssertionError  nulljava 86 java 41 java 64 java 74 java 117  ,3
374138,Deployment needs to stop creating bind files for DDs outside source folders,  ,3
494089,Changing patchset in large review throws exception and takes very long at 100  CPU,  in EGerrit  the Editor opens quite quickly considering it is a very large review However  if I select a comment in the History tab thConsidering opening the review was quick  there must be something wrong with changing patchsets The exception is below  ENTRY org eclipse core databinding observable 4 2 2016 05 19 19 58 28 129 MESSAGE Problems occurred when invoking code from plug in   org eclipse core databinding observable   STACK 0java lang ArrayIndexOutOfBoundsExceptionarraycopy Native Method java 255 java 219 java 1683 java 1033 java 177 java 588 java 585 java 81 java 149 java 42 java 153 java 1 java 67 java 35 java 182 java 4517 java 4135 java 1119 java 336 java 1020 java 150 java 687 java 336 java 604 java 148 java 138 java 196 java 134 java 104 java 388 java 243 invoke0 Native Method java 62 java 43 java 497 java 673 java 610 java 1519 java 1492  ,3
488772, TreeDefaultSelectionOrder   Gtk  Tree  defaultSelection  amp  button press events cause an exception when you create a new Java project via wizard  IAE  Path for project must have only one segment  , eclipse buildId 4 6 0 I20160223 0800Create a new Java Project using the wizard   Ctrl N  Select  Java Project   Press Enter  bug doesn t occur when pressing Alt N  Will throw java lang reflect InvocationTargetExceptionjava 396 java 993 java 168 java 501 java 126 java 1215 java 1185 java 70 java 1185 java 876 java 419 java 618 java 249 java 84 java 4495 java 1339 java 3833 java 3444 java 818 java 794 java 269 java 290 java 295 java 90 invoke Unknown Source java 43 java 497 java 54 java 282 java 264 java 132 java 152 java 494 java 491 java 210 java 286 java 507 java 558 java 378 java 324 java 86 java 84 java 1551 java 1338 java 1363 java 1348 java 1375 java 763 java 3363 java 793 java 1922 java 1990 java 5747 java 3664 java 4731  gtk main do event Native Method java 9485 java 1226  g main context iteration Native Method java 2477 java 3442 java 1118 java 336 java 1019 java 150 java 692 java 336 java 605 java 148 java 138 java 196 java 134 java 104 java 388 java 243 invoke0 Native Method java 62 java 43 java 497 java 670 java 609 java 1516 java 1489 Caused by  java lang IllegalArgumentException  Path for project must have only one segment java 63 java 147 java 208 java 195 java 156 java 67 java 107 java 2240 java 2267 java 128 java 118 Root exception java lang IllegalArgumentException  Path for project must have only one segment java 63 java 147 java 208 java 195 java 156 java 67 java 107 java 2240 java 2267 java 128 java 118  ,3
304598,Hide runtime modules with nothing to display in ROV, The following modules in xdc runtime don t have anything interesting to display in ROV  so they should just be hidden    Assert   Core   Defaults   Log   Main   SysStd   Timestamp   TypesThis can be accomplished with  showRawTab   false   however I don t think this currently works if the raw tab is the only tab in the module  This will need to be fixed first  ,3
447342,Provide fast and easy to use ReflectionUtils, The current org eclipse persistence internal security PrivilegedAccessHelper is relatively slow  creation of new objects for every privileged action call  and hard to use  user must wrap code in doPrivileged himself  Provide faster and easier to use ReflectionUtils class thShould be as fast as possible  but not faster  and follow best practices   Actions implemented as reusable singletons  On demand loading   Lazy loading of inner classes interfaces  load only on demand if security is enabled   Usage of predicates  ,3
413777,XGCONF  loading certain cfg files yields an NPE error, Filed on behald of Ramsey Harris Loading my Dsp cfg script into XGONF results in a java null pointer exception  see attached project files  java lang NullPointerException      addDocPositions Unknown Source       addDocPositions Unknown Source       parseConfigFile Unknown Source       createSourcePage Unknown Source       createPages Unknown Source       java 348       java 670       java 465       java 595       java 271       java 1459       java 972       java 31       java 35       java 135       java 4144       java 3761       java 803       java 1600       java 31       java 35       java 135       java 4144       java 3761       java 2609       java 2499       java 679       java 332       java 668       java 149       java 124       java 196       java 110       java 79       java 353       java 180       invoke0 Native Method       invoke Unknown Source       invoke Unknown Source       invoke Unknown Source       java 629       java 584       java 1438  ,3
549530,Add Task Repository    dialog too wide, See the width of the dialogSee image attached ,3
277445, plug in registry  Plug In registry view throws NPE when Bundle Symbolicname not set, With 3 4 100 v20090520  Happens e g  with R OSGi thENTRY org eclipse jface 4 2 2009 05 22 13 26 55 802 MESSAGE Problems occurred when invoking code from plug in   org eclipse jface   STACK 0java lang NullPointerExceptionjava 264 java 172 java 257 java 382 java 145 java 932 java 102 java 42 java 888 java 48 java 175 java 1012 java 481 java 42 java 888 java 48 java 175 java 2111 java 827 java 802 java 70 java 776 java 639 java 1442 java 937 java 1453 java 126 java 84 java 1176 java 1200 java 1185 java 2060 java 1601 java 4189  gtk main do event Native Method java 7586 java 1184  g main context iteration Native Method java 1858 java 3102 java 2405 java 2369 java 2221 java 500 java 332 java 493 java 149 java 113 java 194 java 110 java 79 java 368 java 179 invoke0 Native Method java 39 java 25 java 585 java 559 java 514 java 1311 java 1287  ,3
552710,Add External JARs selection ignored when creating a new project, I am using Eclipse IDE for Java Developers and JRE jkd 13 0 1  To reproduce this problem   click File   New Java Project  Enter a project name  for example   Hello World    Click Next  Click the Libraries tab  Click the Add External JAR files    button  Choose a  jar file and click Open  Click FinishI expected the Package Explorer to show my selected  jar file in the newly created project  but neither were added  It should have been added to a list of Referenced Libraries for the project  right I rated the severity as normal because you and I both know there is a way to add the external  jar file later  But I published a series of books titled Do It Yourself Java Games intended for beginning programmers with no Java experience  In my books I recommend using Eclipse and walk them through the above steps to add the required external jar file  People are returning the book asking for a refund because they can t get it to work  I am losing book sales due to this issue so its severity is higher than thfyi  adding the same external jar file to an existing project works  right click on the project in Package Explorer   Build Path   Add External Archives     but adding it while creating the project does not work  ,3
151811, evaluation   variable cannot be resolved  for variables in nested class, If setting up breakpint in nested class method which is implemented in parent class method  Then trying to view in  Exspressions view  a variable declared in parent class method  the variable cannot be resolved  Variable is in the scope of children class method were the breakpoint is set of so it should be resolved Screen shot attached explaining all visually                                                                                 eclipse buildId M20060629 1905eclipse commands  oswin32 wswin32 archx86 launcherC  Program Files eclipse eclipse exe nameEclipse showsplash600 exitdataf1c 64 vmC  j2sdk1 4 2 10 bin javaw exeeclipse ee install verify falseeclipse product org eclipse sdk ideeclipse startTime 1153893927744eclipse vm C  j2sdk1 4 2 10 bin javaw exeeclipse vmargs  Xms40m Xmx256m jar ,3
122429,System console    Java 6 0  returns null when running inside Eclipse,  The documentation      says   Returns the unique Console object associated with the current Java virtual machine  if any  When I run the following code import java io Console public class Main  public static void main String   args   Console console   System console   System out println console    directly using  java Main   it works  console    null   However  when I run inside Eclipse  Alt Shift X J   it returns null I m not sure if this is something must be handled  ,3
304390,Provide refactoring participants,  ,3
250166, Scanner Discovery  SD Options  changes from  Restore Defaults  in configuration wide  scope isn t  saved, Build ID  I20080609 1311Steps To Reproduce 1  Create a Hello World ANSI C Project with Linux GCC Toolchain 2  In Property Pages  gt Discovery Options   in Debug configuration unselect  Automate discovery of paths and symbols  in both Configuration wide and Per Language scopes and get out with ok 3  Close and reopen the project    gt   Automate discovery of paths and symbols   are off in both scopes correctly 4  Under  Per Language  scope  select  Restore Defaults    Configuration wide  scope  select  Restore Defaults  and get out with OK 5  Close and reopen the project  You see thAlternatively  select  Restore Defaults  and then  Apply  under both scope in 4  You can still see the same error More information  ,3
445982, Generate JavaFX Getters and Setters  missing when using Shortcut, Screenshots of the mentioned menusThe entry  Generate JavaFX Getters and Setters  in the Source menu is present when opening it via the context menu but not when using the Keyboard Shortcut for the Source menu or the menu bar entry for it This is highly annoying and makes you believe the entry is not present  ,3
163041, content assist  Provide constructor proposals for all signatures, hi  if I haveclass Super     Super  lt some parameters gt      and writeclass C extends Super      lt X gt  and do a ctrl space  producesclass C extends Super    C      which doesn t compile I m thinking a better behaviour would be to   1  automatically parameterize the new constructor if only one superclass constructor exists  and is parameterized or  2  somehow offer to add a particular or all superconstructors  again mirroring the parameterizationThe existing behaviour is still fine for the case where the superclass has only a unparameterized constructor thanks Andrew ,3
233712, rename  method so that it overrides ignores that visibility must not be reduced, Build ID  Build ID  M20071023 1652Steps To Reproduce public class A  public void m Object o    void n    m  abc     public class B extends A  void n Object o     Renaming n in B to m causes an error since visibility of m cannot be reduced in subclass More information  ,3
37041, misc   Show Source of Selected Element Only  should hide element wide indent, An element  such as a method will often  as a whole  be indented with regards to the class body  When you only show one element at a time  seeing this indentation conveys no extra information  since you can t scroll to see the class   It does waste screen real estate  though The editor should hide that the method  or other element  is indented when  Show Source of Selected Element Only  is selected  In a sense  the white space to the left of a method could be regarded as belonging to the class rather than the method  ,3
307792,Junit test failures in the WTP M7 builds  , This bug tracks 2 junit failures th1  Package org eclipse jst jsf core tests  testAddServletjava lang NullPointerExceptionjava 98 java 376 java 209 java 35 java 31 java 587 java 198 java 110 java 79 java 369 java 179 java 619 java 574 java 1406 java 1382 2  Package org eclipse jst jsf validation el tests  testSanityErrorFailed while installing JavaServer Faces 1 1 org eclipse wst common project facet core FacetedProjectFrameworkException  Failed while installing JavaServer Faces 1 1 java 1500 java 442 java 1174 java 1110 java 325 java 1975 java 340 java 89 java 57 java 133 java 63 java 36 java 57 java 57 java 376 java 209 java 195 java 35 java 134 java 3507 java 3154 java 2416 java 2380 java 2229 java 504 java 332 java 497 java 149 java 115 java 138 java 60 java 210 java 196 java 110 java 79 java 369 java 179 java 619 java 574 java 1406 java 1382 Caused by  org eclipse jst jsf core internal project facet JSFFacetException   ELValidationTest org eclipse jst jsf validation el tests jsp BadSyntaxTestCase testSanity 1 1    unable to configure web module for JavaServer Facesjava 94 java 1470  ,3
423416, Index out of bounds  exceptions in CodeCompletionTest,  in readable form M20131113 0800 and N20131205 2000 Many  12 13   Index out of bounds  exceptions in CodeCompletionTest like this Java Model Exception  Java Model Status  Index out of bounds java 121 java 358 java 346 java 91 java 272 java 657 java 310 java 197 java 35 java 136 java 4145 java 3762 java 1119 java 332 java 1003 java 146 java 609 java 332 java 563 java 150 java 125 java 140 java 62 java 212 java 196 java 109 java 80 java 372 java 226 java 636 java 591 java 1450 java 1426 java 34  ,3
531066,Provide metastore implementation for orionhub org,  ,3
330357,Provide guidance  to user right when he needs it, demo1A user will not always realize th If a user does something for which there is a better way possible Eclipse should try to notify the user about it  For example  a preference thThe tips can be shown in a popup on the bottom right of the screen  in a popup near the cursor mouse pointer  or even using the context help infrastructure These tips or guidance could be categorized  new user    intermediate    experienced user  and a user can choose to see tips from only one selected category attaching a demo  video  of some examples I quickly implemented  extract with 7zip and view with Windows Media player VLC  While this should be done for the entire SDK  I am filing the bug against JDT for now     ,3
317652,The source folder cannot be a nested folder of the project, Build Identifier  6 0 0 200909110608When the source folder is a nested folder of the project  some source files cannot be shown correctly in the project explorer Reproducible  AlwaysSteps to Reproduce 1   Create a Hello World C   project  bb 2   The source folder by default is  src   create another source folder  testmethod src  with the source folder wizard 3  In the project explorer  drag and drop  bb cpp  in source foler  src  to  testmethod src  4  Delete the source folder  src  5   Right click on the source folder  testmethod src  in project explorer  not the folder and create a source file  aa cpp  6   But the file  aa cpp  does not show as a child of the source folder  testmethod src  7  If you build the project  however   the project explorer will be refreshed  and  aa cpp  now is shown as a child of the source folder  testmethod src  I debugged the code  it seems that 1  The class  DeltaProcessor  doesn t handle the  resource change event properly 2   When building the project  the builder  Scanner Configuration Builder  refreshes the model CModelManager Also  I d like to know if this behavior  a source folder  testmethod src   is supported by CDT  ,3
370307, implementation  CompilationUnitDocumentProvider resets document without asking, Build Identifier  I20110613 1736If a file is first opened and edited with an editor thAfter thReproducible  AlwaysSteps to Reproduce 1  Open a file with the default editor  e g  hello world txt 2  Type in some characters  without saving 3  Open the same file with an Editor that uses the ComilationUnitDocumentProvider  java editor 4  You can see  th ,3
231651, view model  Add implementation of IElementMementoProvider to a base VM class ,  ,3
552175, performance  Avoid bean introspection overhead, On startup the application model is constructed  Here Xpath expressions are processed with Apache JXPath  When looking into the startup process the method StringModelFragmentImpl mergeXPath is prominent in the profiling results  When looking deeper it can be seen thSet a breakpoint into Introspector findCustomizerClass to see what s happening After investigation I have found out th ,3
519384, override method  Generating code to override method should copy annotations of super method, Java project with which the problem can be reproducedIt seems this was tracked with bug report 353472  see  However with 4 6 I don t observe thTo reproduce1  Import project from attached zip 2  Open type SomeSub 3  Generated code to override method someMethod Observed behaviorThe following code is generated  Overridepublic void someMethod           TODO Auto generated method stub    super someMethod    Desired behaviorSince the super method has the  Before annotation  the generated method should have it as well  So the generated code  in this case  should be as follows  Before Overridepublic void someMethod           TODO Auto generated method stub    super someMethod    I can reproduce this with Version  Neon 3   4 6 3 Build id  R20170220 0833 ,3
384513, quick fix  Create method in super type should add  Override,  ,3
294966, compare  Navigate  gt  Back does not work inside Java compare editor after Open Declaration, I20091110 0800In a Java compare editor  use Ctrl Click or Open Declaration on a method reference whose declaration is in the same editor  The caret correctly jumps to the target  but then  Navigate  gt  Back does not bring me back to the original location  ,3
490402, hovering  hyper link in hover over compare editor reports  Internal Error , In a compare editor of a Java source file  left pane    source from the workspace   hover over a local variable  see its type and try to invoke the hyperlink of thHere s what I get in the log Message  Internal ErrorJava Model Exception  Java Model Status   lt project root gt   in    is not on its project s build path java 566 java 247 java 505 java 241 java 505 java 1176 java 241 java 579 java 316 java 302 java 285 java 653 java 534 java 717 java 574 java 293 java 1945 java 552 java 431  gtk main do event Native Method java 9501 java 1226  g main context iteration Native Method java 2480 java 3576 java 1119 java 336 java 1020 java 150 java 692 java 336 java 605 java 148 java 138 java 196 java 134 java 104 java 388 java 243 invoke0 Native Method java 62 java 43 java 497 java 670 java 609 java 1516 java 1489  ,3
379145, nls tooling  Provide a quick fix which behaves the same as the auto fix,   gt  However  that still leaves the problem that the auto fix and the Quick Fix gt  don t do the same i e  if a user misses to use the auto fix for whatever gt  reason  the subsequent quick fix is not always wh  gt   gt  Another issue with using the quick fix  instead of the auto fix  is that once gt  you paste  k c        program  it is converted to  c   u3077 u308D u3050 u3089 u3080 program  which gt  is already wrong because it leads to  c  u3077    program   I don t know what gt  we can do here  because  c   u3077  is kind of ambiguous    ,3
172595, search  Feature proposal  Identify all unused classes  methods etc within project package, While the existing References search feature is without question very handy  While there exists an expensive commercial solution for  amongst others  this request called RefactorIT  with features such as besaid FindReferencesInProjectAction currently implemented  I thought it might not be an overly far step to running a search on all classes  methods etc  in a package or project and  as opposed to the References Search  list those thRefactorIt further supports a series of helpful search criteria  such as the exclusion of getter and setter accessor methods  overriding methods or JUnit test cases  Naturally this exclusion option could make the search both faster and give better results as to the goal of cleaning up the code  ,3
171370, common  IOexception  on an invalid file path returned by FileLocator toFileURL, Hello Equinox TeamI got an IOexception on the FileLocator toFileURL   method when trying to resolve the installation path of a bundle 1 Here is the snippetpublic static IPath getInstallPath    URLinstallURL   null URL resolveURL  null File file  null if  installPath    null   try  installURL   getInstallURL   if  isDebug     System err println  getInstallPath  installURL       installURL toString     resolveURL   FileLocator resolve installURL  if  isDebug     System err println  getInstallPath  resolveURL       resolveURL toString     file   new File FileLocator toFileURL resolveURL  getFile    if  isDebug     System err println  getInstallPath  file             file toString     installPath   new Path file getCanonicalPath    if  isDebug     System err println  getInstallPath  installPath      installPath toString       catch  Exception exception   log exception  if   installURL    null  logErrorMessage  getInstallPath  installURL       installURL toString    if   resolveURL    null  logErrorMessage  getInstallPath  resolveURL       resolveURL toString    if   file    null   logErrorMessage  getInstallPath  file             file toString    if   installPath    null logErrorMessage  getInstallPath  installPath      installPath toString    installPath   null   return installPath  2  Here is the log ENTRY com anubex ndt core 4 0 2007 01 23 11 58 04 239 MESSAGE Plugin internal error STACK 0java io IOException  The filename  directory name  or volume label syntax is incorrectcanonicalize0 Native Method java 395 java 531 java 181 java 27 java 1589 java 2767 java 2673 java 2149 java 1312 java 840 java 773 java 3016 java 3032 java 82 java 50 java 140 java 37 java 155 java 200 java 65 java 982 java 1010 java 91 java 37 java 254 java 539 java 488 java 400 java 66 java 928 java 3348 java 2968 java 1914 java 1878 java 419 java 149 java 95 java 78 java 92 java 68 java 400 java 177 invoke0 Native Method java 39 java 25 java 585 java 336 java 280 java 977 java 952  ENTRY com anubex ndt core 4 0 2007 01 23 11 58 04 239 MESSAGE getInstallPath  installURL   bundleentry   455  ENTRY com anubex ndt core 4 0 2007 01 23 11 58 04 255 MESSAGE getInstallPath  resolveURL   jar file C  Eclipse 3 2 eclipse plugins com anubex ndt core 1 0 11 jar   ENTRY com anubex ndt core 4 0 2007 01 23 11 58 04 255 MESSAGE getInstallPath  file         file C  Eclipse 3 2 eclipse plugins com anubex ndt core 1 0 11 jar  ENTRY com anubex ndt core 4 0 2007 01 23 11 58 04 255 MESSAGE Activator getInstallPath   is null ENTRY com anubex ndt core 4 0 2007 01 23 11 58 04 255 MESSAGE Plugin internal error STACK 0java lang NullPointerExceptionjava 46 java 1589 java 2767 java 2673 java 2149 java 1312 java 840 java 773 java 3016 java 3032 java 82 java 50 java 140 java 37 java 155 java 200 java 65 java 982 java 1010 java 91 java 37 java 254 java 539 java 488 java 400 java 66 java 928 java 3348 java 2968 java 1914 java 1878 java 419 java 149 java 95 java 78 java 92 java 68 java 400 java 177 invoke0 Native Method java 39 java 25 java 585 java 336 java 280 java 977 java 952 RegardsFrancis ANDRE ,3
441274,Provide a Java Packager export wizard, The IDE should provide a Java Packager export wizard This export plugin would be based on the new Packager API  available in Oracle JDK as of JDK 8u20  It would export and package all resources required to run an application  into an installable  self contained  application bundle  The immediate benefits of the Java Packager wizard would be the following    provide an easy way to generate from the IDE an installable executable version   of the Java application under development testing   help the developer get familiar with Java Packaging and its various flavors and options Beyond that  the wizard should ideally also help the developer elaborate automated build instructions A draft of wireframes of the proposed UI flow for the Java Packager wizard is on this wiki  ,3
