201979,Wrong identation after paste, Build ID  I20070625 1500Steps To Reproduce 1 New php filewith codeprivate function ShowExportButton    d new CDiv  xmlexport     TODO   predelat to podle Rebe45L   raw l new CAppLink  raw   this  gt m action  xexp    GET  data     GLOBALS  str XmlExport                true   GLOBALS  app    gt ShowImage  images xml export gif   32  10   GLOBALS  str XmlExport     l  gt Fin      l new CAppLink  raw   this  gt m action  xexp    GET  data    echo  GLOBALS  str XmlExport    l  gt Fin      d  gt Fin    2  paste this to next line from TODO l new CAppLink array apModule  gt  this  gt m moduleId  apMethod  gt  edit   apParam  gt  aRecord  this  gt m tbl  gt m idname    3  wrong result isprivate function ShowExportButton    d new CDiv  xmlexport     TODO   predelat to podle Rebe45L   raw l new CAppLink array apModule  gt  this  gt m moduleId  apMethod  gt  edit   apParam  gt  aRecord  this  gt m tbl  gt m idname     l new CAppLink  raw   this  gt m action  xexp    GET  data     GLOBALS  str XmlExport                true   GLOBALS  app    gt ShowImage  images xml export gif   32  10   GLOBALS  str XmlExport     l  gt Fin      l new CAppLink  raw   this  gt m action  xexp    GET  data    echo  GLOBALS  str XmlExport    l  gt Fin      d  gt Fin    line  l new CAppLink  raw   this  gt      is idented to front without reasonMore information i have night build org eclipse php feature incubation N20070830 zip ,1
488192,Improve IDE Tooling, Here are some improvement suggestions for the IDE Tooling   The Attachments should be removed from the context menu  The Attachments should be displayed as a table with detail  The  Generate Controls  should be renamed to  Create Control    Generate Control  should be the first entry in the list  Menu Entries should be grouped  The menu should have maximal 6 entries  as it is to big otherwise ,1
193878, performance   delete tasks  action runs in UI thread,  delete tasks  action runs in UI thread and it also seems like not grouping notification events  I deleted few thousands tasks from archive category  trying to figure out why bugzilla query sync don t pickup bugs  and Workbench got frozen for few minutes and after thHere is a piece of stack trace for the deletion itself main  prio 6 tid 0x00296000 nid 0xcc8 runnable  0x0090e000  0x0090fe5c    java lang Thread State  RUNNABLE        java 104         java 339         java 269         java 1071         java 215         java 278         java 78         java 498         java 545         java 490         java 402         java 66         java 938         java 3682         java 3293         java 2389         java 2353         java 2219         java 466         java 289         java 461         java 149         java 106         java 153         java 106         java 76         java 363         java 176         invoke0 Native Method         java 39         java 25         java 597         java 504         java 443         java 1169         java 1144  ,1
291747,VoidType and AliasType override isValueType    isRelation    etc  and AbstractDataType overtides isNodeType  , Because void is the bottom of the type hierarchy  it can act as any type  This should be implemented by Type isSubTypeOf   and lub   The current state is thThe current client code naturally depends heavily on this bad design  Fixing the design flaw would break a lot of code   BTW  isNodeType   is also overridden by AbstractDataType  which is another instance of this problem We need to fix this  ,1
276868,Need posssibility to manipulate the width of the left hand side navigation pane, Feature RequestIt would be smart if riena has the possibility to configure a Sash handle between the navigation pane and the content pane ,2
3328, resources  Data loss when disk is full  1GIX0JL , I lost the contents of a java file apparently because the disk was full Scenario  the disk my workspace is on was full edit an open java file in Eclipse save the change got a message saying thI didn t make any changes outside Eclipse but said no  don t overwrite anyway The change I had just made and wanted to save was minor so I went ahead and selected  refresh from local file system  on the file  The refreshed file was emptyand I got an error message  There were errors during the build   It didn t say what kind of errors  Running out of disk space seems like a likely scenario so I should get an appropriate message Fortunately  Replace from local history  worked and I got the old file contents back NOTES PM  9 4 01 9 46 02 AM Not a common scenario  ,2
421479, 1 8  clean up  quick assist  convert anonymous to lambda must consider lost scope of interface, When converting an anonymous to a lambda expression  we have to consider th package jsr335 funint  FunctionalInterfaceinterface Func      enum En   A      void foo       String NAME          static String staticName     return NAME       default String getName     return NAME    class Test      void bar            Func f   new Func                 Override            public void foo                    System out println En A                  System out println NAME     already not in scope  since static interface methods are not inherited                 System out println staticName                       OK                 System out println Test this                     accessing this or super                 System out println getName                    foo                   System out println this                  System out println super toString                    Class lt   extends Func gt  tc  this getClass                   Class lt   extends Object gt  sc  super getClass                   System out println Func super getName                                  ,2
320255,Provide API to obtain image paths, Sometimes  LCAs need to pass an image path to the client  Currently  this path can only be obtained using internal API  ResourceFactory getImagePath   There should be an API method to provide image paths for custom widget LCAs As an example  see the LCAs in the rap ui forms plug in  ,2
294099,Add and Remove Projects window does not comply with Eclipse IBM UI guidelines, User Agent        Mozilla 5 0  Windows  U  Windows NT 5 1  en US  rv 1 9 0 15  Gecko 2009101601 Firefox 3 0 15Build Identifier  Please see the screen capture with the revisions Reproducible  Always ,2
468971,Provide list of available ExtensionPoints for Extension Wizard, New page to be added in the Extension Definition Wizard  where the user can select one of the available Extension Points during creation of new Extension Definition    transferred from  ,2
331094,PersistenceProviderResolverHolder is thread unsafe, Build Identifier  2 2 0 v20101117 r8503Just bumped into class  It is kind of a strange class  because Serious multi threading issue in this class a   singleton  field is not declared volatile  yet it is read as well as set in non synchronized blocks  which means when some thread sets it  another thread might not see the changed value b  The inner class  DefaultPersistenceProviderResolver  has a field named  providers  of type WekHashMap  note this class is not thread safe  which is used to cache the discovered providers discovered  It lazily populates the list of providers  but the lazy initialisation happens in a non synchronized block  which means the Map can get corrupt if multiple threads call Persistence createEntityManagerFactory    Don t rely on test cases to catch these errors  Just guard the code using synchronized block b  Reproducible  Always ,2
362707,System Properties should override persistence xml properties,  ,2
405300,Bug when use IDENTITY Column on Sybase tables with JPA , When I use an identity column in sybase table as create table snp solicitud transaccion cod solicitud transaccionnumeric 20 0  identity not null val total                decimal 18 4  not null we have the next Entity in java if I use JPA Entity Table name    snp solicitud transaccion  public class SolicitudTransaccion extends EntidadGeneral implements Serializable      private static final long serialVersionUID   1L      Id     GeneratedValue strategy   GenerationType IDENTITY       Column name    cod solicitud transaccion   length 20  nullable   false     private Long id The error occurs when the entity is persisted  since the generated id always returns 0  and if they want to work with this newly inserted entity is impossible because your id is 0look this log LA M S FINA  persist   operation called on  test SolicitudTransaccion  id null   M S FINA  begin unit of work flushM S FINA  TX beginTransaction  status STATUS ACTIVELA M S FINA  Execute query InsertObjectQuery test SolicitudTransaccion  id null   LA M S FINA  Connection acquired from connection pool  default  LA M S FINA  reconnecting to external connection poolFINA  INSERT INTO snp solicitud transaccion  sts registro  fec actualiza  fec creacion solicitud  txt id solicitud  val total  cod participante envio  cod participante procesa  VALUES                      bind   gt   HABILITADO  2013 04 09 10 41 53 775  2013 04 09 10 41 53 775  SOLICITUD 29848655  1000  1  1 LA M S FINA  Execute query ValueReadQuery name  SEQ GEN IDENTITY  sql  SELECT   IDENTITY  FINA  SELECT   IDENTITYLA M S FINA  assign sequence to the object  0   gt  test SolicitudTransaccion  id null   M S FINA  end unit of work flushM S FINA  resume unit of workM S FINA  TX beforeCompletion callback  status STATUS ACTIVEM S FINA  begin unit of work commitregards from Ecuador ,2
323211, libraries  Provide HTML5 browser library,  ,2
180023,provide guaranteed visibility or scheduled mechanism for completed tasks,  ,2
246497,provide clean up actions for automatic containers,  ,2
336298, api  provide task to change set mapping,  ,2
493104, mac   Today  link should switch back to current month, Just testing the Neon M7 Eclipse IDE for Java Developers To reproduce   Create a new task  Select  Scheduled   gt   Choose Date      Switch to a different month using  lt  or  gt   Click the  Today  linkI would expect the calender widget to switch back to the current month  otherwise the user has no indication th  ,2
370443,Exclude requests for debugging, Build Identifier  M20110909 1335This is not a bug This is a feature request and i am doing this request because i could not find this functionality in Eclipse  The search for bugs did not pull out anything neither did googling  If this feature already exists  i apologize and ask to be directed to the documentation  Related to   Eclipse PHP PDT   XDebug Debugger Set Preferences   gt  Xdebug   gt  Configure   gt  Accept Remote session  JIT  to PROMPTA web page can make multiple requests and this creates a nightmare when Eclipse continuously pops up a prompt box and asks to accept the connection when a debug session is already running Most other IDE s allow you to specify paths th SO i can either specify an entire folder from the server or a file to be excluded and the debugger will silently discard any requests   but they display a non blocking message that the Debug request was blocked   This becomes a nightmare in Eclipse if a webpage has like a ch Another feature is th 2 feature requests                          1  Allow paths to be excluded from debug requests2  Display the path from where the request is coming Thanks NaveenReproducible  Always ,2
246441, context  consider suppressing tree node expansion,  ,2
251555, Graphical Editor  Properties  Provide better support for editing complex types with simple content, Currently the XML Schema editor does a pretty good job For example  there is no way to create a complex type with simple content in graphical mode  Perhaps we could use a new menu Further  the content of a complex type with simple content is not visually represented in the complex type figure  We could perhaps have some sort of nested figure similar to the all sequence choice to allow a user the ability to use the graphical view to drill down and select the simple content element  Currently the only way to select the simpleContent element is by using the source view If the user is editing a complex type with atomic simple content and uses restriction  the properties view appears to be missing the constraints tab  We would also need to make sure th ,2
384794,Evaluate better default UI options and preferences for  typical  java development, Build Identifier  Version  Juno Release Build id  20120614 1722When ever I install a new version of Eclipse  I see it as an opportunity to setup a clean new workspace  but there seems to be a whole of of settings thLink with Editor   default to enabled Package Explorer package presenetation   Default to hierarchicalShow Line Numbers   Default to enabledPreferences   gt     Workspaces   gt  Refresh on Access   default to enabledPreferences   gt  Java   gt     Type Filters   Does it ever make sense to use com sun xml internal    etcPreferences   gt     Compiler   gt  Errors Warnings   Default to  Warning  for a lot of the options  It s not that hard to turn them off  and are one of the many reasons why we use a Java IDE over notepad   Content Assist   Insert mode   default to  Completion overwrites Editor Presentation toolbar   Shown by defaultXML Editor   default to source viewing mode  I know it s not part of the Java stuff  but just another example Obviously these defaults are just my ideal defaults  which isn t necessarily the most ideal option for the average Joe user of eclipse  hence the  Evaluate     in the summary This enhancement could be far wider scoped than just the things I ve mentioned Reproducible  Always ,3
548003,Content assist inside of specific lambdas results in NullPointerException, Java class which reproduces the problemWe heavily use nested lambdas in our code base and I ran into problems with content assist  Either it does not show any proposals or it shows a popup  Problems During Content Assist  The following reproduces the problem in Eclipse 2019 03     static class X          public X child Consumer lt X gt  c               return this                   void bad X x           new Runnable                 Override            public void run                    x child  1   gt   1                     child  2   gt   2      CTRL SPACE does not work here                         child  3   gt                                                                                   new Runnable                 Override            public void run                    x child  1   gt   1                     child  2   gt   2      CTRL SPACE results in NullPointerException and popup                         child new Consumer lt X gt                                  Override                            public void accept X x                                                                                                                             I get the following exception stacktrace in the log      ENTRY org eclipse jdt ui 2 0 2019 06 06 14 38 43 891     MESSAGE The  org eclipse jdt ui JavaAllCompletionProposalComputer  proposal computer from the  org eclipse jdt ui  plug in did not complete normally  The extension has thrown a runtime exception      STACK 0    java lang NullPointerException        java 659         java 553         java 303         java 730         java 333         java 453         java 705         java 961         java 775         java 1034         java 641         java 316         java 551         java 1229         java 1329         java 662         java 553         java 303         java 1034         java 641         java 316         java 551         java 1229         java 1354         java 652         java 2250         java 136         java 368         java 358         java 253         java 215         java 66         java 336         java 340         java 334         java 291         java 2014         java 4767         java 2013         java 45         java 2010         java 573         java 503         java 72         java 498         java 380         java 40         java 185         java 3919         java 3550         java 1173         java 339         java 1062         java 156         java 636         java 339         java 563         java 151         java 155         java 203         java 137         java 107         java 400         java 255         invoke0 Native Method         java 62         java 43         java 498         java 659         java 595         java 1501 The following are small variations of the code above where content assist works as expected     void good X x           new Runnable                 Override            public void run                    x child  1   gt   1                     child  2   gt   2      CTRL SPACE works here                         child  3   gt   3 hashCode                                                                         Runnable r        gt               x child  1   gt   1                 child  2   gt   2     CTRL SPACE works here                     child  3   gt                                                      new Runnable                 Override            public void run                    x child new Consumer lt X gt                          Override                    public void accept X x                           x child  2   gt   2      CTRL SPACE works here                             child  3   gt                                                                                                    ,3
540712,Running JUnit test takes long due to Creating Type Hierarchy, I ve switched from Eclipse 4 7 3a to 4 9 and since then  running JUnit  4 12  tests of a project with 10 000  test methods  right click on the project  select Run  gt  As JUnit test  takes 30 60 seconds to start the status bar shows  Creating Type Hierarchy  for a long time  every time  no changes to the project inbetween  Project  Additional info   I have the Gradle STS plugin with 4 7 3a and the  out of box  Buildship plugin in 4 9  If I import the project as Buildship into 4 7 3a  it is slow too   not sure why as running the test should have no interaction with the plugin A Flight Recorder capture indicates these PackageSample CountPercentage   org eclipse jdt internal core75628 177org eclipse jdt internal core search70726 351org eclipse jdt internal compiler lookup44316 511java lang2208 2org eclipse jdt internal compiler parser1957 268org eclipse jdt internal compiler util712 646org eclipse jdt internal compiler ast692 572java util531 975ClassSample CountPercentage   org eclipse jdt internal core search JavaSearchScope70726 351org eclipse jdt internal core JavaElement58121 655Stack TraceSample CountPercentage   org eclipse jdt internal core search JavaSearchScope encloses IJavaElement 70426 239org eclipse jdt internal core JavaElement equals Object 53319 866java lang String equals Object 2017 492org eclipse jdt internal core SourceMethod equals Object 712 646org eclipse jdt internal core JavaElement getAncestor int 421 565org eclipse jdt internal compiler lookup Scope getTypeOrPackage char    int  boolean 351 305org eclipse jdt internal compiler lookup LookupEnvironment createParameterizedGenericMethod MethodBinding  TypeBinding    boolean  boolean 351 305org eclipse jdt internal core SourceRefElement equals Object 341 267org eclipse jdt internal compiler lookup TypeSystem getWildcard ReferenceBinding  int  TypeBinding  TypeBinding    int 331 23org eclipse jdt internal compiler parser Parser parse  311 155 ,3
183339, compiler   Unncessary declaration of thrown checked exception  should consider overrides implementations, If a public or protected method declares an exception thExample public class Foo       Produces a warning  but shouldn t  public void someMethod   throws SomeException            default implementation does nothing        Produces a warning  but shouldn t  public void anotherMethod   throws SomeException            default implementation does nothing    public class Bar extends Foo    public someMethod   throws SomeException      boolean someResult   doSomething       if   someResult         throw SomeException            public class Baz extends Bar    public void anotherMethod   throws SomeException      boolean anotherResult   doSomethingElse       if   anotherResult          throw SomeException             ,3
461661,Package Explorer hides empty working sets, I contribute a working set extension whose content changes dynamically  All projects whose name match a pattern specified for the working set are included While this works mostly well there is an issue when showing the working set in the Package Explorer  When in  Working Sets  mode  the Package Explorer hides empty working sets with types other than  Java  and  Resource   If  however  the working set contains elements it is shown To add more confusion  a working set thWhy are  Java  and  Resource  working sets treated specially and why are other  empty working sets hidden  I find this behavior inconsistent and would welcome if the Package Explorer would tre ,3
