338462,Cannot complete the install because of a conflicting dependency  Software being installed  Eclipse Java Development Tools 3 6 2, Build Identifier  20100917 0705Cannot complete the install because of a conflicting dependency   Software being installed  Eclipse Java Development Tools 3 6 2 r362 v20101117 0800 7z8XFW6FLFlmjJcvz03jyeFBLS F  org eclipse jdt feature group 3 6 2 r362 v20101117 0800 7z8XFW6FLFlmjJcvz03jyeFBLS F   Software currently installed  Eclipse IDE for C C   Developers 1 3 1 20100916 1202  epp package cpp 1 3 1 20100916 1202   Only one of the following can be installed at once      Eclipse Platform 3 6 0 v201006080911  org eclipse platform 3 6 0 v201006080911     Eclipse Platform 3 6 1 v201009090800  org eclipse platform 3 6 1 v201009090800     Eclipse Platform 3 6 2 v201102101200  org eclipse platform 3 6 2 v201102101200   Cannot satisfy dependency     From  Eclipse IDE for C C   Developers 1 3 1 20100916 1202  epp package cpp 1 3 1 20100916 1202     To  org eclipse epp package cpp feature feature group  1 3 1 20100916 1202   Cannot satisfy dependency     From  EPP CPP Feature 1 3 1 20100916 1202  org eclipse epp package cpp feature feature group 1 3 1 20100916 1202     To  org eclipse platform feature group  3 6 1 r361 v20100909 9gF78GrkFqw7GrsZnvz0JWNTeb6fue6896L   Cannot satisfy dependency     From  Eclipse Java Development Tools 3 6 2 r362 v20101117 0800 7z8XFW6FLFlmjJcvz03jyeFBLS F  org eclipse jdt feature group 3 6 2 r362 v20101117 0800 7z8XFW6FLFlmjJcvz03jyeFBLS F     To  org eclipse platform feature group 3 6 2  Cannot satisfy dependency     From  Eclipse Platform 3 6 1 r361 v20100909 9gF78GrkFqw7GrsZnvz0JWNTeb6fue6896L  org eclipse platform feature group 3 6 1 r361 v20100909 9gF78GrkFqw7GrsZnvz0JWNTeb6fue6896L     To  org eclipse platform  3 6 1 v201009090800   Cannot satisfy dependency     From  Eclipse Platform 3 6 2 r362 v20110210 9gF78Gs1FrIGnHDHWkEcopoN8AmxeZflGDGKQi  org eclipse platform feature group 3 6 2 r362 v20110210 9gF78Gs1FrIGnHDHWkEcopoN8AmxeZflGDGKQi     To  org eclipse platform  3 6 2 v201102101200 Reproducible  AlwaysSteps to Reproduce 1  Help   gt  Check for Updates2 3  ,3
544809, CDO  CDO opens ErrorEditPart instead of opened editors when we restart Eclipse, Cloned from  544808   CDO  CDO opens ErrorEditPart instead of opened editors when we restart EclipseSteps to reproduce  1  Connect you to a CDO Server2  Edit the security file  for example  3  Close Eclipse4  Restart Eclipsewe expect the Security File Editor but we get the ErrorEditPart editor    This behavior is very not user friendly  The user expects to refind the opened editor then we restart Eclipse  or at least a way  to refind them quickly  they don t expect an error messageThis behavior can be reproduce with all the editors using CDO  CDO Security file  Papyrus       The exception error is   java lang Exceptionjava 343 java 324 java 305 java 66 java 343 invoke0 Native Method invoke Unknown Source invoke Unknown Source invoke Unknown Source java 58 java 1001 java 966 java 139 java 411 java 333 java 193 java 108 java 77 java 59 java 132 java 1015 java 675 java 781 java 752 java 746 java 45 java 730 java 1295 java 105 java 693 java 781 java 752 java 746 java 45 java 730 java 72 java 689 java 560 java 45 java 544 java 73 java 1015 java 675 java 781 java 752 java 746 java 45 java 730 java 72 java 140 java 689 java 781 java 752 java 746 java 45 java 730 java 72 java 140 java 689 java 781 java 752 java 746 java 45 java 730 java 72 java 140 java 689 java 781 java 752 java 746 java 45 java 730 java 72 java 140 java 689 java 781 java 752 java 746 java 45 java 730 java 72 java 51 java 689 java 781 java 752 java 746 java 45 java 730 java 82 java 105 java 64 java 693 java 781 java 752 java 746 java 45 java 730 java 72 java 140 java 689 java 781 java 752 java 746 java 45 java 730 java 72 java 665 java 689 java 781 java 752 java 746 java 45 java 730 java 1099 java 339 java 1062 java 156 java 636 java 339 java 563 java 151 java 155 java 203 java 137 java 107 java 400 java 255 invoke0 Native Method invoke Unknown Source invoke Unknown Source invoke Unknown Source java 659 java 595 java 1501 java 1474  ,3
548410,Preference to hide the Push the current HEAD to Gerrit dialog, My workflow 1   Press Commit and Push   2  Dialog pops up 3   I press  Finish Please make 2   and 3   optional P S  I remember the good old days in which we did not have the dialog  ,3
309003, MWE2  Provide Eclipse Application wrapper for Mwe2Launcher, MWE has a wrapper for the WorkflowRunner as Eclipse IApplication implementation org eclipse emf mwe core WorkflowRunnerApplication  which enabled execution of MWE workflows as headless application  This is necessary for standalone execution of workflows  where components require the workspace or any other Eclipse facilities  Concrete use case is for example generating code from AUTOSAR models with ARTOP Since MWE2 has its own standalone runner this application wrapper is also required for the org eclipse emf mwe2 runtime plugin This should be rather copy paste the other class and add the appropriate plugin xml entry to the org eclipse emf mwe2 runtime plugin  ,3
274928, launcher java class path property is always overrided by eclipse launcher, Build ID  I20080617 2000Steps To Reproduce eclipse launcher will always use startup jar file as its java class path to start jvm   If user use  eclipse  vmargs  Djava class path      jar      jar  to start eclipse or rcp applications  the jar files specific by user will not be passed to jvm See launcher code in eclipse c   Find the startup jar   jarFile   findStartupJar         the startup jarFile goes on the classpath       if  launchMode    LAUNCH JNI          JNI launching  classpath is set using  Djava class path   cp   malloc   tcslen CLASSPATH PREFIX     tcslen jarFile    1    sizeof  TCHAR   cp    tcscpy cp  CLASSPATH PREFIX   tcscat cp  jarFile       The desired behavior  The jars specific by user should be appended to startup jar file  like this   Djava class path startup jar      jar      jar ,3
482448,Provide a way to inspect meta data contained in  git index from repositories view, We could display the meta data available in  git index when the user opens the  git index from the repositories view  This would be awesome for problem analysis jgit pgm s command debug show dir cache can serve as a starting point for the implementation File pathes should be linked to the respective file versions to allow opening an editor ,3
535480,Eclipse Equinox launcher finds unexpected Windows JVM, The behaviour of the launcher doesn t quite match the description in the help  and without the  vm option sometimes finds an old Oracle Java 1 8 JVM instead of a more recent one I know thNo  vm specifiedWhen no  vm is specified  the launcher looks for a virtual machine first in a jre directory in the root of eclipse and then on the search path  If java is found in either location  then the launcher looks for a jvm shared library  jvm dll on Windows  libjvm so on  nix platforms  relative to thIf a jvm shared library is found the launcher loads it and uses the JNI invocation API to start the vm If no jvm shared library is found  the launcher executes the java launcher to start the vm in a new process Code Example of the problem Oracle Java 10 first in the path java  versionjava version  10 0 1  2018 04 17Java TM  SE Runtime Environment 18 3  build 10 0 1 10 Java HotSpot TM  64 Bit Server VM 18 3  build 10 0 1 10  mixed mode Start Eclipse Help  gt  About Eclipse IDE  gt  Installation Details  gt  Configuration vmC  Program Files Java jre1 8 0 171 bin server jvm dllSimilarly if IBM Java 8 is first on the path The problem appears to be in eclipseWin c findLib   which looks in the Windows registry for  Software  JavaSoft  Java Runtime Environment and finds the  CurrentVersion  or first VM  gt  1 6 in the sub keys   By the way   is the version check  gt  1 6 correct for the current launcher  or does it require 1 7 or 1 8 This search is a bit fragile   Oracle Java 10 uses a different key Software  JavaSoft  JDK or Software  JavaSoft  JRE IBM seems to use Software  IBM  Java Runtime Environment or Software  IBM  Java Development Kit for Java 1 8  but different registry keys for Java 1 7 I suspect OpenJ9 uses different keys for Java 10  but I haven t checked The result is thAnother confusion is thSee also  ,3
311716, metatype  Consider optimizing the meta type provider listener,  ,3
232223, ui  consider lowering job priority of IU sizing job, It seems like the sizing job inside a wizard is still really impacting the performance of the operation thI m wondering if the sizing job should be reduced to priority Job DECORATE   This would actually kind of make sense since the size info is not crucial  especially after the user has decided to proceed    We try to cancel the sizing job  but it doesn t really respond to progress monitor cancelling  especially if it is timing out on a connection   ,3
499446,Exception during code completion, Not sure wh   Error Details   Date  Tue Aug 09 15 42 57 CEST 2016Message  Problems occurred when invoking code from plug in   org eclipse text  Severity  ErrorProduct  Eclipse 4 6 0 20160613 1800  org eclipse epp package java product Plugin  org eclipse textException Stack Trace java lang IllegalStateException  startLine  229  does not match endLine  230 java 459 java 5123 java 212 java 182 java 231 java 84 java 5219 java 1340 java 1366 java 1349 java 3382 java 771 java 182 java 1993 java 5819 java 5490  gtk main do event Native Method java 9545 java 1275  gdk window process updates Native Method java 6123 java 313 java 240 java 108 java 396 java 159 java 3376 java 52 java 341 java 202 java 743 java 712 java 696 java 770 java 1101 java 173 java 1119 java 161 java 103 java 1094 java 1119 java 625 java 233 java 7374 java 8225 java 2530 java 6018 java 6049 java 5733 java 84 java 5219 java 1340 java 1366 java 1349 java 1378 java 764 java 3457 java 801 java 2000 java 5819 java 5490  gtk main do event Native Method java 9545 java 1275  g main context iteration Native Method java 2495 java 4141 java 1121 java 336 java 1022 java 150 java 687 java 336 java 604 java 148 java 138 java 196 java 134 java 104 java 388 java 243 invoke0 Native Method java 62 java 43 java 498 java 673 java 610 java 1519 java 1492  ,3
156039, Navigator  incorrect tab order  label captures focus , 3 2in the navigator  select a file  do Ctrl C  Ctrl va dialog opens  press tabobserve  the empty label catches focus  This is incorrect   focus should move to the OK button BTW  jdt ui package explorer has the same problem My platform details     Platform Details     System properties eclipse buildId M20060629 1905eclipse commands  oslinux wsgtk archx86 launcher afs csail group pag software pkg eclipse milestone eclipse nameEclipse showsplash600 exitdata9960005 configuration afs csail mit edu u a akiezun  eclipse config clean vm afs csail group pag software pkg j2sdk 1 5 jre bin javaeclipse ee install verify falseeclipse product org eclipse sdk ideeclipse startTime 1157217085868eclipse vm  afs csail group pag software pkg j2sdk 1 5 jre bin javaeclipse vmargs  Xmx1024M Dosgi checkConfiguration true Dosgi clean true jar afs csail group pag software pkg eclipse milestone startup jareof eoffile encoding ANSI X3 4 1968file encoding pkg sun iofile separator  java awt graphicsenv sun awt X11GraphicsEnvironmentjava awt printerjob sun print PSPrinterJobjava class path  afs csail group pag software pkg eclipse milestone startup jarjava class version 49 0java endorsed dirs  usr lib j2sdk1 5 sun jre lib endorsedjava ext dirs  usr lib j2sdk1 5 sun jre lib extjava home  usr lib j2sdk1 5 sun jrejava io tmpdir  tmpjava library path  usr lib j2sdk1 5 sun jre lib i386 client  usr lib j2sdk1 5 sun jre lib i386  usr lib j2sdk1 5 sun jre    lib i386  usr lib mozilla java runtime name Java TM  2 Runtime Environment  Standard Editionjava runtime version 1 5 0 b64java specification name Java Platform API Specificationjava specification vendor Sun Microsystems Inc java specification version 1 5java vendor Sun Microsystems Inc java vendor url java vendor url bug java version 1 5 0java vm info mixed mode  sharingjava vm name Java HotSpot TM  Client VMjava vm specification name Java Virtual Machine Specificationjava vm specification vendor Sun Microsystems Inc java vm specification version 1 0java vm vendor Sun Microsystems Inc java vm version 1 5 0 b64line separator org osgi framework bootdelegation  org osgi framework executionenvironment OSGi Minimum 1 0 OSGi Minimum 1 1 JRE 1 1 J2SE 1 2 J2SE 1 3 J2SE 1 4 J2SE 1 5org osgi framework language enorg osgi framework os name Linuxorg osgi framework os version 2 6 15 4 csailorg osgi framework processor i386org osgi framework system packages javax accessibility javax activity javax crypto javax crypto interfaces javax crypto spec javax imageio javax imageio event javax imageio metadata javax imageio plugins bmp javax imageio plugins jpeg javax imageio spi javax imageio stream javax management javax management loading javax management modelmbean javax management monitor javax management openmbean javax management relation javax management remote javax management remote rmi javax management timer javax naming javax naming directory javax naming event javax naming ldap javax naming spi javax net javax net ssl javax print javax print attribute javax print attribute standard javax print event javax rmi javax rmi CORBA javax rmi ssl javax security auth javax security auth callback javax security auth kerberos javax security auth login javax security auth spi javax security auth x500 javax security cert javax security sasl javax sound midi javax sound midi spi javax sound sampled javax sound sampled spi javax sql javax sql rowset javax sql rowset serial javax sql rowset spi javax swing javax swing border javax swing colorchooser javax swing event javax swing filechooser javax swing plaf javax swing plaf basic javax swing plaf metal javax swing plaf multi javax swing plaf synth javax swing table javax swing text javax swing text html javax swing text html parser javax swing text rtf javax swing tree javax swing undo javax transaction javax transaction xa javax xml javax xml datatype javax xml namespace javax xml parsers javax xml transform javax xml transform dom javax xml transform sax javax xml transform stream javax xml validation javax xml xpath org ietf jgss org omg CORBA org omg CORBA 2 3 org omg CORBA 2 3 portable org omg CORBA DynAnyPackage org omg CORBA ORBPackage org omg CORBA portable org omg CORBA TypeCodePackage org omg CosNaming org omg CosNaming NamingContextExtPackage org omg CosNaming NamingContextPackage org omg Dynamic org omg DynamicAny org omg DynamicAny DynAnyFactoryPackage org omg DynamicAny DynAnyPackage org omg IOP org omg IOP CodecFactoryPackage org omg IOP CodecPackage org omg Messaging org omg PortableInterceptor org omg PortableInterceptor ORBInitInfoPackage org omg PortableServer org omg PortableServer CurrentPackage org omg PortableServer POAManagerPackage org omg PortableServer POAPackage org omg PortableServer portable org omg PortableServer ServantLocatorPackage org omg SendingContext org omg stub java rmi org w3c dom org w3c dom bootstrap org w3c dom events org w3c dom ls org xml sax org xml sax ext org xml sax helpersorg osgi framework vendor Eclipseorg osgi framework version 1 3 0org osgi supports framework extension trueos arch i386os name Linuxos version 2 6 15 4 csailosgi arch x86osgi bundles org eclipse equinox common 2 start  org eclipse update configurator 3 start  org eclipse core runtime startosgi bundlestore  afs csail mit edu u a akiezun  eclipse config org eclipse osgi bundlesosgi checkConfiguration trueosgi clean trueosgi configuration area file  afs csail mit edu u a akiezun  eclipse config osgi framework file  afs csail mit edu group pag software pkg eclipse 3 2 plugins org eclipse osgi 3 2 0 v20060601 jarosgi framework beginningstartlevel 1osgi framework shape jarosgi framework version 3 2 0 v20060601osgi install area file  afs csail mit edu group pag software pkg eclipse 3 2 osgi instance area file  afs csail mit edu u a akiezun eclipseworkspaces 6883 osgi instance area default file  afs csail mit edu u a akiezun workspace osgi logfile  afs csail mit edu u a akiezun eclipseworkspaces 6883  metadata  logosgi manifest cache  afs csail mit edu u a akiezun  eclipse config org eclipse osgi manifestsosgi nl en USosgi os linuxosgi sharedConfiguration area file  afs csail mit edu group pag software pkg eclipse 3 2 configuration osgi splashLocation  afs csail mit edu group pag software pkg eclipse 3 2 plugins org eclipse platform 3 2 0 v20060601 splash bmposgi splashPath platform  base plugins org eclipse platformosgi syspath  afs csail mit edu group pag software pkg eclipse 3 2 pluginsosgi ws gtkpath separator  sun arch data model 32sun boot class path  usr lib j2sdk1 5 sun jre lib rt jar  usr lib j2sdk1 5 sun jre lib i18n jar  usr lib j2sdk1 5 sun jre lib sunrsasign jar  usr lib j2sdk1 5 sun jre lib jsse jar  usr lib j2sdk1 5 sun jre lib jce jar  usr lib j2sdk1 5 sun jre lib charsets jar  usr lib j2sdk1 5 sun jre classessun boot library path  usr lib j2sdk1 5 sun jre lib i386sun cpu endian littlesun cpu isalist sun io unicode encoding UnicodeLittlesun jnu encoding ANSI X3 4 1968sun management compiler HotSpot Client Compilersun os patch level unknownuser country USuser dir  afs csail mit edu u a akiezunuser home  afs csail mit edu u a akiezunuser language enuser name akiezunuser timezone America New York ,3
