288011,alternate implementation for module wide configs of type String, module wide configs of type String should be declared of type const char   in lieu of const char   both to save space as well as to ensure ththis feature maintains binary backward compatibility     ,1
347006,Front end needs to be designed   refactoring  validation framework  etc , The entire validation framework needs to be redesigned  This will entail  but not limited to  1  Removing the primitive types  Bindings should be created for the external types th2  Make much of the validation extensible  The various stereotypes and annotations for a given part member should register validator classes thIn addition  the refactoring framework will need to come over from RBD  Most  all   of this framework is fairly general  update references  change package names  change imports  etc   Some rework will be needed since EDT will enforce 1 part per file  ,1
283877,improve reuse of Mylyn in server and RCP applications, The Mylyn architecture is intended to support the following layers   Headless  Only core components  capable of running in a headless Equinox runtime  some able to run on a plain Java classpath  RCP  Components like the Task List and Task Editor should be able to run in RCP applications and not require the entire Eclipse SDK  IDE  The rest of Mylyn  which requires the entire Eclipse IDE SDKWe ve had some additional dependencies creep in which prevent some of this reuse  e g   the coupling of org eclipse mylyn tasks ui to org eclipse ui ide   In order to support reuse outside of the IDE  we need to improve on the separation of the layers  ,1
416619,Need to improve  and document  the way feature qualifiers are  auto incremented , And  wouldn t hurt to do the same for bundle qualifiers    This bug  and  yes  it is a bug  not an enhancement request     continues the discussion started in   But in general  we waste too much time having  failed builds  because some qualifier doesn t increment  thus get s  swapped out  by comparator  thus causing failures later since not all qualifiers  line up  or match wh In particular  in bug  it is was stated  Internally Tycho converts qualifiers to commit dates  and  bump version  commit is necessary if multiple qualifier formats are referenced from the same feature  Now  we ve gotten  used to  the fact th But  in  if was a regular code bundle th It appears  from  the outside   th Is there more we can do in Eclipse Platform  For example  if the Orbit bundles are all listed xml  would that then enable the current heuristic to work  Does the heuristic stop trying  as soon as it detects there is a mix of  qualifier types  in a feature  ,1
410597, regression  NPE when querying and configuration is not cached, Steps 1  Connect as anonymous2  Create a query to bring in all reviewsCaused by  java lang NullPointerExceptionjava 261 java 193 java 1 java 234 java 100 java 164 java 158 java 35 java 135     23 moreIf I synchronize tasks that never finishes  Worker 3  prio 5 tid 0x000000010200b000 nid 0x8d03 waiting on condition  0x0000000113ff7000    java lang Thread State  TIMED WAITING  sleeping sleep Native Method java 147 java 107 java 160 java 245 java 218 java 153 java 135 java 225 java 53  ,2
241847, plan   annotation  param annotation matching pointcut does not always match, sources for reproduce caseParam annotation matching pointcut does not always match   I have an interface whose method parameter is annotated   Some implementations  of interface  match the pointcut but other implementations  of same interface  do not match To reproduce              1  Unpack attached sources2  Clean AspectJ project   rebuild3  Run  CC main      Test succeeds  pointcut matches 4  Run  LongLong main     Test fails  pointcut doesn t match Workaround            5  Edit method  LongLong m1    immediately after rebuild 6  Run  LongLong main      Test succeeds My Eclipse environment is                           Eclipse AspectJ Development ToolsVersion  1 5 2 200804241330AspectJ version  1 6 0 20080423100000Eclipse v3 3 2 M20080221 1800 ,2
190604,Allow context providers to be loaded by a unique classloader,  ,2
237158,Provide Performance TestCase, Eike  do you want to me to start a new project for that or I can go in the current test project   Maybe by adding a new package org eclipse emf cdo tests performanceBasically here the first test I will do   X  10 000 Basic Description  This test will tell us the optimal performance of inserting objects and to retrieved them  Test1  Insert X simple objects of the same type  Get X objects of the same type Test2  Insert X simple objects of the same type  Access X 100 objects randomly ChainingDescription  This test will tell us if it takes time to retrieved objects in the database  By crawling many relationship the database will not be able to fetch all objects   Insert X objects linked list    Crawl the linked list of X objectsDescription  Again  some database will fetch too much objects  TO evaluate the cost of such practices  we will not fetch them   Insert a linked list of X elements  Also each of them wll have a list of Y elements   Crawl the linked list of X elements with only accessing the first element This is really basic stuff   but I believe we will be able to optimize at many places   Let me know if you have others ideas  I have many others but I need to start somewhere  Since I already did them for another project    I will be refactoring them  ,2
287176,Provide autoformatting for remote source code, Often  when debugging JS remote source code  it s stripped of all whitespaces and hard to read Debugger could provide an option to auto formIt can be done two ways 1  formatting source code  before  it s loaded by XULRunner2  form ,2
317991,JMX  initializeIdentityMap className  requires unset EMPTY STRING input validation handler to avoid ClassNotFoundException,   we need to warn on or introduce an input validation handler when there is no user imput from the MBean jconsole http UI  outside of any management UI wrapper around the bean   this is likely a problem with the other functions that accept inputsourceObject    id 460  RunTimeServices    public synchronized void initializeIdentityMap String className  throws ClassNotFoundException  Daemon Thread  http 127 0 0 1 8080 2   Suspended  breakpoint at line 437 in ConversionManager  JPAConversionManager ConversionManager  convertObjectToClass Object  line  437JPAConversionManager ConversionManager  convertObject Object  Class  line  141MBeanJBossRuntimeServices JBossRuntimeServices  initializeIdentityMap String  line  1274NativeMethodAccessorImpl invoke0 Method  Object  Object    line  not available  native method NativeMethodAccessorImpl invoke Object  Object    line  39DelegatingMethodAccessorImpl invoke Object  Object    line  25Method invoke Object  Object     line  597ReflectedDispatcher invoke Invocation  line  157Invocation dispatch   line  96Invocation invoke   line  88XMBean AbstractMBeanInvoker  invoke String  Object    String    line  264MBeanServerImpl invoke ObjectName  String  Object    String    line  668Server invokeOpByName String  String  String    String    line  258Server invokeOp String  int  String    line  223HtmlAdaptorServlet 3 run   line  380HtmlAdaptorServlet 3 run   line  377AccessController doPrivileged PrivilegedExceptionAction lt T gt   line  not available  native method HtmlAdaptorServlet invokeOp String  int  String    line  376HtmlAdaptorServlet invokeOp HttpServletRequest  HttpServletResponse  line  287HtmlAdaptorServlet processRequest HttpServletRequest  HttpServletResponse  line  104HtmlAdaptorServlet doPost HttpServletRequest  HttpServletResponse  line  86HtmlAdaptorServlet HttpServlet  service HttpServletRequest  HttpServletResponse  line  637HtmlAdaptorServlet HttpServlet  service ServletRequest  ServletResponse  line  717ApplicationFilterChain internalDoFilter ServletRequest  ServletResponse  line  290ApplicationFilterChain doFilter ServletRequest  ServletResponse  line  206ReplyHeaderFilter doFilter ServletRequest  ServletResponse  FilterChain  line  96ApplicationFilterChain internalDoFilter ServletRequest  ServletResponse  line  235ApplicationFilterChain doFilter ServletRequest  ServletResponse  line  206StandardWrapperValve invoke Request  Response  line  235StandardContextValve invoke Request  Response  line  191SecurityAssociationValve invoke Request  Response  line  190BasicAuthenticator AuthenticatorBase  invoke Request  Response  line  525JaccContextValve invoke Request  Response  line  92SecurityContextEstablishmentValve process Request  Response  HttpEvent  line  126SecurityContextEstablishmentValve invoke Request  Response  line  70StandardHostValve invoke Request  Response  line  127ErrorReportValve invoke Request  Response  line  102CachedConnectionValve invoke Request  Response  line  158StandardEngineValve invoke Request  Response  line  109CoyoteAdapter service Request  Response  line  330Http11Processor process Socket  line  829Http11Protocol Http11ConnectionHandler process Socket  line  598JIoEndpoint Worker run   line  447Thread run   line  61909 41 02 727 ERROR   HtmlAdaptor   Servlet service   for servlet HtmlAdaptor threw exceptionjava lang ClassNotFoundException  forName0 Native Method java 247 java 437 java 141 java 1274 invoke0 Native Method java 39 java 25 java 597 java 157 java 96 java 88 java 264 java 668 java 258 java 223 java 380 java 377 doPrivileged Native Method java 376 java 287 java 104 java 86 java 637 java 717 java 290 java 206 java 96 java 235 java 206 java 235 java 191 java 190 java 525 java 92 java 126 java 70 java 127 java 102 java 158 java 109 java 330 java 829 java 598 java 447 java 619 ,2
343162, AttributeOverrides gives me exception, Build Identifier  2 2 0 v20110202 r8913The AttributeOverrides gives me an excpetion in the following scenario class A have a field mapped with  AttributeOverridesclass B extends A and have another field of the same type mapped using  AttributeOverridesThis mapping throws an exception everytime I try to perform a simple query for B I ve attached a full example and the stacktrace Reproducible  Always ,2
378313,In Symfoware  a subquery cannot be specified on both sides of a comparison predicate or a quantified predicate , Build Identifier  In Symfoware V10  a subquery cannot be specified on both sides of a comparison predicate or a quantified predicate  This issue affects JPA test lrg Reproducible  AlwaysSteps to Reproduce 1 setup Symfoware database server 10 02 configure jdbc driver of Symfoware3 run test lrg in the jpa eclipselink jpa test directory ,2
201692,Include the Eclipse Workbench User Guide into the Online Help,  ,2
508466,Get completion filtering on content,   mandatory reading as it contains a better description of the issue and some links to related ones The completion returned by the CSS LanguageServer from VSCode seems to ignore the  prefix  of the completed word to process  ,2
220970,provide option for hiding old completed tasks,  ,2
272187, api  provide a way to mark a task as read,  ,2
399444, e4  restoring of editor state failed, What steps will reproduce the problem 1  Made another task active2  3     Error Details   Date  Tue Jan 29 14 01 07 PST 2013Message  Restoring of editor state failedSeverity  ErrorProduct  Eclipse 1 5 1 20121004 1506  org eclipse epp package java product Plugin  org eclipse mylyn context uiSession Data eclipse buildId M20120914 1800java version 1 7 0 11java vendor Oracle CorporationBootLoader constants  OS linux  ARCH x86 64  WS gtk  NL en USFramework arguments    product org eclipse epp package java productCommand line arguments    os linux  ws gtk  arch x86 64  product org eclipse epp package java productException Stack Trace java lang reflect InvocationTargetExceptioninvoke0 Native Method java 57 java 43 java 601 java 416 java 367 java 128 java 114 java 1 java 93 java 42 java 85 java 110 java 62 java 115 java 688 java 42 java 679 java 180 java 75 java 479 java 30 java 86 java 70 java 52 java 290 java 76 invoke Unknown Source java 43 java 601 java 56 java 231 java 212 java 131 java 171 java 561 java 1231 java 1277 java 130 java 895 java 220 java 84 java 1276 java 3562 java 3186 java 1045 java 332 java 940 java 86 java 587 java 332 java 542 java 149 java 124 java 196 java 110 java 79 java 353 java 180 invoke0 Native Method java 57 java 43 java 601 java 629 java 584 java 1438 java 1414 Caused by  org eclipse ui MultiPartInitException  No input factory ID found for editor id null name nulljava 4435     67 more ,2
291637,Need uniformity in projects repository site URLs, Currently  projects use lots of different URLs for their project update sites  I ll attach a screen shot from Galilio SR1  after the site had been contacted once  to retrieve content metadata  To give an idea of the variety  here s the ending segment of a fewupdatesreleasese3 4update site3 52 51 0 1 stablemilestoneproject search searchSome of these look like project specific errors  but the point of this cross project bug is th So  first of all  it looks pretty unprofessional  and hardly  coordinated   Second  there s an issue of if it  should  be version specific or if there should just be one URL per project  and that one URL give access to any available updates  I m not sure of the right answer  but wanted to open this bug for comment and suggestions so we can do better for Helios  ,2
437069,make runtests sh  and other files  identical in  production  as in test package,  noticed a number of differences between the version in  production  directory  vs  the one packaged with unit tests  This bug will be used to both track making sure they are  the same      and cleaned up  By  cleaned up  I notice they  both set  vmcmd       but I believe that s set in other places too  So should probably be set in just one place   just as a potential example   ,2
230699,IMP editor not entirely robust w r t   New Editor  command,  gt  The editors don t seem to fully support multiple instances of the same file  right click  new editor  on any editor pane   Quickly pasting content into a duplicated editor seems to break it From SMS I tried this in a level 3 workspace with a LEG IDE on the usual example and didn t have any problem    New Editor  correctly brought up a new editor with the current file with no problems  and when I tried immediately copying text into new editor I again didn t have any problems   I ll try to find out more from Lennart     ,2
458536,Edapt launch configuration layout has huge width, When creating a new edapt launch configuration  the launch configuration dialog suddenly re layouts to use the full 1920 pixels of monitor width I have available For me this happens on Windows7  which normally deals much better with missing or otherwise bad SWT layout configuration details than GTK   ,2
457623,IllegalArgumentException computing proposals for inner class field in display view,   changed a bit  public class MyClass    public Runnable m1        return new Runnable          private int innerClassField       public void run            innerClassField        lt  lt  breakpoint goes here                    public static void main String   args   MyClass mc   new MyClass   mc m1   run     If you open the Display view  enter  inner  and activate content assist  you get the following exception  java lang IllegalArgumentExceptionjava 589 java 912 java 856 java 2638 java 619 java 573 java 49 java 245 java 6444 java 6579 java 11835 java 3295 java 1713 java 2083 java 131 java 91 java 79 java 145 java 1904 java 42 java 1902 java 573 java 570 java 505 java 70 java 499 java 1720 java 967 java 52 java 288 java 90 invoke0 Native Method invoke Unknown Source invoke Unknown Source invoke Unknown Source java 55 java 247 java 229 java 132 java 149 java 499 java 508 java 210 java 286 java 507 java 558 java 378 java 324 java 86 java 84 java 1262 java 1060 java 1085 java 1070 java 1112 java 1108 java 1529 java 4746 java 343 java 4627 java 339 java 5042 CallWindowProcW Native Method java 2443 java 640 DispatchMessageW Native Method java 2549 java 3759 java 1151 java 337 java 1032 java 156 java 648 java 337 java 592 java 150 java 138 java 196 java 134 java 104 java 380 java 235 invoke0 Native Method invoke Unknown Source invoke Unknown Source invoke Unknown Source java 648 java 603 java 1465 The exception occurs with and without the fix from  ,3
114763, DCR  warn on potentially infinite loops, In the following code class X    boolean bar        return true      void foo        for             if  bar             return                 the for loop exits by a side effect  return  instead of exiting when itscondition becomes false  Some developers consider this  and equivalent patternswith while and do statements  as bad practice  A warning could be issuedwhenever the loop condition consistently evaluates to true  before the firstloop iteration and after all subsequent iterations  ,3
545436,Expression view not showing values outside of anonymous functions, Short exampleWhen debugging an anonymous function  the expression view cannot display the values of variables which are in the outer scope  outside of the anonymous function  Example private static void fubar JButton button  String text   button addActionListener  ActionEvent e    gt   System out println  text     text      When debugging and stopping Full example is attached  ,3
548688,The method toCollection Supplier lt C gt   in the type Collectors is not applicable for the arguments  JSONArray  new , Simple maven project with problematic codeAttached code works from command line and from other IDE s ,3
510229,Eclipse hangs on startup in  Loading org eclipse ltk ui refactoring , Threaddump when eclipse hangsInstalled eclipse 4 7M4 on macOS 10 12  added two plugins  eclipse git team provider and eclipse maven integration  afterwards I imported some local git repos and some local java projects After some restarts  Eclipse started to hang on startup  splash screen was showing  Loading org eclipse ltk ui refactoring  Deleting the workspace xmi solves the issue  it will restart every time   however as soon as I e g  open a java file in the editor  exit eclipse  it will reproducebly hang as described above Attached is a threaddump  and two workspace xmi  one which is working fine  the other one just differing in the fact thRegards Dieter ,3
475630,AssertionFailedException in JavaCore newContainerEntry  JavaCore java 4506 , The following incident was reported via the automated error reporting     code                    0    plugin                  org eclipse ui 3 107 0 v20150507 1945    message                 Unhandled event loop exception    fingerprint             cb0c96eb    exception class         org eclipse jdt internal core ClasspathEntry AssertionFailedException    exception message       Container path cannot be null    number of children      0        org eclipse jdt internal core ClasspathEntry AssertionFailedException  Container path cannot be null    java 4506     java 4392     java 705     java 791     java 49     java 48     java 824     java 57     java 71     java 117     java 133     java 83     java 1372     java 353     java 906     java 617     java 815     java 70     java 791     java 611     java 762     java 1493     java 903     java 1505     java 132     java 84     java 4362     java 1113     java 1137     java 1122     java 7633     java 5690     java 1956     java 5242     java 4718     java 5050     java  2     java 2443     java 1553     java 6501     java 4698     java 6024     java 5050     java  2     java 2549     java 3767     java 827     java 803     java 77     java 170     java 595     java 511     java 420     java 84     java 4362     java 1113     java 4180     java 3769     java 1127     java 337     java 1018     java 156     java 654     java 337     java 598     java 150     java 139     java 196     java 134     java 104     java 380     java 235     invoke0 null  2     invoke null  1     invoke null  1     invoke null  1     java 669     java 608     java 1515      General Information     reported by       Ronnie Henriksen    anonymous id      786626b3 dcd5 4b93 b5a4 905f90f867b9    eclipse build id  4 5 0 I20150603 2000    eclipse product   org eclipse epp package java product    operating system  Windows7 6 1 0  x86 64    win32    jre version       1 8 0 45 b15The following plug ins were present on the execution stack         1  org eclipse core databinding observable 1 5 0 v20150422 0725    2  org eclipse core databinding 1 5 0 v20150422 0725    3  org eclipse core runtime 3 11 0 v20150405 1723    4  org eclipse debug core 3 10 0 v20150303 1130    5  org eclipse debug ui 3 11 0 v20150514 0917    6  org eclipse e4 ui workbench 1 3 0 v20150531 1948    7  org eclipse e4 ui workbench swt 0 13 0 v20150504 0621    8  org eclipse equinox app 1 3 300 v20150423 1356    9  org eclipse equinox launcher 1 3 100 v20150511 1540    10  org eclipse jdt core 3 11 0 v20150602 1242    11  org eclipse jdt 3 11 0 v20150603 2000    12  org eclipse jdt launching 3 8 0 v20150527 0946    13  org eclipse jface 3 11 0 v20150602 1400    14  org eclipse swt 3 104 0 v20150528 0211    15  org eclipse ui 3 107 0 v20150507 1945    16  org eclipse ui ide application 1 1 0 v20150422 0725    17  org eclipse ui ide 3 11 0 v20150510 1749Please note that   Messages  stacktraces  and nested status objects may be shortened   Bug fields like status  resolution  and whiteboard are sent  back to reporters   The list of present bundles and their respective versions was  calculated by package naming heuristics  This may or may not reflect reality Other Resources   Report      Manual  Thank you for your assistance Your friendly error reports inbox  ,3
525863,when traversing through a project directory  sub directories take forever to open  sometimes forced to quit, version Eclipse Java EE IDE for Web Developers Version  Neon Release  4 6 0 steps to repro 1  start up eclipse 2  go to a project 3  go through a directory to get to a java fileActual results eclipse hangsstack trace in  home knassiri workspace  metadata  logENTRY org eclipse equinox event 4 0 2017 07 11 14 24 33 135 MESSAGE Exception while dispatching event org osgi service event Event  topic org eclipse e4 ui model ui UIElement visible SET   ChangedElement org eclipse e4 ui model application ui menu impl ToolBarImpl 2b2a4332  elementId  org eclipse jdt junit ResultView  tags      contributorURI  null   widget  ToolBar     renderer  org eclipse e4 ui workbench renderers swt ToolBarManagerRenderer 7f6936cc  toBeRendered  true  onTop  false  visible  false  containerData  null  accessibilityPhrase  null   org eclipse e4 data  ChangedElement org eclipse e4 ui model application ui menu impl ToolBarImpl 2b2a4332  elementId  org eclipse jdt junit ResultView  tags      contributorURI  null   widget  ToolBar     renderer  org eclipse e4 ui workbench renderers swt ToolBarManagerRenderer 7f6936cc  toBeRendered  true  onTop  false  visible  false  containerData  null  accessibilityPhrase  null   AttName visible  EventType SET  OldValue true  Widget ToolBar     NewValue false   AttName visible  EventType SET  OldValue true  Widget ToolBar     NewValue false  to handler org eclipse e4 core di internal extensions EventObjectSupplier DIEventHandler 54c543a5 STACK 0org eclipse e4 core di InjectionException  java lang IllegalArgumentException  Argument not valid        java 64         java 80         java 201         java 197         java 1         java 230         java 148         java 135         java 78         java 39         java 94         java 60         java 374         java 345         java 782         java 1004         java 856         java 846         java 841         java 42         java 825         java 173         invoke Unknown Source         java 43         java 498         java 54         java 80         java 201         java 197         java 1         java 230         java 148         java 135         java 78         java 39         java 94         java 60         java 374         java 303         java 1350         java 1284         java 340         java 324         java 551         java 629         java 99         java 84         java 5219         java 1340         java 1366         java 1349         java 669         java 1303         java 1983         java 5819         java 5490          gtk main do event Native Method         java 9545         java 1275          g main context iteration Native Method         java 2495         java 4141         java 1121         java 336         java 1022         java 150         java 687         java 336         java 604  ,3
484396,Eclipse fails to find implementations of interface methods inherited from another class, Use the below snipped to reproduce this problempublic interface Foo  void bar    public  class AbstractFoo  public void bar     public class FooImpl extends AbstractFoo implements Foo  public class TestImpl  Foo foo public void test     Do ctrl mouse hover and click open implementations    Eclipse will not be able to find implementation inherited from AsbtractFoofoo bar     Here eclipse correctly determines th Marking this as major  although I am inclined to mark it as critical  as you would expect this simple functionality to be working in any java IDE  ,3
389671,Compiler fails to identify overloaded methods with mildly ambiguous generic signatures, The below classes generate an error in Eclipse despite compiling fine via javac public class Test    interface A lt B gt       void x Test2 pType  B    mediaObject      void x Test2 pType  String text  int offset       void foo    bar   x Test2 X         A lt   gt  bar    return null   public enum Test2  X  ,3
