344527,ClassCastException when doubliclicking  o file inside  archive , Build Identifier  3 6 2When a proiject is imported and the ELF binary parser is enabled some archived are visible in the project explorer  After expanding an archive and double clicking on an  o file the following exception is thrown java lang ClassCastException  org eclipse core internal resources File cannot be cast to org eclipse core resources IContainerjava 66 java 82 java 659 java 1132 java 197 java 124 java 148 java 313 java 779 java 277 java 497 java 162 java 42 java 49 java 175 java 160 java 2162 java 1190 java 1220 java 228 java 222 java 389 java 84 java 1053 java 4066 java 3657 java 2640 java 2604 java 2438 java 671 java 332 java 664 java 149 java 115 java 196 java 110 java 79 java 369 java 179 invoke0 Native Method java 39 java 25 java 597 java 620 java 575 java 1408 java 1384 Reproducible  Always ,3
223263, assist  change content assistance for enum inside switch from alphabetical order to ordinal order , Enter the following code enum State    BEFORE  DURING  AFTER  public void foo State state     switch state       case    Cursor Here    Press CTRL space  The order of the content assist is in alphabetical order  AFTER  BEFORE and then DURING  BEFORE  DURING  AFTER would be better  ,3
527164,MetadataResourceFactoryImpl   xml  registration breaks EMF applications, MAJOR since this is an inter project interference org eclipse cbi p2repo aggregator git tree org eclipse cbi p2repo p2 maven plugin xml provides a org eclipse emf ecore extension parser registration for  xml  thThe  xml  extension is shared globally  You MUST use contentTypes to have extennded  xml  behaviours  see the UML2 definitions pain  An XMI file content may start lt  xml version  1 0  encoding  UTF 8   gt  lt umlmmmi Package xmi version  2 0  xmlns xmi      umlMM emof umlmmmi  xmi id   pqqNkELpEdu4D7MpmOwj g  name  transport  gt EMF understands XMI and so understands xmi version on line 2 MetadataResourceFactoryImpl does not and so opening an XMI file with the Sample Ecore Model Editor gives org eclipse emf ecore xmi FeatureNotFoundException  Feature  version  not found   platform  resource org eclipse qvtd xtext qvtrelation tests models mitosi samples transportuml xml  2  360 java 2045 java 2009 java 2761 java 77 java 2247 java 1384 java 1522 java 1044 java 1026 java 720 java 509 java 745 java 1359 java 1289 java 3132 java 852 java 602 java 505 java 841 java 770 java 141 java 1213 java 643 java 327 java 175 java 261 java 1518 java 1297 java 259 java 274 java 406 java 1168 java 1266 java 1336 java 348 java 151 java 99 java 355 invoke Unknown Source java 43 java 498 java 55 java 990 java 955 java 124 java 399 java 318 java 162 java 105 java 74 java 56 java 129 java 992 java 661 java 767 java 738 java 732 java 42 java 716 java 1293 java 68 java 40 java 233 java 144 java 4889 java 212 java 36 java 201 java 196 java 1 java 230 java 148 java 135 java 78 java 39 java 52 java 60 java 374 java 173 java 620 java 584 java 769 java 401 java 1214 java 3261 java 3176 java 3158 java 70 java 3153 java 3117 java 323 java 211 java 86 java 4428 java 1079 java 4238 java 3817 java 1150 java 336 java 1039 java 153 java 680 java 336 java 594 java 148 java 151 java 196 java 134 java 104 java 388 java 243 invoke0 Native Method java 62 java 43 java 498 java 653 java 590 java 1499 java 1472  ,3
445250,Eclipse c c   mark syntax errors while compiling and running the program fine with no errors, Eclipse mark line as syntax errors while there are no errors in buildHi  while i am working on Ubuntu 14 04    Eclipse Luna C C   IDEi wrote this program include  lt stdio h gt  include  lt math h gt  define RAD TO DEG  180  4   atanl 1      generic square root function define SQRT X   Generic  X       long double  sqrtl       default  sqrt       float  sqrtf  X    generic sine function  angle in degrees define SIN X   Generic  X   long double  sinl  X  RAD TO DEG   default      sin  X  RAD TO DEG   float        sinf  X  RAD TO DEG   int main void      flo0f     double xx   45 0     long double xxx  45 0L     long double y   SQRT x      long double yy  SQRT xx      long double yyy   SQRT xxx      printf    17Lf n   y        matches float    printf    17Lf n   yy       matches default    printf    17Lf n   yyy      matches long double    int i   45     yy   SQRT i                 matches default    printf    17Lf n   yy      yyy  SIN xxx                matches long double    printf    17Lf n   yyy      return 0  9 default compiler and it supports C11 Generic feature   and i have build compiler run everything is fine but the eclipse mark some line of my code as syntax error while no errors appeared in the build and compile i don t know why  i have attached a screen shot to the eclipse after running the program successfully  but stil the code or the editor mark syntax errors like  syntax error        symbol y cannot be resolved on line 29  30  31   34  36 if you move the mouse on the syntax mark it will say symbol y  yy  yyy cannot be resolved on line ,3
426924, Refactoring  Renaming function to a pointer shouldn t be allowed, Eclipse IDE for C C   DevelopersVersion  Kepler Service Release 1Build id  20130919 0819Reproducing the bug Consider the following code          Original Version         int GlobalVar 0   0 int func 0       return GlobalVar 0  int Function 0        return GlobalVar 0                                    Now  let s rename the function  func 0  to   func 0 Applying the refactoring            Refactored             int GlobalVar 0   0 int  func 0       return GlobalVar 0  int Function 0        return GlobalVar 0                                   The tool shouldn t allow to apply invalid transformations like this  Notice thThanks in advance  ,3
227798,Traditional Rendering  Provide a way to quickly overwrite the entire table cell when editing,  ,3
123475,Editor view should provide better feedback when in function with no symbolic info, If you select a frame in the Debug view that s associated with a function with no symbolics info  the editor view does not update  As such  it seems to the user thTo reproduce the problem  create a simple Cygwin CDT projects thNote thAlso  note th ,3
375203,Provide JUnits to test launch cancellations,  it was suggested to add JUnit tests to validate proper cancellation of the DSF GDB launchers  Here is Marc s reply Absolutely   But I don t know how   These cancellations are triggered bycancelling a Dialog and we don t have JUnit tests th  This isactually something that is a big lack in our JUnit coverage  there is a bunchof logic thI ve noticed th  I haven t hadtime to investigate  but I would really like for DSF to have such tests  ,3
460598, Breakpoint insertion failure  when setting breakpoint after getline   on Windows, MinGW GDB dies with at SIGINTI encounter a reproducible failure of GDB when using MinGW or MinGW w64 on Windows Affects   eclipse cpp luna SR1a win32 x86 64  stable release  mingw64 x64 4 8 1 release posix seh rev5  most recent release  mingw64 x86 64 4 9 2 release posix seh rt v3 rev1  MinGW from C  mingw32 bin gt gcc  vUsing built in specs COLLECT GCC gccTarget  mingw32Configured with     gcc 4 6 2 configure   enable languages c c   ada fortran objc obj c     disable sjlj exceptions   with dwarf2   enable shared   enable libgomp   disable win32 registry   enable libstdcxx debug   enable version specific runtime libs   build mingw32   prefix  mingwThread model  win32gcc version 4 6 2  GCC C  mingw32 bin gt gdb  vGNU gdb  GDB  7 4  Windows 7 64bitPlease note  thTest code  code int main int argc  char   argv      string line     getline cin  line      printf  your line   s n   line c str        return 0    code Steps to reproduce   Build the code with one of the Toolchains mentioned above  using  std c  0x   Launch the program in debug mode   Let it run till getline   is called  Insert a breakpoint at the printf   lineActual Result The program does not respond to user input  GDB does not respond to interrupt or any other commands  An error is thrown   Breakpoint installation failed  Breakpoint insertion failure Significant lines of GDB output  code 132 543 31 exec continue   thread 1132 547 31 running132 547  running thread id  all 132 547  gdb 134 596  thread created id  2  group id  i1 134 598    New Thread 3880 0x1258  n 134 598  running thread id  all 134 602    nProgram received signal  134 602   SIGINT  Interrupt  n 134 603    Switching to Thread 3880 0x1258  n 134 605   0x0000000076ca49f2 in KERNEL32 CtrlRoutine    from C   Windows  system32  kernel32 dll n 134 605  stopped reason  signal received  signal name  SIGINT  signal meaning  Interrupt  frame  add r  0x0000000076ca49f2  func  KERNEL32 CtrlRoutine  args    from  C   Windows  system32  kernel32 dll    thread id  2  stopped threads  all 134 607  thread selected id  2 134 607  gdb 134 607 32 break insert  f D   app  main cpp 147  code Expected Result Successfully tested with GDB on CMD   Open CMD and change to directory containing the executable  Start executable and look up its process number   lt PID gt    Open another CMD and start GDB  In GDB execute the following commands code attach  lt PID gt break D   app  main cpp 147continue  code   Switch to first CMD and enter a line and hit  lt Enter gt  key  Switch back to GDB  you should see sth  like  code Breakpoint 1  main  argc 1  argv 0x4dfe20     cpp 147147             printf  your line   s n   line c str      code   Now you can step through the rest of the program by entering stepReferences I selected the Toolchain following the    Qt Project recommondations I found a mailing list thread thThere is a bug report related to this mailing list thread      Use GDB async mode for GDB 7 0I m not sure if this bug is related I posted about this issue in the eclipse forums and asked for confirmation  but after 3 days and no reply I decided to report this as a bug Currently to me it looks like developing Windows applications on Windows using MinGW and Eclipse CDT is impossible Please tell me if I am doing something wrong  ,3
522521,In a debug configuration  shared libraries paths are not taken into account, the gdb shared libraries optionIn a debug configuration  in shared libraries option  directories with libraries selected are not taken into account   gdb doesn t load symbols of selected libraries  whereas   Load shared library symbols automatically  unchecked works well My version      Eclipse IDE for C C   Developers Version  Neon 3 Release  4 6 3  Build id  20170314 1500    Eclipse C C   Development Tools Version  9 2 1 201704050430 ,3
487507,NPE when create new ARM Eclipse project, 0  Install arm none eabi gcc into system1  Install GNU Arm plugin from  2  Create new  C Project    gt  Executable   gt  STM32F4xx C C   Project  Use all default settings  3  On last screen click Finish Logs  SESSION 2016 02 09 15 34 28 744                                                eclipse buildId 4 5 1 v20160106 1000java version 1 8 0 73java vendor Oracle CorporationBootLoader constants  OS linux  ARCH x86 64  WS gtk  NL en USCommand line arguments    os linux  ws gtk  arch x86 64 ENTRY org eclipse cdt ui 4 4 2016 02 09 15 35 13 424 MESSAGE Project cannot be created STACK 0java lang NullPointerExceptionjava 129 java 163 java 219 java 65 java 192 java 108 java 2241 java 130 java 202 java 639 java 559 java 259 java 70 java 108 java 2241 java 130 java 463 java 371 java 1002 java 268 java 162 java 154 java 35 java 135 java 3806 java 3445 java 172 java 387 java 1002 java 177 java 155 java 193 java 799 java 429 java 619 java 248 java 84 java 4493 java 1329 java 3831 java 3442 java 827 java 803 java 115 java 473 java 595 java 511 java 420 java 84 java 4493 java 1329 java 3831 java 3442 java 1127 java 337 java 1018 java 156 java 654 java 337 java 598 java 150 java 139 java 196 java 134 java 104 java 380 java 235 invoke0 Native Method java 62 java 43 java 497 java 669 java 608 java 1515 java 1488  ,3
120700,use IDE console window while debugging, Is there a way to use eclipse IDE console  instead of new command window  for C C   program standard input output when debugging  using GDB    just like when debugging java program  Now  I need to switch between windows while debugging and watching intermediate output  I was searching quite a lot on bugzilla but couldn t find solution  ,3
367723,Files generated by the compiler are immediately delete by the builder, Build Identifier  Version  Indigo Service Release 1 Build id  20110916 0149When I build a C project  I can see compilations launched in the console view  but each ends with an error  but no message  and no file generated  gcc  O0  g3  Wall  c  fmessage length 0  o src Hello o    src Hello cBuild error occurred  build is stoppedTime consumed  125  ms So I investigated to understand whI launched the compilation outside Eclipse  using the same command line as in the console view  It worked  And in verbose mode  outputs are also identical inside or outside Eclipse  except for the temporary file name of course   So  compiler  project and command line are fine I embedded the command line in a shell  in order to have more control on wh If there is more than one source file in the project  compilation is launched for each one  but generated files are deleted after each  not together after the last source file So  the problem seems to occur during the build process and due to it Reproducible  AlwaysSteps to Reproduce 1  Create a new  Hello World ANSI C Project  with  Cygwin GCC  or  MinGW GCC  toolchain 2  Build the project  using the  v option of the compiler helps to be sure of which one is used  The output directory  Debug  contains only a src subdirectory and no generated files  ,3
341591,Problems exporting include paths and symbols to XML file in project  folder or file properties, I ve got a project where I ve set different include directories and symbols for different subdirectories in the project  I tried to export these settings using  Project Properties  gt  C C   General  gt  Paths and Symbols  gt  Export Settings     Unfortunately the XML file thI also tried to export the settings to an XML file on a per directory basis using  Directory Properties  gt  C C   General  gt  Paths and Symbols  gt  Export Settings      Unfortunately the  Export Settings     and  Import Settings     buttons for  per directory  properties don t even bring up the  Export   Import  windows  clicking them seems to do absolutely nothing   ,3
425488,Overly strong condition when attempting to rename a variable, Version Eclipse IDE for C C   DevelopersVersion  Kepler Service Release 1Build id  20130919 0819Reproducing the bug Consider the following code                Original Version                 define Aint main int argc  char   argv       int a     Variable to be renamed ifdef A    a   1  else    a   2 endif    return a                                                 Now  let s try to rename the selected variable to  b   Since there aren t any other declaration named  b   it should produce the following result               Suggested Version                define Aint main int argc  char   argv       int b  ifdef A    b   1  else    b   2 endif    return b                                                 However  the refactoring tool doesn t allow to apply the transformation  overly strong constraints  Thanks in advance ,3
522302, JPA 2 2  Missing project facet and false error for persistence xml, If I switch my project to EclipseLink 2 7 0  which includes JPA 2 2  and change the XSD and version in my persistence xml to 2 2 I get the following error although my web app and JUnit tests are still running fine The persistence xml file does not have supported content for this JPA platform Additionally there is no version 2 2 for JPA project facets  only 1 0  2 0 and 2 1 are displayed  I m running Eclipse Oxygen Release  4 7 0  with JDK 1 8 0 131  x86  with all the latest plugins installed persistence xml  lt persistence xmlns       xmlns xsi       xsi schemaLocation                    version  2 2  gt      lt persistence unit name  test  transaction type  RESOURCE LOCAL  gt          lt provider gt org eclipse persistence jpa PersistenceProvider lt  provider gt          lt exclude unlisted classes gt false lt  exclude unlisted classes gt          lt shared cache mode gt NONE lt  shared cache mode gt              lt  persistence unit gt      lt  persistence gt  ,3
425467,Changing behavior when renaming function  using the   operator , Eclipse IDE for C C   DevelopersVersion  Kepler Service Release 1Build id  20130919 0819Reproducing the bug Consider the following code                Original Version                int x int a       function to be renamed    return a  int main int a  char   argv       return x a                                                  After applying the refactoring  we have the resulting code               Refactored Version               int   x int a       renamed function    return a  int main int a  char   argv       return   x a                                                  The refactoring tool allows to rename the function  x  with the invalid identifier    x   Notice thThe refactoring tool and compiler don t complain about  leading to a Segmentation Fault when attempting to execute the resulting program Thanks in advance  ,3
425466,Compilation error when renaming function with invalid name, Eclipse IDE for C C   DevelopersVersion  Kepler Service Release 1Build id  20130919 0819Reproducing the bug Consider the following code                Original Version                int main int a  char   argv       Function  main  to be renamed to  main a     return a                                                 After applying the refactoring  we have the resulting code               Refactored Version               int main a int a  char   argv       Renamed function    return a                                                 The refactoring tool allows to rename functions with invalid names  like the invalid identifier  main a   leading to a lexical error  A suggestion would be checking if the proposed rename is a well formed name Thanks in advance  ,3
509732,Content assist does not work inside macro invocation, In the following code  define DEFINE FUNC      void foo       VA ARGS    struct Waldo      void find     DEFINE FUNC     Waldo w     w    invoke content assist here            if content assist is invoked I would expect find   to be offered as a completion proposal  ,3
521469,template specializations inside class scope aren t allowed by the standard, struct A    template lt int I gt   struct Test     template lt  gt   struct Test lt 0 gt         lt   not allowed  the template specialization should be marked as a syntactic problem If only I knew where when to catch the erroneous declaration I would prepare a fix  Is it the parser itself or is there some AST visitor that is collecting such things  ,3
539391,With the faster release cycle  will the eclipse release update site get auto updated , I couldn t find an answer to this  and I hope it s the right place to ask When 2018 12 is out  will there be an option to auto update my 2018 09 to use the new Eclipse release update site  Or do we need to change that manually every quarter  if we want to keep on the leading edge best regards Vlad ,3
346011, performance  ProblemsLabelDecorator causes slowness when editing large files, Here is a typical call stack captured while the UI thread was unresponsive  main  prio 10 tid 0x0a016400 nid 0x355c runnable  0xff8bd000    java lang Thread State  RUNNABLEat  C C      kernel vsyscall     so  so  so  so  so  so  intern Native Method java 133 java 107 java 109 java 222 java 207 java 175 java 144 java 133 java 149 java 184 java 167 java 91 java 65 java 116 java 97 java 351 java 326 java 183 java 35 java 134   locked  lt 0x907dfc30 gt   a org eclipse swt widgets RunnableLock java 3515 java 3164 java 2644 java 2606 java 2440 java 683 java 332 java 676 java 149 java 115 java 196 java 110 java 79 java 369 java 179 at  C C     fini Unknown Source invoke0 Native Method java 57 java 43 java 616 java 619 java 574 java 1407  ,3
478957,Can you provide Dali Java Persistence Tool in zipped P2 repository alone as well , Can you provide Dali Java Persistence Tool in zipped P2 repository alone as well Such as JDT Runtime Repo in    etc Thanks  ,3
344601,Inconsistent behaviour of the Project Explorer view  when displaying Java EE web artifacts, Build Identifier  20110218 0911I am using 32 bit Windows XP SP 3  and the latest 1 6 0 25 JDK  I am using thelatest Eclipse IDE for Java EE developers   Helios SR2  for Windows 32 bit  Theproblem is about the Project Explorer view  in the Java EE perspective  It isrelated with the way thReproducible  AlwaysSteps to Reproduce 1  Create a new Dynamic Web Project  version 2 4  choose the Java EE perspective2  Create several types of web components  servlet  filter  listener 3  Observe thWhen I create a new servlet  it goes under the Java Resources src folder  When I create a new filter or listener  it goes under the Java Resources folder  Only when I refresh the  src  node of the tree  the two web components are moved together under the  Java Resources src You can take a look  ,3
436752,Editor occasionally fails to regain focus after losing it, This is a tricky one to word  and I apologise in advance thThe window clearly has focus  and the line I click on is highlighted  However  there s no caret anywhere and only the letter keys work  thClosing down all the editors and re opening them has no effect  My only recourse is to close eclipse and restart it I m happy to diagnose this in any way but I don t know where to start  ,3
223565,Wizards using multiple category path entries should be considered by NewTypeDropDownAction, In order to contribute to NewTypeDropDownAction new wizards should be defined by using a class tag with parameters  The following wizard declaration is a snippet from the JavaDoc of CWizardRegistry getTypeWizardElements    lt wizard   name  My C Wizard    icon  icons cwiz gif    category  org eclipse cdt ui newCWizards    id  xx MyCWizard  gt     lt class class  org xx MyCWizard  gt        lt parameter name  ctype  value  true    gt        lt  class gt      lt description gt        My C Wizard    lt  description gt  lt  wizard gt The cppunit plugin defines two wizards in  a seperate category  The category attribute needs a second value    org eclipse cppunit   Extending the above mentioned wizard declaration by the second category value lets the wizard appear in the cppunit category which is a subcategory of the C C   category  It is not possible to contribute the new wizard to the NewTypeDropDownAction because the invoked CWizardRegistry getAllWizardElements   does not consider path entries for category values This could be fixed if the CWizardRegistry getAllWizardElements   implementation could only consider the first entry of the value path of the attribute category of the wizard declaration The following code considers the first path entry of the category value public static IConfigurationElement   getAllWizardElements    List elemList   new ArrayList   IExtensionPoint extensionPoint   Platform getExtensionRegistry   getExtensionPoint PlatformUI PLUGIN ID  PL NEW  if  extensionPoint    null   IConfigurationElement   elements   extensionPoint getConfigurationElements   for  int i   0  i  lt  elements length  i     IConfigurationElement element  elements i  if  element getName   equals TAG WIZARD        String category   element getAttribute ATT CATEGORY      if  category    null  amp  amp          category startsWith CUIPlugin CCWIZARD CATEGORY ID               category startsWith CUIPlugin CWIZARD CATEGORY ID                 elemList add element          return  IConfigurationElement    elemList toArray new IConfigurationElement elemList size      The change is th This implementation change would enable developers to provide further C C   wizards th ,3
325547,Provide Multi select smart copy, This is basically just a placeholder entry at this stage and may need a short paper written up to describe the full behaviorSo the issue is thNote thA particular example I have class A with a subclass B and an association ALikesB between A and B They all reside in oldFolder I select all 3 and copy them to newFolder I find   newFolder B extends oldFolder A  newFolder ALikesB is between oldFolder A and oldFolder BWhat I would like instead is   newFolder B extends newFolder A  newFolder ALikesB is between newFolder A and newFolder B ,3
