"<relative-time class=""no-wrap"" datetime=""2019-04-05T22:08:08Z"">Apr 5, 2019</relative-time>","The Icon Journey...Version 2<a href=""https://code.visualstudio.com/blogs/2017/10/24/theicon"" rel=""nofollow"">The 2017 icon change showed how much passion and interest there in the iconography for VS Code, and we thank you for that feedback. There are still a few outstanding issues with current icon, and we’ve been spending time over the past few weeks looking at ways to resolve them. We wanted to share where we are and get your thoughts.The current icon is <a data-hovercard-type=""issue"" data-hovercard-url=""/microsoft/vscode/issues/59778/hovercard"" href=""https://github.com/Microsoft/vscode/issues/59778"">hard to see on some customers taskbars as well as in some parts of the Windows UI like the file chooser dialog. The size of the VS Code shape itself, when wrapped within the Visual Studio Family ribbon (the “wall” on the right) makes <a data-hovercard-type=""issue"" data-hovercard-url=""/microsoft/vscode/issues/44931/hovercard"" href=""https://github.com/Microsoft/vscode/issues/44931"">the difference between Visual Studio and Visual Studio Code hard to spot, especially for some customers with color vision deficiency. Finally, some commented that the macOS version of the product icon looks out of place amongst other apps in the dock.An opportunity to learnAs well as your feedback, there was also efforts going on inside Visual Studio and Visual Studio for Mac on aligning with iconography across Microsoft, being led by Windows and Office. You’ll have seen some of this in the latest <a href=""https://devblogs.microsoft.com/visualstudio/a-preview-of-ux-and-ui-changes-in-visual-studio-2019/"" rel=""nofollow"">product icons for Visual Studio (Windows) and <a href=""https://devblogs.microsoft.com/visualstudio/reflecting-your-feedback-in-visual-studio-2019-2/"" rel=""nofollow"">Visual Studio for Mac as well as some of the recent <a href=""https://news.microsoft.com/europe/2018/11/29/say-hello-to-microsofts-new-office-icons/"" rel=""nofollow"">Office icon updates. While this was not our main driver of change, it made sense to learn from the other work and leverage a similar style to solve some of the issues we were seeing.The proposed icons<a href=""https://user-images.githubusercontent.com/6909617/55654227-b871b680-57e8-11e9-8728-62be20609813.png"" rel=""noopener noreferrer"" target=""_blank""><img alt=""2017-2019-stable"" src=""https://user-images.githubusercontent.com/6909617/55654227-b871b680-57e8-11e9-8728-62be20609813.png"" style=""max-width:100%;"" width=""668""/>VS Code's current Windows icon (above left) and the proposed icon (above right)Making it easier to findWe are dropping the thick ribbon on the right side of the icon. This allows us to increase the size of the VS Code shape (the key identifier of difference) to a size where it’s now a lot simpler to glance across the taskbar and spot your favorite code editor.<a href=""https://user-images.githubusercontent.com/6909617/55719383-08719880-59f6-11e9-9a2a-537441767e4b.png"" rel=""noopener noreferrer"" target=""_blank""><img alt=""Windows taskbar-new-office"" src=""https://user-images.githubusercontent.com/6909617/55719383-08719880-59f6-11e9-9a2a-537441767e4b.png"" style=""max-width:100%;"" width=""668""/>The proposed icons for the stable and Insiders builds of VS Code as well as Visual Studio 2019To make the icon more legible on a variety of backgrounds (from the desktop to the file chooser), we have added depth to the icon. This allows us to using lighting and shadows to create an overlapped effect, but also has the added advantage of lifting the icon up and off many flat colors it might encounter.<a href=""https://user-images.githubusercontent.com/6909617/55689601-39ae8200-597e-11e9-8443-8a2fb20df47e.png"" rel=""noopener noreferrer"" target=""_blank""><img alt=""2019-colours"" src=""https://user-images.githubusercontent.com/6909617/55689601-39ae8200-597e-11e9-8443-8a2fb20df47e.png"" style=""max-width:100%;"" width=""668""/>An example of the proposed icon on some of the blues and greens that you can choose in Windows10.Improving accessibilityTo improve accessibility, we needed a something that is more than color, so taking inspiration from the other Visual Studio Preview builds, we have brought a “stencil” look to the Insiders version VS Code while keeping the familiar green.<a href=""https://user-images.githubusercontent.com/6909617/55689606-492dcb00-597e-11e9-8c9a-a933fa054463.png"" rel=""noopener noreferrer"" target=""_blank""><img alt=""2017-2019-insiders"" src=""https://user-images.githubusercontent.com/6909617/55689606-492dcb00-597e-11e9-8c9a-a933fa054463.png"" style=""max-width:100%;"" width=""668""/>VS Code's current Insiders build icon (above left) and the proposed version (above right)Keeping a native macOS style icon<a href=""https://user-images.githubusercontent.com/6909617/55654261-d3442b00-57e8-11e9-9e61-554a8092919a.png"" rel=""noopener noreferrer"" target=""_blank""><img alt=""2017-2019-mac"" src=""https://user-images.githubusercontent.com/6909617/55654261-d3442b00-57e8-11e9-9e61-554a8092919a.png"" style=""max-width:100%;"" width=""668""/>VS Code's current macOS icon (above left) and the proposed icon (above right)We’ve kept a macOS style icon for Visual Studio Code on the Mac. We considered having the same icon across all three operating systems but decided to follow the native Mac style. What we also wanted to add to the macOS version was a stronger connection with the Windows icon which would strengthen the recognition between the two versions. Using the same shape, as well as stencil look to the Insiders build, allowed us to do that easily.<a href=""https://user-images.githubusercontent.com/35271042/55649462-e084f980-5797-11e9-8ac7-fd493fe5ff15.png"" rel=""noopener noreferrer"" target=""_blank""><img alt=""macOS dock"" src=""https://user-images.githubusercontent.com/35271042/55649462-e084f980-5797-11e9-8ac7-fd493fe5ff15.png"" style=""max-width:100%;"" width=""668""/>Whilst keeping the shape of the background the same for our macOS icons, we were conscious on making sure that VS Code was easy to identify next to <a href=""https://devblogs.microsoft.com/visualstudio/reflecting-your-feedback-in-visual-studio-2019-2/"" rel=""nofollow"">Visual Studio for Mac so we’ve adopted a darker look for the shape. This lets you easily spot the difference if you have both installed (and next to each other) in your dock.Let us know what you thinkWe would love to hear your feedback on these proposals So let us know what you think!",['https://code.visualstudio.com/blogs/2017/10/24/theicon']
"<relative-time class=""no-wrap"" datetime=""2019-04-05T22:53:24Z"">Apr 5, 2019</relative-time>",Love this idea!,
"<relative-time class=""no-wrap"" datetime=""2019-04-05T22:57:51Z"">Apr 5, 2019</relative-time>","I think a color change is enough to differentiate Insider from Retail, does not have to be a different shape as well. Did you guys explore going into the same direction as the Office guys then? I thought everything across Microsoft has to follow the same scheme now?",
"<relative-time class=""no-wrap"" datetime=""2019-04-05T23:52:52Z"">Apr 5, 2019</relative-time>","I think having the Insider icon have those cutouts opposed to the stable build makes it look too much like an X, especially a green X, i. e. Excel.",
"<relative-time class=""no-wrap"" datetime=""2019-04-06T01:31:04Z"">Apr 6, 2019</relative-time>",Really nice icons. Its a good idea.,
"<relative-time class=""no-wrap"" datetime=""2019-04-06T02:08:12Z"">Apr 6, 2019</relative-time>","A green X is Excel - the Excel logo never looked like that, but the Mandela Effect will be a thing. How about Orange for the insiders build?That said, I like the shape, it's in-line with Visual Studio 2019 just like the current icon is like the VS 2017 one. Just no Green X please.And maybe don't have a gap at all, in small sizes (e.g., Taskbar icon) it looks more like the icon is actually broken and is missing a column of pixels, the 3D look only works at bigger sizes for me.",
"<relative-time class=""no-wrap"" datetime=""2019-04-06T02:56:02Z"">Apr 6, 2019</relative-time>","I like the proposed look for both stable &amp; insiders build specifically the macos one's.I love the 3d look of the icons.However in the insider build one the stencil dark band or border can be reduced in thickness, after all only an effect.",
"<relative-time class=""no-wrap"" datetime=""2019-04-06T03:29:01Z"">Apr 6, 2019</relative-time>","I love blue icon of #code and the proposed one with blue, I think is good",
"<relative-time class=""no-wrap"" datetime=""2019-04-06T03:34:22Z"">Apr 6, 2019</relative-time>",Nice ....,
"<relative-time class=""no-wrap"" datetime=""2019-04-06T03:35:43Z"">Apr 6, 2019</relative-time>",Love the idea. Both look great but I'm a lil bit biased towards the stencil look. It will make code icon standout from a pile of icons in a glimpse. Time to spot the stencil icon is seemingly less compared to the other new icon.,
"<relative-time class=""no-wrap"" datetime=""2019-04-06T03:40:32Z"">Apr 6, 2019</relative-time>","it's great, good job",
"<relative-time class=""no-wrap"" datetime=""2019-04-06T03:57:27Z"">Apr 6, 2019</relative-time>","I like what you’ve done here overall. That being said, have you considered drawing from the <a href=""https://medium.com/microsoft-design/redesigning-the-office-app-icons-to-embrace-a-new-world-of-work-91d72608ee8f"" rel=""nofollow"">new Microsoft Office, Skype, etc. logos? The brand consistency might be nice.",
"<relative-time class=""no-wrap"" datetime=""2019-04-06T07:18:10Z"">Apr 6, 2019</relative-time>",The macOS icons are fire! I want them shipped in the next build. Tyvm,
"<relative-time class=""no-wrap"" datetime=""2019-04-06T07:35:56Z"">Apr 6, 2019</relative-time>",I like the blue ones for Mac and PC,
"<relative-time class=""no-wrap"" datetime=""2019-04-06T07:55:52Z"">Apr 6, 2019</relative-time>",I like the second proposal. ,
"<relative-time class=""no-wrap"" datetime=""2019-04-06T07:56:35Z"">Apr 6, 2019</relative-time>","I've always wondered why the thick ribbon was there, made it look weird, these look a lot better, great idea!",
"<relative-time class=""no-wrap"" datetime=""2019-04-06T07:57:28Z"">Apr 6, 2019</relative-time>","Most likely an oversight, but the Insiders icons in the Proposed and Windows 10 background presentations aren't rounded at the bottom part while they appear rounded in the mockups of the Win 10 taskbar and the macOS dock.<a href=""https://user-images.githubusercontent.com/10488070/55666661-86576780-586f-11e9-9701-4f658c08fbb2.png"" rel=""noopener noreferrer"" target=""_blank""><img alt=""inoticedthis"" src=""https://user-images.githubusercontent.com/10488070/55666661-86576780-586f-11e9-9701-4f658c08fbb2.png"" style=""max-width:100%;""/>",
"<relative-time class=""no-wrap"" datetime=""2019-04-06T08:14:23Z"">Apr 6, 2019</relative-time>",macOS one looks super dope. Maybe thinner border but the proposed one still looks sweet.,
"<relative-time class=""no-wrap"" datetime=""2019-04-06T10:02:44Z"">Apr 6, 2019</relative-time>",I love it,
"<relative-time class=""no-wrap"" datetime=""2019-04-06T10:11:55Z"">Apr 6, 2019</relative-time>","Love the depth of the proposed icon! Just the right level of shadows and rounded corners.However, I'd prefer the macOS icon without the outline — the same as the Windows one. The shape of the outline looks weird to me and doesn't seem to match the typical macOS icon style. I think the ""inner"" icon would stand beautifully on its own. ",
"<relative-time class=""no-wrap"" datetime=""2019-04-06T10:45:50Z"">Apr 6, 2019</relative-time>",Nice! I wouldn't mind having the Windows one on macOS as well — it's so beautiful! ,
"<relative-time class=""no-wrap"" datetime=""2019-04-06T12:01:25Z"">Apr 6, 2019</relative-time>",I love the proposed blue icon!,
"<relative-time class=""no-wrap"" datetime=""2019-04-06T12:17:40Z"">Apr 6, 2019</relative-time>","Looking good. I guess. Especially the blue (""stable"") one. ",
"<relative-time class=""no-wrap"" datetime=""2019-04-06T13:19:34Z"">Apr 6, 2019</relative-time>","Get rid of the cutout on green icon, make it same shape as the blue icon.",
"<relative-time class=""no-wrap"" datetime=""2019-04-06T13:56:00Z"">Apr 6, 2019</relative-time>","I like the new icons, however, o do like the old macOS icon background. If you could find some way to incorporate it, that'd be nice it better fits with the system in that's sense",
"<relative-time class=""no-wrap"" datetime=""2019-06-13T10:03:40Z"">Jun 13, 2019</relative-time>","The new icon looks off centered. When navigating to vscode, I find my eyes drawn to the smaller ""x"" then having to make the conscious decision to move it to the right (where the icon is bigger) before clicking.Could we work on making the icon more centered or have the choice to switch to the older icon? Having a smaller surface area towards the middle of the icon is off-putting. Pls +1 if you experience the same.Or maybe rotating the icon to look like a flask might help :)<br/><a href=""https://user-images.githubusercontent.com/21115797/59155650-80366080-8a43-11e9-863f-744437f760f4.png"" rel=""noopener noreferrer"" target=""_blank""><img alt=""vscode-icon-offcenter"" src=""https://user-images.githubusercontent.com/21115797/59155650-80366080-8a43-11e9-863f-744437f760f4.png"" style=""max-width:100%;"" width=""168""/>It looks better if your dock is on the side.",
"<relative-time class=""no-wrap"" datetime=""2019-06-13T13:15:06Z"">Jun 13, 2019</relative-time>","Most icons on macOS have a filled-in center. Because the new icon has a transparent hole in the middle, it looks out of place compared to other Mac apps. I agree with @matpag- @adryd325's implementation of the proposed icon looks consistently better across the board in the dock, the application switcher, in launchpad, and in the application folder. It also looks the same whether dark mode is on or off and regardless of the user's wallpaper color.I understand the goal of having one icon across all platforms, but it's too bad that macOS visual design language has to suffer. I wasn't particularly fond of the old icon, but at least it looked like a Mac app.I think it depends on what's behind the Dock, really. It would be nice if Apple kept with the last rendition of the 3D glass Dock from many years ago; it looks nicest on that.",
"<relative-time class=""no-wrap"" datetime=""2019-06-13T14:18:17Z"">Jun 13, 2019</relative-time>","Im a bit late to the party, just like last time. Im really annoyed by the VS Code logo using similar colors to the VS 2019 logo (for colorblind people). I dont see any difference between the two and that makes switching between the two really difficult. I am currently creating my own builds with a pink VS Code logo to actually see the difference between the two.Hopefully this can be taken in account next time there is a logo change?",
"<relative-time class=""no-wrap"" datetime=""2019-06-13T15:11:05Z"">Jun 13, 2019</relative-time>","Im a bit late to the party, just like last time. Im really annoyed by the VS Code logo using similar colors to the VS 2019 logo (for colorblind people). I dont see any difference between the two and that makes switching between the two really difficult. I am currently creating my own builds with a pink VS Code logo to actually see the difference between the two.Hopefully this can be taken in account next time there is a logo change?Visual Studio's logo is an infinity symbol, whereas Visual Studio Code's is a fish.",
"<relative-time class=""no-wrap"" datetime=""2019-06-13T17:59:33Z"">Jun 13, 2019</relative-time>","I came here after seeing the Release Notes showing off the new logo to say the same thing as @StefanJanssen95.  A large amount of people are red/green colorblind (the most common kind) and this icon is incredibly hard to tell apart from VS2019 (the little line on the left of the VS2019 icon is insignificant on a dark, small taskbar).  Maybe a colorblind mode is appropriate, like in many other apps.",
"<relative-time class=""no-wrap"" datetime=""2019-06-13T18:00:18Z"">Jun 13, 2019</relative-time>","Visual Studio's logo is an infinity symbol, whereas Visual Studio Code's is a fish.wow, yes that is true but barely quickly recognizable.",
"<relative-time class=""no-wrap"" datetime=""2019-06-14T05:43:42Z"">Jun 14, 2019</relative-time>","Visual Studio's logo is an infinity symbol, whereas Visual Studio Code's is a fish.wow, yes that is true but barely quickly recognizable.Logic wise visual studio code is 75% of infinity",
"<relative-time class=""no-wrap"" datetime=""2019-06-14T09:54:43Z"">Jun 14, 2019</relative-time>","@adryd325 Really thanks!!!How to install on macOS:<br/>Just go in application, find Visual Studio Code app, right click, show package content, open Contents folder then Resources folder and replace Code.icns icon with the one provided by adryd. (you can rename it instead of replacing it if you want to restore the old icon at some point)<br/>Then just remove it from dock or restart it and it will show up.Didn't worked for me. I mean, it kinda did, but not all the way. This is what I mean:Click to expand image<a href=""https://user-images.githubusercontent.com/5470780/59500776-6f01af80-8e9a-11e9-8d77-e922177403ea.png"" rel=""noopener noreferrer"" target=""_blank""><img alt=""weird"" src=""https://user-images.githubusercontent.com/5470780/59500776-6f01af80-8e9a-11e9-8d77-e922177403ea.png"" style=""max-width:100%;"" width=""739""/>I quit VSCode, removed from Dock and did killall Finder but it's still the same. Gonna try the sudo method. Btw, I'm on Mojave 10.14.5.EDIT: Clearing the cache from <a data-hovercard-type=""issue"" data-hovercard-url=""/microsoft/vscode/issues/71827/hovercard"" href=""https://github.com/microsoft/vscode/issues/71827#issuecomment-501374831"">jonaskohl's comment worked. Thank you and big thanks to @adryd325 for the macOS-friendly icon Oh, and just to be clear. That I'm using the @adryd325's icon, doesn't mean I don't appreciate all the time and effort put into the new design by the VSCode team! ",
"<relative-time class=""no-wrap"" datetime=""2019-06-14T11:39:20Z"">Jun 14, 2019</relative-time>","<div class=""email-fragment"">Try `killall Dock`<span class=""email-hidden-toggle""><a href=""#"">…<div class=""email-hidden-reply""><div class=""email-quoted-reply"">On Fri, Jun 14, 2019 at 5:57 AM Matronator ***@***.***&gt; wrote: @adryd325 &lt;<a href=""https://github.com/adryd325"">https://github.com/adryd325&gt; Really thanks!!! How to install on macOS: Just go in application, find Visual Studio Code app, right click, show package content, open Contents folder then Resources folder and replace Code.icns icon with the one provided by adryd. (you can rename it instead of replacing it if you want to restore the old icon at some point) Then just remove it from dock or restart it and it will show up. Didn't worked for me. I mean, it kinda did, but not all the way. This is what I mean: Click to expand image [image: weird] &lt;<a href=""https://user-images.githubusercontent.com/5470780/59500776-6f01af80-8e9a-11e9-8d77-e922177403ea.png"">https://user-images.githubusercontent.com/5470780/59500776-6f01af80-8e9a-11e9-8d77-e922177403ea.png&gt; I quit VSCode, removed from Dock and did killall Finder but it's still the same. Gonna try the sudo method. Btw, I'm on Mojave 10.14.5. — You are receiving this because you were mentioned. Reply to this email directly, view it on GitHub &lt;#71827?email_source=notifications&amp;email_token=ALOM2RA4NCHAPZ4Q6LSAQDDP2NTO3A5CNFSM4HD7G7SKYY3PNVWWK3TUL52HS4DFVREXG43VMVBW63LNMVXHJKTDN5WW2ZLOORPWSZGODXWKM5Q#issuecomment-502048374&gt;, or mute the thread &lt;<a href=""https://github.com/notifications/unsubscribe-auth/ALOM2RAMG5QSNOIEQTZ2KQ3P2NTO3ANCNFSM4HD7G7SA"">https://github.com/notifications/unsubscribe-auth/ALOM2RAMG5QSNOIEQTZ2KQ3P2NTO3ANCNFSM4HD7G7SA&gt; .<div class=""email-fragment"">","['https://github.com/adryd325', 'https://github.com/adryd325', 'https://github.com/adryd325', 'https://user', 'https://user', 'https://github.com/microsoft/vscode/issues/71827', 'https://github.com/microsoft/vscode/issues/71827', 'https://github.com/notifications/unsubscribe', 'https://github.com/notifications/unsubscribe']"
"<relative-time class=""no-wrap"" datetime=""2019-06-14T11:53:08Z"">Jun 14, 2019</relative-time>","Try killall Dock<br/><a href=""#"">…@adryd325 Thanks, already fixed it (post edited, but it probably didn't show up in your mail notification) ",
"<relative-time class=""no-wrap"" datetime=""2019-06-14T12:24:18Z"">Jun 14, 2019</relative-time>","You can also achieve something similar for just the .app by opening the new image or ICNS file with Preview, hitting Cmd+A, Cmd+C, then clicking the small icon of the Get Info window (below) and hitting Cmd+V to paste the new icon into the pool. Fastest way to change all your icons on macOS.<a href=""https://user-images.githubusercontent.com/1473776/59508937-9b5b0300-8e7d-11e9-97d2-755948f3fef9.png"" rel=""noopener noreferrer"" target=""_blank""><img alt=""image"" src=""https://user-images.githubusercontent.com/1473776/59508937-9b5b0300-8e7d-11e9-97d2-755948f3fef9.png"" style=""max-width:100%;""/>",
"<relative-time class=""no-wrap"" datetime=""2019-06-14T13:17:49Z"">Jun 14, 2019</relative-time>","You can also achieve something similar for just the .app by opening the new image or ICNS file with Preview, hitting Cmd+A, Cmd+C, then clicking the small icon of the Get Info window (below) and hitting Cmd+V to paste the new icon into the pool. Fastest way to change all your icons on macOS.<a href=""https://user-images.githubusercontent.com/1473776/59508937-9b5b0300-8e7d-11e9-97d2-755948f3fef9.png"" rel=""noopener noreferrer"" target=""_blank""><img alt=""image"" src=""https://user-images.githubusercontent.com/1473776/59508937-9b5b0300-8e7d-11e9-97d2-755948f3fef9.png"" style=""max-width:100%;""/> I've been doing that for folders, great feature. But you would still have to update the cache so the change would show up in Dock/Finder/Launchpad (or at least I had too).",
"<relative-time class=""no-wrap"" datetime=""2019-06-14T13:42:40Z"">Jun 14, 2019</relative-time>",The easiest way to refresh the icon in the dock on MacOS:Pin VS Code to Dock (Keep in Dock).Quit VS Code if it is open.Unpin VS Code from dock (Remove from Dock).Open Applications in Finder and drag the app back to the dock.,
"<relative-time class=""no-wrap"" datetime=""2019-06-14T13:48:13Z"">Jun 14, 2019</relative-time>","The easiest way to refresh the icon in the dock on MacOS:Pin VS Code to Dock (Keep in Dock).Quit VS Code if it is open.Unpin VS Code from dock (Remove from Dock).Open Applications in Finder and drag the app back to the dock.Don't know why but this is exactly how I did it the first time and it didn't worked. I had to quit VSCode and follow instructions from a <a data-hovercard-type=""issue"" data-hovercard-url=""/microsoft/vscode/issues/71827/hovercard"" href=""https://github.com/microsoft/vscode/issues/71827#issuecomment-501374831"">comment above.sudo touch /Applications/Visual\ Studio\ Code.app;sudo touch /Applications/Visual\ Studio\ Code.app/Contents/Info.plist;sudo touch /Applications/Visual\ Studio\ Code.app/Contents/Resources/Code.icns;killall Dock Finder",
"<relative-time class=""no-wrap"" datetime=""2019-06-14T14:01:05Z"">Jun 14, 2019</relative-time>","In my experience, quitting the application and restarting it (by clicking it in the Dock) almost always updates its icon, but whatever works. Logging out and back in or restarting is probably pretty fast nowadays, too.",
"<relative-time class=""no-wrap"" datetime=""2019-06-14T16:06:20Z"">Jun 14, 2019</relative-time>",Windows 10. Updated. Same icon.,
"<relative-time class=""no-wrap"" datetime=""2019-06-15T14:45:10Z"">Jun 15, 2019</relative-time>","Windows 10. Updated. Same icon.Same here. Windows 10, Updated VSCode, started the latest version, ran commandie4uinit.exe -showbut still have the blue icon.",
"<relative-time class=""no-wrap"" datetime=""2019-06-16T01:47:50Z"">Jun 16, 2019</relative-time>",How do I update the icon in windows 7?,
"<relative-time class=""no-wrap"" datetime=""2019-06-19T08:07:28Z"">Jun 19, 2019</relative-time>","Why did you choose a fish without the head as the logo?May I remind you something from the time when the previous icon was introduced:<a href=""https://user-images.githubusercontent.com/13851064/59275921-f31f2180-8c65-11e9-8ba0-6751c5f13da5.png"" rel=""noopener noreferrer"" target=""_blank""><img alt=""image"" src=""https://user-images.githubusercontent.com/13851064/59275921-f31f2180-8c65-11e9-8ba0-6751c5f13da5.png"" style=""max-width:100%;""/>So I'd say the fish is doing better now.that's good",
"<relative-time class=""no-wrap"" datetime=""2019-06-21T07:23:03Z"">Jun 21, 2019</relative-time>","Why did you choose a fish without the head as the logo?May I remind you something from the time when the previous icon was introduced:<a href=""https://user-images.githubusercontent.com/13851064/59275921-f31f2180-8c65-11e9-8ba0-6751c5f13da5.png"" rel=""noopener noreferrer"" target=""_blank""><img alt=""image"" src=""https://user-images.githubusercontent.com/13851064/59275921-f31f2180-8c65-11e9-8ba0-6751c5f13da5.png"" style=""max-width:100%;""/>So I'd say the fish is doing better now.As for a logo designer, the previous change stabbed me in hart, so I drew this cartoon to explain what's wrong with the icon as much as I could.Today from technical point of view the icon looks great. Thanks for the change, now I can click on it without negative emotions. Hope the logo will become infinite ♾some day!",
