"Jun 13, 2019","Most icons on macOS have a filled-in center. Because the new icon has a transparent hole in the middle, it looks out of place compared to other Mac apps. I agree with @matpag- @adryd325's implementation of the proposed icon looks consistently better across the board in the dock, the application switcher, in launchpad, and in the application folder. It also looks the same whether dark mode is on or off and regardless of the user's wallpaper color.I understand the goal of having one icon across all platforms, but it's too bad that macOS visual design language has to suffer. I wasn't particularly fond of the old icon, but at least it looked like a Mac app.I think it depends on what's behind the Dock, really. It would be nice if Apple kept with the last rendition of the 3D glass Dock from many years ago; it looks nicest on that.",
"Jun 13, 2019","Im a bit late to the party, just like last time. Im really annoyed by the VS Code logo using similar colors to the VS 2019 logo (for colorblind people). I dont see any difference between the two and that makes switching between the two really difficult. I am currently creating my own builds with a pink VS Code logo to actually see the difference between the two.Hopefully this can be taken in account next time there is a logo change?",
"Jun 13, 2019","Im a bit late to the party, just like last time. Im really annoyed by the VS Code logo using similar colors to the VS 2019 logo (for colorblind people). I dont see any difference between the two and that makes switching between the two really difficult. I am currently creating my own builds with a pink VS Code logo to actually see the difference between the two.Hopefully this can be taken in account next time there is a logo change?Visual Studio's logo is an infinity symbol, whereas Visual Studio Code's is a fish.",
"Jun 13, 2019","I came here after seeing the Release Notes showing off the new logo to say the same thing as @StefanJanssen95.  A large amount of people are red/green colorblind (the most common kind) and this icon is incredibly hard to tell apart from VS2019 (the little line on the left of the VS2019 icon is insignificant on a dark, small taskbar).  Maybe a colorblind mode is appropriate, like in many other apps.",
"Jun 13, 2019","Visual Studio's logo is an infinity symbol, whereas Visual Studio Code's is a fish.wow, yes that is true but barely quickly recognizable.",
"Jun 14, 2019","Visual Studio's logo is an infinity symbol, whereas Visual Studio Code's is a fish.wow, yes that is true but barely quickly recognizable.Logic wise visual studio code is 75% of infinity",
"Jun 14, 2019","@adryd325 Really thanks!!!How to install on macOS:Just go in application, find Visual Studio Code app, right click, show package content, open Contents folder then Resources folder and replace Code.icns icon with the one provided by adryd. (you can rename it instead of replacing it if you want to restore the old icon at some point)Then just remove it from dock or restart it and it will show up.Didn't worked for me. I mean, it kinda did, but not all the way. This is what I mean:Click to expand imageI quit VSCode, removed from Dock and did killall Finder but it's still the same. Gonna try the sudo method. Btw, I'm on Mojave 10.14.5.EDIT: Clearing the cache from jonaskohl's comment worked. Thank you and big thanks to @adryd325 for the macOS-friendly icon Oh, and just to be clear. That I'm using the @adryd325's icon, doesn't mean I don't appreciate all the time and effort put into the new design by the VSCode team! ",
"Jun 14, 2019","Try `killall Dock`…On Fri, Jun 14, 2019 at 5:57 AM Matronator ***@***.***&gt; wrote: @adryd325 &lt;https://github.com/adryd325&gt; Really thanks!!! How to install on macOS: Just go in application, find Visual Studio Code app, right click, show package content, open Contents folder then Resources folder and replace Code.icns icon with the one provided by adryd. (you can rename it instead of replacing it if you want to restore the old icon at some point) Then just remove it from dock or restart it and it will show up. Didn't worked for me. I mean, it kinda did, but not all the way. This is what I mean: Click to expand image [image: weird] &lt;https://user-images.githubusercontent.com/5470780/59500776-6f01af80-8e9a-11e9-8d77-e922177403ea.png&gt; I quit VSCode, removed from Dock and did killall Finder but it's still the same. Gonna try the sudo method. Btw, I'm on Mojave 10.14.5. — You are receiving this because you were mentioned. Reply to this email directly, view it on GitHub &lt;#71827?email_source=notifications&amp;email_token=ALOM2RA4NCHAPZ4Q6LSAQDDP2NTO3A5CNFSM4HD7G7SKYY3PNVWWK3TUL52HS4DFVREXG43VMVBW63LNMVXHJKTDN5WW2ZLOORPWSZGODXWKM5Q#issuecomment-502048374&gt;, or mute the thread &lt;https://github.com/notifications/unsubscribe-auth/ALOM2RAMG5QSNOIEQTZ2KQ3P2NTO3ANCNFSM4HD7G7SA&gt; .","['https://github.com/adryd325', 'https://github.com/adryd325', 'https://github.com/adryd325', 'https://user', 'https://user', 'https://github.com/microsoft/vscode/issues/71827', 'https://github.com/microsoft/vscode/issues/71827', 'https://github.com/notifications/unsubscribe', 'https://github.com/notifications/unsubscribe']"
"Jun 14, 2019","Try killall Dock…@adryd325 Thanks, already fixed it (post edited, but it probably didn't show up in your mail notification) ",
"Jun 14, 2019","You can also achieve something similar for just the .app by opening the new image or ICNS file with Preview, hitting Cmd+A, Cmd+C, then clicking the small icon of the Get Info window (below) and hitting Cmd+V to paste the new icon into the pool. Fastest way to change all your icons on macOS.",
"Jun 14, 2019","You can also achieve something similar for just the .app by opening the new image or ICNS file with Preview, hitting Cmd+A, Cmd+C, then clicking the small icon of the Get Info window (below) and hitting Cmd+V to paste the new icon into the pool. Fastest way to change all your icons on macOS. I've been doing that for folders, great feature. But you would still have to update the cache so the change would show up in Dock/Finder/Launchpad (or at least I had too).",
"Jun 14, 2019",The easiest way to refresh the icon in the dock on MacOS:Pin VS Code to Dock (Keep in Dock).Quit VS Code if it is open.Unpin VS Code from dock (Remove from Dock).Open Applications in Finder and drag the app back to the dock.,
"Jun 14, 2019",The easiest way to refresh the icon in the dock on MacOS:Pin VS Code to Dock (Keep in Dock).Quit VS Code if it is open.Unpin VS Code from dock (Remove from Dock).Open Applications in Finder and drag the app back to the dock.Don't know why but this is exactly how I did it the first time and it didn't worked. I had to quit VSCode and follow instructions from a comment above.sudo touch /Applications/Visual\ Studio\ Code.app;sudo touch /Applications/Visual\ Studio\ Code.app/Contents/Info.plist;sudo touch /Applications/Visual\ Studio\ Code.app/Contents/Resources/Code.icns;killall Dock Finder,
"Jun 14, 2019","In my experience, quitting the application and restarting it (by clicking it in the Dock) almost always updates its icon, but whatever works. Logging out and back in or restarting is probably pretty fast nowadays, too.",
"Jun 14, 2019",Windows 10. Updated. Same icon.,
"Jun 15, 2019","Windows 10. Updated. Same icon.Same here. Windows 10, Updated VSCode, started the latest version, ran commandie4uinit.exe -showbut still have the blue icon.",
"Jun 16, 2019",How do I update the icon in windows 7?,
"Jun 19, 2019",Why did you choose a fish without the head as the logo?May I remind you something from the time when the previous icon was introduced:So I'd say the fish is doing better now.that's good,
"Jun 21, 2019","Why did you choose a fish without the head as the logo?May I remind you something from the time when the previous icon was introduced:So I'd say the fish is doing better now.As for a logo designer, the previous change stabbed me in hart, so I drew this cartoon to explain what's wrong with the icon as much as I could.Today from technical point of view the icon looks great. Thanks for the change, now I can click on it without negative emotions. Hope the logo will become infinite ♾some day!",
"Jun 21, 2019","Why did you choose a fish without the head as the logo?May I remind you something from the time when the previous icon was introduced:So I'd say the fish is doing better now.As for a logo designer, the previous change stabbed me in hart, so I drew this cartoon to explain what's wrong with the icon as much as I could.Today from technical point of view the icon looks great. Thanks for the change, now I can click on it without negative emotions. Hope the logo will become infinite ♾some day!It used to be the Visual Studio icon.",
"Jun 21, 2019","@alexanderby Oh, nice to see the author of the image here. I had this picture saved, but couldn't remember where I got it from.Thank you for making it.",
"Jun 21, 2019","Hah, that image came up on my Microsoft on-boarding this week - you're now famous @alexanderby ",
"Jul 2, 2019","I hate the new icon so much that I am downgrading my VS Code version, and will be changing IDEs if it is not reverted, because I simply cannot stand to look at something so awful all day. Did anyone actually test this icon on a real machine before it was implemented, or just look at it in product presentations? I have a hard time believing that anyone who had seen it in a real world environment on a real Mac would ever let it out of the design room.Quite frankly, this is the worst logo I have ever seen for any product anywhere. It has no regard for the Mac aesthetic that all my other icons follow. All the other icons in my dock are either rectangular or have some other visually appealing symmetry. This one is lopsided and totally out of place. Why did you have to change for the sake of change? This logo is just really, really bad.I guess it was a nice run while it lasted.",
"Jul 2, 2019","@KallasteAlright, I understand design is important, even when dealing with programming, but this is a severe overreaction. I suggest just replacing the icns file. Sure it's hacky and it's not a permanent solution (though you could chmod it to be read only) but as a developer, you can handle that.As far as ditching vscode as an editor, if the icon was the only reason you chose it, please do so, of not, it's kind of rediculous to change editors only because of an icon. Something that is rarely part of the editors UI.",
