246774,JPA  javax persistence jtaDataSource requires wiki instructions on override usage, This wiki enhancement request surrounds usage of the javax persistence jtaDataSource as an override for application scoped datasources deployed with the EAR The original wls server  is for WebLogic 10 3 but the behaviour of this persistence unit property should be documented for all application servers Issue    The jta data source is always overriden by the datasource in javax persistence jtaDataSource   A documentation wiki is required on usage of this alternate property    Current behavior is thExample persistence xml lt persistence version  1 0  xmlns    gt      lt persistence unit name  unified  transaction type  JTA  gt           lt provider gt org eclipse persistence jpa PersistenceProvider lt  provider gt           lt jta data source gt localOracle10RemoteDS lt  jta data source gt                lt properties gt     gt                lt property name  javax persistence jtaDataSource  value  java app jdbc appDS   gt               code references                 This one found by Doug and Shaun during debugging of the workaround for  During a CRUD operation against the entityManager 1  By design in EntityManagerSetupImpl getDatasourceFromProperties   we only use the datasource from  lt jta data source gt  if it is non null in the supplied PersistenceUnitInfoImpl The global datasource  oracle10RemoteDS  defined in  lt jta data source gt  is ignored  the application managed datasource localOracle10RemoteDS defined in javax persistence jtaDataSource is used inteadignored     gt  weblogic jdbc common internal RmiDataSource 18a24e9used     gt  datasource java app jdbc localOracle10RemoteDS   id 11049     protected javax sql DataSource getDatasourceFromProperties Map m  String property  javax sql DataSource defaultDataSource          Object datasource   getConfigPropertyLogDebug property  m  session          if   datasource    null               return defaultDataSource                   if   datasource instanceof String                 Create a dummy DataSource that will throw an exception on access   gt          return new DataSourceImpl  String datasource  null  null  null  Daemon Thread   ACTIVE  ExecuteThread   14  for queue   weblogic kernel Default  self tuning     Suspended EntityManagerSetupImpl getDatasourceFromProperties Map  String  DataSource  line  1035EntityManagerSetupImpl updateLogins Map  line  966EntityManagerSetupImpl updateServerSession Map  ClassLoader  line  1176EntityManagerSetupImpl deploy ClassLoader  Map  line  237EntityManagerFactoryImpl getServerSession   line  69EntityManagerFactoryImpl createEntityManagerImpl Map  boolean  line  118jtaDataSourceRmiDataSource   id 10956 appNamenullclassLoadernulldriverClass weblogic jdbc jta DataSource   id 11038 driverInstanceDataSource   id 11039 driverPropsConcurrentProperties   id 11040 driverUrl jdbc weblogic jta oracle10RemoteDS   id 11041 isLoggingResourcefalsejdbcCtxWLEventContextImpl   id 11042 jndiNamesString 1    id 11043 jtaRegistrationName oracle10RemoteDS   id 11044 moduleNamenullpanullpoolName oracle10RemoteDS   id 11044 rmiSettingsRmiDriverSettings   id 11045 scope Global   id 11046 txDataSourcetrueuseDrivertrueverbosefalse2  Later on in updateLogins   we create our own wrapper for the ds name and dataSourceorg eclipse persistence internal jpa jdbc DataSourceImpl 1ca62e2When we return to the login   call later in deploy   we resolve the datasource and set it on our wrapper   this is the one we use Daemon Thread   ACTIVE  ExecuteThread   0  for queue   weblogic kernel Default  self tuning     Suspended  breakpoint at line 102 in JNDIConnector  JNDIConnector connect Properties  line  118JNDIConnector connect Properties  Session  line  94DatabaseLogin DatasourceLogin  connectToDatasource Accessor  Session  line  164ServerSession DatabaseSessionImpl  loginAndDetectDatasource   line  570EntityManagerFactoryProvider login ServerSession  Map  line  209EntityManagerSetupImpl deploy ClassLoader  Map  line  246EntityManagerFactoryImpl getServerSession   line  69EntityManagerFactoryImpl createEntityManagerImpl Map  boolean  line  118dataSourceRmiDataSource   id 11046 appNamenullclassLoadernulldriverClass weblogic jdbc jta DataSource   id 10944 driverInstanceDataSource   id 11047 driverPropsConcurrentProperties   id 11048 driverUrl jdbc weblogic jta localOracle10RemoteDS   id 11049 isLoggingResourcefalsejdbcCtxWLEventContextImpl   id 11050 jndiNamesString 1    id 11051 jtaRegistrationName  appsdir weblogicEAR88 ear localOracle10RemoteDS localOracle10RemoteDS   id 11052 moduleNamenullpanullpoolName localOracle10RemoteDS   id 11053 rmiSettingsnullscope Application   id 11054 txDataSourcetrueuseDrivertrueverbosefalse3  We may need to adjust the comments javadoc for updateLogins   as they contradict each other in their use of the supplied PersistenceUnitInfo We should state th and that  properties will overrided settings in persistenceUnitInfo              Override the default login creation method        If persistenceInfo is available  use the information from it to setup the login       and possibly to set readConnectionPool            protected void updateLogins Map m          DatasourceLogin login   session getLogin                  Note  This call does not checked the stored persistenceUnitInfo or extended properties because           the map passed into this method should represent the full set of properties we expect to process ,3
506419,Global search for resources and text in resources,  ,3
205855,ruby project outside of workspace doesn t show library container, Build ID  I20070625 1500Steps To Reproduce 1  New Ruby project2  select  create project from existing source  3  set source path to directory with ruby filesclick finish  expected   new project contains ruby interpreter libraries  actual     only project files shown  no library containerMore information  ,3
429893,NullPointerException possible in IdentifiableTypeImpl, I am getting a NPE on a MappedSuperClass thThe object on which it is actually failing is import javax persistence MappedSuperclass import org eclipse persistence annotations ReadOnly       Abstract class providing a common base for all references used to perform   simple database lookup operations     param  lt T gt  The ID type for the implementer  Long  custom PK  etc     MappedSuperclass ReadOnlypublic abstract class LookupEntity lt T gt  extends BaseEntity   private static final long serialVersionUID   2851322481034028047L   public abstract T getId     public abstract String getName     public abstract String getDescription    The relevant stack trace is java lang IllegalStateException  Failed to load ApplicationContextjava 99 java 101 java 109 java 75 java 319 java 212 java 289 java 12 java 291 java 232 java 89 java 238 java 63 java 236 java 53 java 229 java 61 java 71 java 309 java 175 java 50 java 38 java 467 java 683 java 390 java 197 Caused by  org springframework beans factory BeanCreationException  Error creating bean with name  referenceRepository   Invocation of init method failed  nested exception is java lang NullPointerExceptionjava 1553 java 539 java 475 java 304 java 228 java 300 java 195 java 681 java 760 java 482 java 121 java 60 java 64 java 91     25 moreCaused by  java lang NullPointerExceptionjava 242 java 212 java 78 java 65 java 146 java 41 java 67 java 150 java 224 java 210 java 84 java 1612 java 1549     38 more ,3
296324,Provide annotation to manually define the SQL to fetch a property, User Agent        Mozilla 5 0  Windows  U  Windows NT 6 0  de  rv 1 9 1 5  Gecko 20091102 Firefox 3 5 5   NET CLR 3 5 30729 Build Identifier  Hibernate provides a way to easily define the SQL to for a property using the  Formula annotation     It would be nice to have this feature in EclipseLink too Please also see the forum topic php t msg amp th 158462 amp start 0 amp S 083f556c8b57265fe0eaf1517f8d741dReproducible  Always ,3
375953,Enhancement Request   Provide means to introspect JAXB MOXy s metadata for a model, This enhancement is for the addition of APIs th  This would be similar to the mechanisms offered by JPA and the following from the JAXB RI     com sun xml bind v2 model runtime RuntimeTypeInfoSet ,3
477524,Provide ECF file transfer provider based upon OkHttp, Within the Android community the usage of HttpUrlConnection or Apache HttpClientis typical avoided  as the Android community consider them as slow The de facto standard in Android is the OkHttp library which on modernAndroid devices is also used by the framework under the hook if youuse HttpUrlConnection OkHttp implements also the same API as HttpURLConnection so it should be possible to implement it as  drop in replacement  of an existing file transfer provider  ,3
301490,Resource does not exist when rename project , Build Identifier  Build id  I20090611 1540org eclipse core internal resources ResourceException  Resource   1 1 sql  does not exist java 319 java 196 java 756 java 496 java 466 java 448 java 1800 java 444 java 423 java 1024 java 216 java 4198 java 4220 java 534 java 603 java 564 java 739 java 879 java 285 java 163 java 35 java 134 java 3855 java 3476 java 173 java 388 java 330 java 557 java 153 java 117 java 621 java 453 java 472 java 624 java 228 java 84 java 1003 java 3880 java 3473 java 825 java 801 java 143 java 70 java 155 java 39 java 294 java 476 java 508 java 270 java 95 java 73 java 461 java 168 java 119 java 476 java 508 java 169 java 470 java 824 java 880 java 569 java 510 java 125 java 84 java 1191 java 1002 java 1027 java 1012 java 1040 java 1036 java 1669 java 4281 java 5953 java 3977 java 5821 java 4589 DispatchMessageW Native Method java 2409 java 3471 java 2405 java 2369 java 2221 java 500 java 332 java 493 java 149 java 113 java 194 java 110 java 79 java 368 java 179 invoke0 Native Method invoke Unknown Source invoke Unknown Source invoke Unknown Source java 559 java 514 java 1311 Reproducible  AlwaysSteps to Reproduce 1  In Navigator  create a general project named 12  In this project  create a sql file  1 sql3  Open this sql file with SQLScrapbook4  Rename this projectAfter step4  there is ResourceException  ,3
536970,Could not open the DTP SQL Results view, When trying to open the SQL Results View I get the following exceptions   I ve reinstalled eclipse multiple times with same results   Eclipse is installed with 3 different versions of the Lucene core jar   3 5 0  6 1 0 and 7 1 0   The stack trace seems to indicate thorg eclipse core runtime CoreException  Plug in org eclipse datatools sqltools result ui was unable to load class org eclipse datatools sqltools result internal ui view ResultsView java 197 java 179 java 931 java 243 java 60 java 59 java 101 java 302 java 340 invoke0 Native Method invoke Unknown Source invoke Unknown Source invoke Unknown Source java 55 java 1005 java 970 java 137 java 412 java 331 java 190 java 105 java 74 java 56 java 129 java 1012 java 672 java 557 java 42 java 541 java 70 java 1012 java 672 java 778 java 749 java 743 java 42 java 727 java 1277 java 102 java 690 java 778 java 749 java 743 java 42 java 727 java 70 java 137 java 686 java 778 java 749 java 743 java 42 java 727 java 70 java 137 java 686 java 778 java 749 java 743 java 42 java 727 java 70 java 137 java 686 java 778 java 749 java 743 java 42 java 727 java 70 java 48 java 686 java 778 java 749 java 743 java 42 java 727 java 79 java 102 java 61 java 690 java 778 java 749 java 743 java 42 java 727 java 70 java 137 java 686 java 778 java 749 java 743 java 42 java 727 java 70 java 700 java 686 java 778 java 749 java 743 java 42 java 727 java 1096 java 336 java 1059 java 153 java 667 java 336 java 597 java 148 java 152 java 196 java 134 java 104 java 388 java 243 invoke0 Native Method invoke Unknown Source invoke Unknown Source invoke Unknown Source java 656 java 592 java 1498 java 1471 Caused by  java lang ClassNotFoundException  An error occurred while automatically activating bundle org eclipse datatools sqltools result ui  248  java 123 java 505 java 328 java 392 java 470 java 419 java 411 java 150 loadClass Unknown Source java 609 java 177     122 moreCaused by  org osgi framework BundleException  Error starting module java 590 java 449 java 468 java 114     132 moreCaused by  java lang NoClassDefFoundError  org eclipse datatools sqltools result internal utils ILoggergetDeclaredConstructors0 Native Method privateGetDeclaredConstructors Unknown Source getConstructor0 Unknown Source newInstance Unknown Source java 763 java 716 java 1002 java 354 java 581     135 moreCaused by  java lang ClassNotFoundException  An error occurred while automatically activating bundle org eclipse datatools sqltools result  247  java 123 java 505 java 328 java 392 java 36 java 466 java 419 java 411 java 150 loadClass Unknown Source     144 moreCaused by  org osgi framework BundleException  Exception in org eclipse datatools sqltools result ResultsViewPlugin start   of bundle org eclipse datatools sqltools result java 800 java 729 java 1002 java 354 java 581 java 449 java 468 java 114     153 moreCaused by  java lang NoSuchMethodError  org apache lucene index IndexWriter addDocument Ljava lang Iterable  Jjava 139 java 117 java 779 java 1 doPrivileged Native Method java 772     160 more ,3
408402,Hide fxml files from Eclipse, For those of us using fxgraph files  it would be nice if the fxml files were  invisible   for a couple of reasons   1  they are visual clutter in the package explorer  and  2  Eclipse wants to check them into source control  The latter is not horrible  but one normally doesn t keep generated files in source control  and every time there s a new efxclipse release thI envision something like whI realize this also has implications for wh ,3
399690,Several actions fail with NPE if project has not been imported created, There are several actions thHere s the stacktrace for the ignore error  ENTRY org eclipse egit ui 4 0 2013 01 31 14 11 54 805 MESSAGE Unable to ignore resources STACK 1org eclipse core runtime CoreException  Unable to ignore resourcesjava 90 java 57 java 53 Caused by  java lang NullPointerExceptionjava 97 java 82     2 more SUBENTRY 1 org eclipse egit core 4 0 2013 01 31 14 11 54 806 MESSAGE Unable to ignore resources STACK 0java lang NullPointerExceptionjava 97 java 82 java 57 java 53  ,3
297399,Support user setting only the owning side of a OneToMany   ManyToMany, Add some limited support to help users when they only set the owning side of a bi directional relationship   During change calculation EclipseLink has the opportunity to fabricate a ChangeRecord for the non owning side   Once the change record is created and merged EclipseLink s cache would reflect thAlthough the specification requires users to set both sides of the relationships our competitors do not and a substantial number of user mailing list enquiries involve this scenario   Adding this functionality would greatly improve the user experience  ,3
411620,VJET to support typescript definition files, Support type script definition files for VJET ANVILs Typescript type libraries    Suggested by jquery member community here  ,3
482236,JVM selection UI in the launcher, The user experience when the launcher fails to find a JRE is pretty bad  I ve answered many forum posts from confused users who encounter the launch failed dialog  The other aspect of this is poor behavior when wrong version of Java is found The JVM detection logic in the launcher should be augmented with UI to prompt the user to find a compatible JVM install  ,3
413169,Create a  Calling home  policy, Code Recommenders wants to collect usage data  1   It looks like we are well past the point where I need to draft a policy regarding  calling home  or otherwise providing data out of user installations of Eclipse software We had a lot of push back regarding privacy concerns  for example  when we implemented the UDC Off the top of my head  i e  this is  not  the policy  just some brainstorming    Any call home service would have to be opt in The user needs to be able to review the data before it is sent Raw data  which may include non obvious potentially private information  needs to be transferred securely The target for data collected by content distributed from eclipse org must be an eclipse org server  e g  the Eclipse packages must be configured to send data to an eclipse org server   This can be configurable by adopters to send to an alternate server Raw data needs to be stored securely and access to the data needs to be strictly controlled Cleaned and processed data needs to be publicly accessible Any project implementing a call home server must get approval from EMO ED  I m also thinking thThoughts  1   ,3
479536,Improve Tooling Support for NullPointerAnalysis, According to AERI NullPointerExceptions are the most frequently occurring exception type   4x more frequent than  2  IllegalArgumentException AC discussed to recommend to enable Null Analysis by default in JDT but several test runs have shown thHowever  I m under the impression thThus  I d propose 1  setting up a  external null annotations repository  where developers can  semi   automatically can download external null annotations for the libraries they use 2  Setting up a sharing mechanism where users can share their  manual or automatically generated  null analysis information  This may include quick fixes inside the IDE thSuch a service could be set up as an IDE  and tool agnostic standard to allow integrations with tools like FindBugs  PMD  and thus integrations into build systems   or even with other IDEs Implementing this package will certainly take no less than 8 weeks of work and requires support by JDT committers working on Null analysis  ,3
480177,WTP XML editor technology face lift, The XML editor in Eclipse has been compared to other XML editors and found to be rather basic  see  1  for an example   FEEP funding should be used to provide a decent XML editing support in Eclipse  in all packages   1   ,3
534849,was not able to show the ui, Unable to load UIjava lang NoClassDefFoundError  org eclipse jdt internal compiler ast BinaryExpressiondefineClass1 Native Method java 800 java 142 java 449 java 71 java 361 java 355 doPrivileged Native Method java 354 java 425 java 358 java 3072 java 152 java 476 java 434 java 420 java 495 java 489 java 67 invoke0 Native Method java 57 java 43 java 606 java 869 java 447 java 60 java 45 java 85 java 184 java 248 java 206 java 467 java 328 java 146 java 285 java 100 java 105 java 56 java 451 java 443 java 417 java 180 java 150 java 4688 java 414 java 464 java 372 java 507 java 435 java 388 java 252 java 361 java 354 java 47 java 35 java 65 java 129 java 248 java 84 java 1057 java 4170 java 3759 java 1113 java 332 java 997 java 138 java 610 java 332 java 567 java 150 java 124 java 196 java 110 java 79 java 354 java 181 invoke0 Native Method java 57 java 43 java 606 java 636 java 591 java 1450 Caused by  java lang ClassNotFoundException  org eclipse jdt internal compiler ast BinaryExpressionjava 363 java 355 doPrivileged Native Method java 354 java 425 java 358     83 moreCaused by  java io EOFException  Detect premature EOFjava 131 java 444 java 71 java 361     88 more ,3
540531, Dark Theme   LSP Text Occurrences  background color not adapted, When switching to the dark theme  the background colors of the text editor annotations  LSP Text Read Write Occurrences  are not adapted In the Rust IDE  this leads to the same font color as the background color for text occurrences when switching to the dark theme by default  see  ,3
514964,CSS editor detects error in font family declaration even though there is none , Displaying an error is detected when it should not be I am developing a JavaFX application  This involves using CSS stylesheets which are editable in the Eclipse IDE  When writing the stylesheet I declare an external font using  font face  The exact code is posted below  font face  font family   IM FELL Great Primer  src  url  IMFeGPrm28P ttf    The font file declares a name using space therefore in order to use it I encapsulate the name with quotes in the declaration as per CSS syntax  The IDE detects this as an error and highlights the text  IM FELL Gre This is not an error as described in the CSS 2 specification  This is no different in CSS 3  Read here  I will attach an image below I can verify th ,3
410783, providers  filetransfer  HttpClientRetrieveFileTransfer reports file size as  1, The HttpClientRetrieveFileTransfer will append a request and response interceptor to enable possible gzip encoding  line 606 in HttpClientRetrieveFileTransfer java  unless an IFileRangeSpecifiction has been provided  This has a bad side effect in thIt would be greA workaround is to always pass a IFileRangeSpecifiction with a very large range  ,3
447616,Create Patch Dialog Does Nothing on EAR project, Steps to reproduce 1  Create some changes in a EAR Git project  only on the web tier 2  Don t commit or stage any of the changes in Git3  On the Java EE view  right click the EAR project and select Team  gt  Create Patch4  Select clipboard and select next5  Keep the default values and click finishOnce you click finish the dialog doesn t go away and nothing is copied into the clipboard  There is no error message or anything to signify whI tried doing this on the Web project where all my changes were and it worked successfully  I tried on any other tier and it said there were no changes for the current selection To be specific  the ear project is  appname  and the web project is  appnameWeb  The  Error Log  view had this Message  Patch file was not writtenjava lang reflect InvocationTargetExceptionjava 421 java 1028 java 166 java 827 java 432 java 628 java 248 java 84 java 1057 java 4170 java 3759 java 826 java 802 java 116 java 106 java 31 java 290 java 90 invoke Unknown Source invoke Unknown Source invoke Unknown Source java 56 java 243 java 224 java 132 java 167 java 499 java 508 java 213 java 850 java 743 java 727 java 662 java 84 java 1057 java 4170 java 3759 java 1113 java 332 java 997 java 140 java 611 java 332 java 567 java 150 java 124 java 196 java 110 java 79 java 354 java 181 invoke0 Native Method invoke Unknown Source invoke Unknown Source invoke Unknown Source java 636 java 591 java 1450 Caused by  java lang StringIndexOutOfBoundsException  String index out of range   1charAt Unknown Source charAt Unknown Source java 250 java 170 java 121 eclipse buildId 4 3 2 M20140221 1700java version 1 6 0 37java vendor Sun Microsystems Inc BootLoader constants  OS win32  ARCH x86  WS win32  NL en USFramework arguments    product org eclipse epp package jee productCommand line arguments    os win32  ws win32  arch x86  product org eclipse epp package jee product ,3
443195,Provide an implementation for eKeys based accessors,  identified limitations in the support for indexed collections using EMap  eKeys was suggested as a better way to go Therefore provide enhancements so th I have a prototype th Is there any reason why eKeys cannot be generalized to eStructuralFeature   ,3
415078,Man pages should not be ignored in favor of method comments inside TCL package,  ,3
386397,Clean Up Eclipse Projects in Git Rep, Currently it is very difficult to get the Eclipse Projects checked into out Git Repository into a state where they can compile We should simplify this task Some Suggestions  1  Stop depending on projects in orbit  instead  depend  by relative path  on the jar files we have checked into GIT 2  Reexamine the Classpath variables we use and ensure we need them all  and convert any we can to relative paths 3  Move our dependencies so into a directory where they can be easily added to an Eclipse target environment Our goal should be a state where users can simply do the following for our core projects1  Import the projects2  Point at a target environment3  Have compile succeed  ,3
326132,DefaultHostContainerFinder uses ecf generic server as default even if bundle org eclipse ecf provider remoteservice is not deployed, org eclipse ecf internal osgi services distribution Activator defines ecf generic server as the ECF default  This is totally acceptable if org eclipse ecf provider remoteservice is deployed  However  if this bundle is missing in the current runtime  DefaultHostContainerFinder fails to create a default remote service container Maybe as part of  ,3
416975,Mark schema attributes as translatable and or identifiers,  ,3
391375,Repository inside a subdirectory of another repository displays bogus Unstaged Changes, Screenshot of Staging View that should be emptyI wanted to test if I could have a repository inside of another repository I created a repository named SuperTest      then created an Eclipse EJB project inside of it called SuperEJB    then created a bunch of subdirectories for a path that looks like         SuperTest SuperEJB ejbModule com super I then created another repository called SuperTestSub inside the path listed above I then added  SuperTestSub   to  gitignore in the SuperTest repoository I then proceeded to make some commits in both repositories using command line Git  git status from command line then shows thAfter that  I decided to test EGit s staging view  which should have displayed 0 unstaged changes for both repos  The SuperTest repo showed 0 unstaged changes  but the SuperTestSub displayed what is shown in the screenshot attachment    ,3
320227,Javascript IDE ECMA 3 DOM reference does not include Element removeEventListener  , When writing Javscript code in the Javascript editor th Interestingly enough  both of the non standard methods attachEvent  and  detachEvent are supported   and the attached documentation claim these are standard ECMA DOM Level 3 methods and points to the correct DOM Level 3 specification  which obviously has no mention of these  ,3
