416049,Exception thrown when SQL result is removed, During the removal of an SQL Result in the Results View  the HistoryIndexListener is fired and aims to remove the result instance from its underlying lucene index  However  this index is being open as read only causing an exception to be thrown  Since this is the first listener fired from the ResultManager instance  no other listeners are fired java lang UnsupportedOperationException  This IndexReader cannot make any changes to the index  it was opened with readOnly   true java 23 java 43 java 1339 java 1375 java 184 java 155 java 34 java 117 java 200 java 100 java 168 java 584 java 501 java 452 java 84 java 1392 java 3742 java 3363 java 1113 java 332 java 997 java 138 java 610 java 332 java 567 java 150 java 124 java 196 java 110 java 79 java 354 java 181 invoke0 Native Method java 57 java 43 java 606 java 636 java 591 java 1450 java 1426 1 ,3
373116,Generator preferences invisible when there s duplicate names IDs, This pertains to the compiler preference and property pages  If there are two generators contributed via the org eclipse edt ide core generators extension point  and they either have the same name or same ID  we pop up a warning and then hide the generator portion of the UI 1  We should not hide this UI when this happens  It s a warning  not an error  Let them configure stuff  while leaving the warning 2  If we display the generator ID then it s okay to have conflicting names  This could be a new column in the table  a tooltip  whatever we decide looks best  Duplicate IDs though  is  a problem and we should only show one of them  first one in the list   They can configure it still  but it s We should defer this post 0 8 since we don t currently have any generator conflicts  This will be more an issue as third parties start writing their own generators  ,3
268044,StyledText should provide grouping information if multiple events are sent to describe one source modification,  was fixed in order to allow TextViewer in jface text to group a sequence of VerifyEvents thWhile this works  it requires TextViewer to run its own editing story  as it currently vetoes any VerifyEvents and then modifies the text content itself  This is necessary because there is no way to detect the last event of a sequence if it relies on the event timestamp It would be much easier for jface text if the events shared a tag that would let TextViewer know that1  an event is part of an event sequence2  an event is the first or last event of the sequenceFor example  the event could state the total number of events in the current sequence  1 for the trivial case   and the rank of the event in the sequence  Perhaps some of the many fields of VerifyEvent could be re used for that purpose  ,3
508769,Export Content to Git, Push the registry content or the whole repository to a git repositoryThe idea is afterwards to be able to pull from Git or use Git based Master Repository on bootstrapping an instance ,3
467015,Add ability to filter inject mylyn selection  similar to IModelContentProvider, SelectionConveter  used by DLTKEditingMonitor   is based on getSourceElementAt only  so it s not possible to remove unnecessary element s like in trees As I see in code  it contain special hack for IPackageDeclarations  line 87   Probably extension point or special method in language toolkit will be required  ,3
438864,please provide default cache expiry key for persistence xml, just likeeclipselink cache shared defaulteclipselink cache type defaulteclipselink cache size defaultallow us to set expiry using same syntax ,3
290814,xml data provider not complete, I would like to bind xml  preloaded  xml documents  dom instance  to an ui Right now  xml support in xwt seems to be incomplete I have already added two new XML Data Provider Factories to handle xml documents by dom instances and by url I will attach a patch when I have tested this  ,3
254287,Default identity used in JMSTopicTransportManager createConnection boolean , The createConnection boolean  method of JMSTopicTransportManager contains the following line of code   TopicConnection topicConnection   connectionFactory createTopicConnection   which invokes the no argument variant of the TopicConnectionFactory gt  gt createTopicConnection method  rather than the variant thMy client has a business policy thThe username and password values configured in the  jndi naming service  element of sessions xml file are available in the context of JMSTopicTransportManager gt  gt createConnection boolean  via the  getRemoteContextProperties   method inherited from TransportManager  so it certainly is possible to use the 2 arg variant of the createTopicConnection Can I suggest that you invent a way that the JMSTopicTransportManager could be configured to use the available username and password credentials Perhaps you could add an additional sub element of the sessions session remote command transport element in the sessions xml schema to indicate whether to use credentials  Or perhaps always invoke the 2 arg createTopicConnection if there is a username and password available Thanks very much for your consideration of this request  ,3
514912,Make Generate Mobile Interface menu item selection dependent,  ,3
376342,License text for the IDE  all in one build  has  n  at the end of every line, screenshot of the problemI m upgrading from the 0 7 Win32 all in one build to the 0 8 Win32 all in one build   Every line in the license text for the IDE feature ends with  n    See the attached screenshot   The licenses for Eclipse and the feature EGL Web Developer Tools are OK  ,3
56265,Need capability to merge subclasses BeanInfo for identical properties, This was reported from a WSAD customer  PMR 11457 999 788  but is a limitation in VE as well Create a class thCreate a property descriptor for the property  components  and specifiy it to be hidden  i e  aPropDesc setHidden true   When you bring up the visual editor for this class and drop components onto it  the add Component       statement does not get generated in the source code This is because there are specific decoders that handle the  components  feature for a java awt Container but the VE doesn t recognize that the  components  feature for this class is the same  but with just an additional setting  hidden true   So the code is not generated We need the capability to somehow merge in the BeanInfo properties of a class and it s superclass for which the property name is the same  ,3
433726,config file in  git directory empty, Dear EGit Team from time to time EGit corrupts my config file in the  git directory of a repo  After thI encountered this issue multiple times but I cannot say whThis occurs on differnt repos  So i seems not to be related to a specific repo Regards Matthias ,3
464787,Memory leak by calling JAXBHelperContext   Leak suspect IdentityWeakHashMap, We have problem with heap memory  In heap dump we can see thOur architecture We work with SDO objects in our system so we need to use JAXBHelperContext for transformations from   to POJO  Object of JAXBHelperContext is implemented as instance variable in Singleton class   so there is only one instance of JAXBHelperContext in our system  We were expecting thWe tried to change implementation and remove JAXBHelperContext from singleton  after th  We use Websphere Application Server v7  ,3
474078,NoClassDefFoundError in CssDslActivator getRuntimeModule  77 , The following incident was reported via the automated error reporting The user s  left the following comments      wrote     The problematic package  org eclipse fx ide css  may originate in the following bundles   org eclipse fx ide css 2 0 0 201506111511  from which the following bundles present on the stack trace import it     org eclipse fx ide css ui 2 0 0 201506111511        Carlois Delfino wrote     The problematic package  org eclipse fx ide css  may originate in the following bundles   org eclipse fx ide css 2 0 0 201506111511  from which the following bundles present on the stack trace import it     org eclipse fx ide css ui 2 0 0 201506111511        Carlois Delfino wrote     The problematic package  org eclipse fx ide css  may originate in the following bundles   org eclipse fx ide css 2 0 0 201506111511  from which the following bundles present on the stack trace import it     org eclipse fx ide css ui 2 0 0 201506111511        Carlois Delfino wrote     The problematic package  org eclipse fx ide css  may originate in the following bundles   org eclipse fx ide css 2 0 0 201506111511  from which the following bundles present on the stack trace import it     org eclipse fx ide css ui 2 0 0 201506111511        Carlois Delfino wrote     The problematic package  org eclipse fx ide css  may originate in the following bundles   org eclipse fx ide css 2 0 0 201506111511  from which the following bundles present on the stack trace import it     org eclipse fx ide css ui 2 0 0 201506111511        code                    2    plugin                  org eclipse jface 3 11 0 v20150602 1400    message                 Problems occurred when invoking code from plug in   org eclipse jface      fingerprint             473eaf60    exception class         java lang NoClassDefFoundError    exception message       org eclipse fx ide css CssDslRuntimeModule    number of children      0        java lang NoClassDefFoundError  org eclipse fx ide css CssDslRuntimeModule    java 77     java 63     java 55     java 26     java 49     java 262     java 55     java 188     java 164     java 76     java 88     java 64     java 154     java 949     java 74     java 114     java 42     java 50     java 173     java 1029     java 473     java 42     java 50     java 173     java 2176     java 843     java 818     java 70     java 791     java 611     java 762     java 1493     java 903     java 1505     java 132     java 84     java 4362     java 1113     java 1137     java 1122     java 7633     java 5690     java 1956     java 5242     java 4718     java 5050     java  2     java 2443     java 1553     java 6501     java 4698     java 6024     java 5050     java  2     java 2549     java 3767     java 1127     java 337     java 1018     java 156     java 654     java 337     java 598     java 150     java 139     java 196     java 134     java 104     java 380     java 235     invoke0 null  2     invoke null  1     invoke null  1     invoke null  1     java 669     java 608     java 1515      General Information     reported by           anonymous id      7e289236 73e8 4489 8a3e 4f6a6450250e    eclipse build id  4 5 0 I20150603 2000    eclipse product   org eclipse epp package java product    operating system  Windows8 6 2 0  x86 64    win32    jre version       1 8 0 51 b16The following plug ins were present on the execution stack         1  org eclipse core databinding observable 1 5 0 v20150422 0725    2  org eclipse core databinding 1 5 0 v20150422 0725    3  org eclipse core runtime 3 11 0 v20150405 1723    4  org eclipse e4 ui workbench 1 3 0 v20150531 1948    5  org eclipse e4 ui workbench swt 0 13 0 v20150504 0621    6  org eclipse equinox app 1 3 300 v20150423 1356    7  org eclipse equinox launcher 1 3 100 v20150511 1540    8  org eclipse fx ide css ui 2 0 0 201506111511    9  org eclipse fx ide css 2 0 0 201506111511    10  org eclipse jface 3 11 0 v20150602 1400    11  org eclipse swt 3 104 0 v20150528 0211    12  org eclipse ui 3 107 0 v20150507 1945    13  org eclipse ui ide application 1 1 0 v20150422 0725    14  org eclipse ui ide 3 11 0 v20150510 1749    15  org eclipse ui views 3 8 0 v20150422 0725    16  org eclipse xtext ui 2 7 3 v201411190455    17  org eclipse xtext 2 7 3 v201411190455Please note that   Messages  stacktraces  and nested status objects may be shortened   Bug fields like status  resolution  and whiteboard are sent  back to reporters   The list of present bundles and their respective versions was  calculated by package naming heuristics  This may or may not reflect reality Other Resources   Report      Manual  Thank you for your assistance Your friendly error reports inbox  ,3
395747,Editing  gitignore outside workspace is not refreshed with F5, Editing  gitignore outside workspace is not refreshed with F5 Use of F5 on a project does not re check the  gitignore files have not been added delete modified Furthermore to this even if I use  Team   gt  Ignore  to make Eclipse create a  gitignore and then replace the file with new contents  from outside of Eclipse   then press F5 I unset Project Explorer   gt  Filter   gt     resources  so the  gitignore is visible   If I open the file  it still displays the old contents  like Eclipse has cached the data contents  So this bug is about use of F5 to make EGit refresh its view of  gitignore files   I would expect it to pickup new contents  ,3
288415,provide pluggable ui frameworks, User Agent        Opera 9 80  Windows NT 5 1  U  en  Presto 2 2 15 Version 10 00Build Identifier  Currently  there is a bunch of  declarative  UI frameworks to facilitate the creation of UIs  Namely  XSWT  XWT  TMF  Wazaabi  UFacekit  glimmer  XScalaWT  maybe JavaFX for SWT  to be implemented   and a lot more   I do not know all of them in detail  but I am sure each one has its pros and cons  Just to not force the developer to choose the only one framework  the target platform  e4  should add support for using them interchangeably and uniformly I suggest to provide some extension points to accomplish this task  Hallvard proposed  uniforms  as a potential name   org eclipse ui uniforms loaders  this will enable the ui framework provider to register his framework  as being able to handle a specific forms language  XWT  TMF  glimmer        org eclipse ui uniforms forms  this will enable consumers developers to register a piece fragment of UI  created in an UI language  XWT  TMF  glimmer       by a unique id  org eclipse ui uniforms bindings  this will enable consumers developers to bind ui fragments   using its unique id  to a target container  such as views   editors  pref pages  wizards  etc   org eclipse ui uniforms listeners  this will enable consumers developers and framework providers to listen to  forms events  e g  before form is being loaded  or after form is loadedBinding a form or ui fragment to a target container will require the target container to be able to be extendable  i e  ViewPart  EditorPart  etc  will have to be modified in order to be populated declaratively through the bindings extension point Reproducible  Always ,3
485400,Provide an API to get an attribute value for a given entity instance, I don t know if this is the right place for such a request  but since EclipseLink is the JPA Reference Implementation I hope It would be VERY helpful if the JPA metamodel supported a way to get an attribute value given the javax persistence metamodel Attribute lt X  Y gt  instance and an actual instance of the entity th Something like Y getValue X entityInstance  In case of the canonical metamodel  the implementation might even be generated  since X type is known   otherwise a generic reflection based implementation might be provided by the JPA implementation Right now  I have to provide this by myself  A proof of concept for the SingularAttribute case private static  lt E  A gt  A getAttributeValue final E entity final SingularAttribute lt   super E  A gt  attribute     try      final Member member   attribute getJavaMember       if  member instanceof Method          SuppressWarnings  unchecked        final A result    A    Method  member  invoke entity        return result       else if  member instanceof Field          SuppressWarnings  unchecked        final A result    A    Field  member  get entity        else        throw new IllegalArgumentException            unexpected Java member type  expecting Method or Field  found               member      catch  final Exception e        throw new RuntimeException e      There are two problems though   in case of Field  an access through the getter  instead of a direct access through the field itself  would respect object encapsulation an hence would be preferable  it s not a big problem to enhance the above code to try getter access before direct field access in the  member instanceof Field  case  though   this is much harder  instead  I m experiencing that for related entities the member is a Method but in case of statically weaved classes this Method is not my declared method  but rather an internal EclipseLink Weaver generated method that does not return the actual value  but rather a ValueHolder for thatThis is a problem because I would need to unwrap the value holder and I couldn t yet find a proper way to do thSo  if the JPA API provided such a feature  it would be very helpful when using the metamodel to perform generic processing over entities Meanwhile  any suggestion to solve the  ValueHolder  problem would be appreciated  ,3
431624,Create Checkout branch   requires 3700 MB memory when starting Eclipse, Ericsson WMR is using RSARTE UML Development Eclipse ver  4 2 2  memory 1700 MBEgit version 3 4Project  RNCI would like to Create and Check out a new branch Using the icon  Checkout branch  tag or reference  I open the dialog Create branch  Give the name for the new branch  Oli branch2  and the source master Click Ok  wait for 2 3 minutes  then I get an error  Branch could not be createdJava heap space Eclipse displays another error view  out of memory  Do you want to exit the workbench    After I choose not to close the workspace  I click on the icon  Checkout branch  tag or reference  and I can see my new created branch there  listed I select it  then want to do  Checkout  on it so I click on button  Checkout  I can see in the status bar of Eclipse  lower right corner  the message  Checking out RNC  Oli branch2 0    Also  I see the memory usage for Eclipse  diplayed in the lower status bar  is increasing to 2000 MB The procentage keeps 0  for the next minutes Meanwhile I can see the CPU usage  using command  top  on terminal  on the Linux host is varying between 100  and 300  for my user  for process  javaw  After 3 4 minutes  I get error message  An internal error occurred during   Checking out RNC   refs heads Oli branch2  Java heap space   I click Ok  then I get another error message  Out of memory  Do you want to exit the workbench  In the end  I cannot do a proper checkout of the new branch I mention th ,3
298793,trident in cvs, Some issues   the trident checked in into cvs has dependency on swt 3 6  but compiles against swt 3 5    gt  I have to remove version requirement when compiling against galileo  tests are embedded in src folder  Should they not be independently packaged in their own test plugin  ,3
366302, Improvement  Let the user decide determine search console orientation,  ,3
286349,NPE on  Open Type , Build ID  20090723After some time of work  Open Type  functionality stops working   no selection dialog is opened due to NPE java lang NullPointerExceptionjava 249 java 238 java 279 java 1243 java 1121 java 300 java 139 java 790 java 243 java 53 java 92 java 289 java 476 java 508 java 169 java 470 java 824 java 880 java 569 java 510 java 125 java 84 java 1191 java 1002 java 1027 java 1012 java 1040 java 1036 java 1368 java 4053 java 346 java 3946 java 342 java 4589 CallWindowProcW Native Method java 2312 java 639 DispatchMessageW Native Method java 2409 java 3471 java 2405 java 2369 java 2221 java 500 java 332 java 493 java 149 java 113 java 194 java 110 java 79 java 368 java 179 invoke0 Native Method invoke Unknown Source invoke Unknown Source invoke Unknown Source java 726 java 542 java 1478  ,3
305387,Request property to override default  exclude unlisted classes  setting for DDL gen, In Dali  a user is often developing a project for an EE environment  and as such  may choose not to list all classes in the persistence xml   A Dali project has a preference setting for such a case   Discover annotated classes    When this property is set  Dali scans the project for all annotated classes so thWhen generating tables from entities in such a case  EclipseLink DDL gen is executed in an SE environment  not an EE environment  and so the entire persistence unit is  not  scanned for annotated classes   This is not whWith an additional property to override the default behavior of  exclude unlisted classes   Dali could ensure th ,3
398569, docs  Provide better validation explainations,  ,3
402701,Provide validation option to opt out of dependency validations, In many cases dependency validation rules such as  Cannot use type TYPELIST without active needs or  Unused Types TYPELIST These are gre When this happens these validation rules are just noise to developer and they want to but other warnings are ignored because they are ignoring all of these warnings which is minimum  ,3
509508,Project share silently fails when git conflicts exist, To reproduce  Create git repo and a README md file in it Create a  blank  dirigible project and invoke Team gt Share on it specifying the repo above as location  ,3
148250,Attempting to change the SWT jar location of a Java project fails, Steps to reproduce 1  Create a Java project2  Add the SWT library using the PDE target jar 3  In the Pkg Explorer  bring up the context menu for the SWT entry and select Configure 4  Change the radio button selection from PDe to IDE and hit Finish Expected result The jar being used should change Actual result An internal error thStack trace from log java lang reflect InvocationTargetExceptionjava 350 java 763 java 67 java 760 java 2283 java 88 java 61 java 254 java 539 java 488 java 400 java 66 java 1085 java 3164 java 2840 java 1914 java 1878 java 419 java 149 java 95 java 78 java 92 java 68 java 400 java 177 invoke0 Native Method java 39 java 25 java 585 java 336 java 280 java 977 java 952 Caused by  java lang NullPointerExceptionjava 478 java 389 java 1346 java 564 java 633 java 679 java 438 java 691 java 719 java 1737 java 717 java 757 java 494 java 4118 java 23 java 1900 java 1267 java 1470 java 2169 java 1312 java 840 java 773 java 3016 java 2981 java 91 java 113 Root exception java lang NullPointerExceptionjava 478 java 389 java 1346 java 564 java 633 java 679 java 438 java 691 java 719 java 1737 java 717 java 757 java 494 java 4118 java 23 java 1900 java 1267 java 1470 java 2169 java 1312 java 840 java 773 java 3016 java 2981 java 91 java 113 Session data  eclipse buildId I20060526 0010java version 1 5 0 05java vendor Sun Microsystems Inc BootLoader constants  OS linux  ARCH x86  WS gtk  NL en CACommand line arguments    os linux  ws gtk  arch x86 ,3
280853,exposed NL key for Label Decorator, With Java EE IDE  near Galileo release  20090618 1920 Preferences  General  Appearance  Label DecorationsThere is a list of about 40 label decorators  One of them says  datatools core ui modelexplorer modelExplorerColumnDecorationLooks like a plugin properties file is missing a key value pair     or similar  ,3
313028,Adding an option to use the auto reconnect of the smack library in XMPP Provider, Build Identifier  20100506 2000Since ECF is not using Smack 3 1  and since this version of smack is capable of automatically reconnecting if the connection is dropped suddenly  without calling disconnect   it would be gre Reproducible  Always ,3
377470,IDE Analyis search, Support searching the EGL source base and building analysis reports Example  search for all programs with dynamic SQL statements  ,3
505845,Add  targetLocation  property in  template json , Add a  targetLocation  property into the source objects in  template json  Example                sources                         name   database crud dao js           action   generate           rename    sDao           targetLocation    ScriptingServices  lt placeholder for package name gt  dao                              ,3
98645,Target  BeanInfo Editor  should deal with System exit  , After pasting text into source code editor and saving the changes I got theMessage IWAV0138E Remote VM terminated too soon  See  log file for trace of output  For VM Project  Simulation1  VM for Simulation1  a few times  And then also a null pointer exception occured  After closing andrestarting eclipse the message and error rised again  Eclipse hangs up completly  ,3
420898, providers  MQTT  Create MQTT broker container,  It would also be useful to have an ECF container thNote there was a discussion  2  about Paho providing a Java based broker  they do not have thIn the short term  there is also the possibility of using ActiveMQ s MQTT broker to implement this enhancement  as we already have an ActiveMQ provider  3   1   2   3   ,3
285896,Add support for automatically reconnecting to XMPP server,  ,3
330607,Provide documentation of JPA dynamic persistence, Can t remember if I had opened a bug previously  My quick search revealed nothing The root bug is Sub bugs will contain more details of their individual functionality  ,3
280778,Doc  expand on FullIdentityMap usage to avoid memory leaks, The following elug URL states when to use FullIdentityMap but  WARNING  Use the FullIdentityMap only if the class has a small number of finite instances  Otherwise  a memory leak will occur   We need to relate this potiential memory leak behavior to bugs such as  and  how small  a cache size will cause leakage  where subclass leakages will also occur and under whWithout these specific constraints  the user may avoid use of this superclass  ,3
549675,Unable to create JavaScript project in Eclipse  IDE for Web and JavaScript Developers , Screenshot of creating project wizardHi I ve just downloaded the latest version of Eclipse ID for JS and am not able to see the option to create a java script project or any type of project for th ,3
321423, Discovery  jSLP  Adopt service TTL,  ,3
