533255,NUMBER FORMAT EXCEPTION when Auto activation delay field is entered with characters in Code Assist  SQL Development, Code Assist Preferences    gt   Auto activation delay  field should allow only numbers in the Code Assist Preferences dialog1  Launch the Eclispe application in a fresh workspace2  Select Window  gt  Preferences   gt Data Management   gt SQL Development   gt  SQL Editor   gt  Code Assist   gt Auto Activation3  Verify that the Enable auto Activation checkbox is unchecked5  Check the Enable auto Activation checkbox6  Verify that the Auto activation delay field is enabledVerify that the 500 is displayed by default in the Auto activation delay field7  Enter  abc  in the Auto activation delay field8  Click on Apply buttonVerify that the Unhandled event loop exception is displayed java lang NumberFormatException in org eclispe jface pluginjava lang NumberFormatException  For input string   abc forInputString Unknown Source parseInt Unknown Source parseInt Unknown Source java 140 java 905 java 42 java 50 java 173 java 889 java 409 java 168 java 230 java 618 java 249 java 84 java 4418 java 1079 java 4236 java 3824 java 818 java 794 java 211 java 63 java 473 java 565 java 397 java 84 java 4418 java 1079 java 4236 java 3824 java 1121 java 336 java 1022 java 150 java 693 java 336 java 610 java 148 java 138 java 196 java 134 java 104 java 388 java 243 invoke0 Native Method invoke Unknown Source invoke Unknown Source invoke Unknown Source java 673 java 610 java 1519  ,3
148856,occasional ConcurrentModificationException adding tools to VE palette, I m getting an occasional exception when the VE palette is created  I think    When I get the exception  the palette is created  but absent my tools   I tried setting an exception breakpoint  but I stopped getting the exception   I filed this against EMF since that s the top of the trace    I don t know enough about EMF to know which component I should have used Here s the traceback eclipse buildId unknownjava version 1 5 0 04java vendor Sun Microsystems Inc BootLoader constants  OS win32  ARCH x86  WS win32  NL en USFramework arguments    product org eclipse sdk ide  pdelaunchCommand line arguments    product org eclipse sdk ide  data C  Eclipse Workspaces VE    runtime New configuration  dev file C  Eclipse Workspaces VE  metadata  plugins org eclipse pde core New configuration dev properties  pdelaunch  os win32  ws win32  arch x86ErrorTue Jun 27 13 29 37 EDT 2006Problems occurred when invoking code from plug in   org eclipse ve java core  java util ConcurrentModificationExceptionjava 1327 java 1275 java 356 java 262 java 233 java 108 java 61 java 372 java 262 java 1234 java 1694 java 37 java 1685 java 58  ,3
476086,CreationException in CssDslActivator createInjector  67 , The following incident was reported via the automated error reporting     code                    0    plugin                  org apache log4j 1 2 15 v201012070815    message                 org eclipse fx ide css ui CssDslExecutableExtensionFactory    Failed to create injector for org eclipse fx ide css CssDsl    fingerprint             a14da25f    exception class         java lang RuntimeException    exception message       Failed to create injector for org eclipse fx ide css CssDsl    number of children      0        java lang RuntimeException  Failed to create injector for org eclipse fx ide css CssDsl    java 71     java 55     java 26     java 51     java 262     java 55     java 40     java 46     java 109     java 129     java 27     java 275     java 279     java 107     java 95     java 65     java 168     java 288     java 226     java 414     java 459     java 159     java 62     java 69     java 198     java 359     java 351     java 247     java 463     java 450     java 440     java 437     java 437     java 437     java 137     java 38     java 1662     java 42     java 1652     java 1486     java 1462     java 2074     java 477     java 299     java 42     java 289     java 152     java 373     java 1470     java 2250     java 5409     java 106     java 122     java 55 caused by  com google inject CreationException  Guice creation errors 1  null returned by binding java 79  but org eclipse fx ide css validation CssDslJavaValidator ext is not  Nullable  while locating org eclipse fx ide css extapi CssExt OsgiCssExtServiceProvider  while locating org eclipse fx ide css extapi CssExt    for field ext Unknown Source   java 56   while locating org eclipse fx ide css validation CssDslJavaValidator1 error    java 435     java 183     java 109     java 95     java 72     java 62     java 67     java 55     java 26     java 51     java 262     java 55     java 40     java 46     java 109     java 129     java 27     java 275     java 279     java 107     java 95     java 65     java 168     java 288     java 226     java 414     java 459     java 159     java 62     java 69     java 198     java 359     java 351     java 247     java 463     java 450     java 440     java 437     java 437     java 437     java 137     java 38     java 1662     java 42     java 1652     java 1486     java 1462     java 2074     java 477     java 299     java 42     java 289     java 152     java 373     java 1470     java 2250     java 5409     java 106     java 122     java 55      General Information     reported by           anonymous id      f3010822 998a 43a8 a2e7 1a040e76dfce    eclipse build id  4 5 0 I20150603 2000    eclipse product   org eclipse epp package jee product    operating system  Windows7 6 1 0  x86 64    win32    jre version       1 8 0 51 b16The following plug ins were present on the execution stack         1  com google inject 3 0 0 v201312141243    2  org eclipse core jobs 3 7 0 v20150330 2103    3  org eclipse core resources 3 10 0 v20150423 0755    4  org eclipse core runtime 3 11 0 v20150405 1723    5  org eclipse fx ide css ui 2 0 0 201506111511    6  org eclipse fx ide css 2 0 0 201506111511    7  org eclipse jdt core 3 11 0 v20150602 1242    8  org eclipse jdt 3 11 0 v20150603 2000    9  org eclipse jdt ui 3 11 0 v20150527 0925    10  org eclipse xtext builder 2 8 3 v201506010551    11  org eclipse xtext 2 8 3 v201506010551    12  org eclipse xtext common types ui 2 8 3 v201506010551    13  org eclipse xtext common types 2 8 3 v201506010551    14  org eclipse xtext ui 2 8 3 v201506010551Please note that   Messages  stacktraces  and nested status objects may be shortened   Bug fields like status  resolution  and whiteboard are sent  back to reporters   The list of present bundles and their respective versions was  calculated by package naming heuristics  This may or may not reflect reality Other Resources   Report      Manual  Thank you for your assistance Your friendly error reports inbox  ,3
295937,Feature  TypeTestWithAccessors and CacheIdentityMap TestModels failed to setup on PostgreSQL, CacheIdentityMapTestModel failed to setup on PostgreSQL 8 4 1 with following error      Local Exception Stack Exception  EclipseLink 4002   Eclipse Persistence Services   2 0 0 qualifier   org eclipse persistence exceptions DatabaseExceptionInternal Exception  org postgresql util PSQLException  ERROR  type modifier is not allowed for type  text Position  1732Error Code  0Query  DataModifyQuery sql  CREATE TABLE BIG BAD OBJ  ID01 BIGINT NOT NULL  ID02 BIGINT NOT NULL  ID03 BIGINT NOT NULL  ID04 BIGINT NOT NULL  ID05 BIGINT NOT NULL  ID06 BIGINT NOT NULL  ID07 BIGINT NOT NULL  ID08 BIGINT NOT NULL  ID09 BIGINT NOT NULL  ID10 BIGINT NOT NULL  STRING DATA01 VARCHAR 100   STRING DATA02 VARCHAR 100   STRING DATA03 VARCHAR 100   STRING DATA04 VARCHAR 100   STRING DATA05 VARCHAR 100   STRING DATA06 VARCHAR 100   STRING DATA07 VARCHAR 100   STRING DATA08 VARCHAR 100   STRING DATA09 VARCHAR 100   STRING DATA10 VARCHAR 100   STRING DATA11 VARCHAR 100   STRING DATA12 VARCHAR 100   STRING DATA13 VARCHAR 100   STRING DATA14 VARCHAR 100   STRING DATA15 VARCHAR 100   STRING DATA16 VARCHAR 100   STRING DATA17 VARCHAR 100   STRING DATA18 VARCHAR 100   STRING DATA19 VARCHAR 100   STRING DATA20 VARCHAR 100   CALENDAR DATA01 TIMESTAMP  CALENDAR DATA02 TIMESTAMP  CALENDAR DATA03 TIMESTAMP  CALENDAR DATA04 TIMESTAMP  CALENDAR DATA05 TIMESTAMP  CALENDAR DATA06 TIMESTAMP  CALENDAR DATA07 TIMESTAMP  CALENDAR DATA08 TIMESTAMP  CALENDAR DATA09 TIMESTAMP  CALENDAR DATA10 TIMESTAMP  DATE DATA01 DATE  DATE DATA02 DATE  DATE DATA03 DATE  DATE DATA04 DATE  DATE DATA05 DATE  DATE DATA06 DATE  DATE DATA07 DATE  DATE DATA08 DATE  DATE DATA09 DATE  DATE DATA10 DATE  TIME DATA01 TIME  TIME DATA02 TIME  TIME DATA03 TIME  TIME DATA04 TIME  TIME DATA05 TIME  TIME DATA06 TIME  TIME DATA07 TIME  TIME DATA08 TIME  TIME DATA09 TIME  TIME DATA10 TIME  TIMESTAMP DATA01 TIMESTAMP  TIMESTAMP DATA02 TIMESTAMP  TIMESTAMP DATA03 TIMESTAMP  TIMESTAMP DATA04 TIMESTAMP  TIMESTAMP DATA05 TIMESTAMP  TIMESTAMP DATA06 TIMESTAMP  TIMESTAMP DATA07 TIMESTAMP  TIMESTAMP DATA08 TIMESTAMP  TIMESTAMP DATA09 TIMESTAMP  TIMESTAMP DATA10 TIMESTAMP  LSTRING DATA01 TEXT 500   LSTRING DATA02 TEXT 500   LSTRING DATA03 TEXT 500   BLOB DATA BYTEA  SER DATA BYTEA  NUM DATA01 BIGINT  NUM DATA02 BIGINT  AGG STRING01 VARCHAR 255   AGG NUM01 BIGINT  AGG STRING02 VARCHAR 255   AGG NUM02 BIGINT  AGG STRING03 VARCHAR 255   AGG NUM03 BIGINT  REF FK01 BIGINT  REF FK02 BIGINT  REF FK03 BIGINT  PRIMARY KEY  ID01  ID02  ID03  ID04  ID05  ID06  ID07  ID08  ID09  ID10    java 324 java 800 java 866 java 586 java 529 java 914 java 205 java 191 java 234 java 214 java 85 java 670 java 2322 java 1225 java 1207 java 1167 java 936 java 81 java 904 java 188 java 889 java 297 java 248 java 240 java 41 java 178 java 276 java 178 java 413 java 200 java 313 java 248 java 208 java 313 Caused by  org postgresql util PSQLException  ERROR  type modifier is not allowed for type  text Position  1732java 2062 java 1795 java 257 java 479 java 367 java 321 java 791  ,3
527276, remoteserviceadmin  generic  Service consumer disconnect after 60 minutes, Posted to forumI have two applications which communicate with OSGi remote services on the same system But always after exactly one hour  the service consumer loses the remote services  although the host application still detects the consumer one in the remote registry If I restart the consumer application  it doesn t find the remote services anymore and the host application doesn t detect any connection  I need to restart the host application to go back to normal Does anyone have a solution to not lose the connection after this timeout  ,3
244509,Loading module SGEDRV dll failed causing Eclipse to crash, When browsing files in Eclipse IDE  for example after pressing  Browse     in Workspace Launcher  Eclipse crashes and I receive following error dialog SGEDRSE   ErrorFatal error  Loading module SGEDRV dll failed   Error  126  Eclipse is installed into laptop which has encrypted harddrive Adding Safeguard Easy into computer s system path didn t remove the problem  ,3
328717,Refactor virtually identical code blocks in 3 DatasourceCall translate methods into one, DAtasourceCall java translateCustomQuery   364 translateQueryString   657    virtually identical to 364 above translatePureSQLCustomQuery   452    slight diff            while  lastIndex     1                   int tokenIndex   queryString indexOf argumentMarker    lastIndex                  String token                 if  tokenIndex     1                       token   queryString substring lastIndex  queryString length                        lastIndex    1                   else   ,3
450249,Import Project Set should override existing projects, When I re import a projectset into my workspace and the projects in the projectset have other versions then the projects in the workspace i would expect thcurrently nothing happens  there isn t even an information about that  ,3
374352,Fails to update open files and used libraries with pull merge in Scala Projects , When using EGit with the Scala IDE for Eclipse under Windows  XP and 7 tested EGit fails to do pull changes on files scala files opened in the editor or used libraries  The exception is as follows Exception caught during execution of merge command  java io IOException  Could not delete file C  home git blahblah Testprojekt src Blah scalaSource files you can close and fix the problem with a reset and a new merge from within Eclipse  In the case of a library I had to close Eclipse and resolve the problem using the git command line   The git command line tool has no problems to replace the files while eclipse is running  This renders EGit useless for use with the Scala IDE under Windows  Under Linux and Mac OS everything works fine  To reproduce create a Scala Project with some source file  Do some changes remotely  Open the corresponding file  maybe do some edit and undo so th ,3
280703, Identifier  of Syntax items  shows functions at Syntax Coloring Preferences, Build ID  M20090211 1700Steps To Reproduce 1  Select Windows  gt  Preferences from the main menu 2  Expand Data Management  gt  SQL Development  gt  SQL Editor  gt  Syntax Coloring 3  Select  Identifier  of Syntax items  and select Underline 4  On the Preview   count  is underlined below SELECT count    AS  COLUMN  FROM tab  count  is not  Identifier  but  Function   actually it is defined at org eclipse datatools sqltools sql DefaultSQLSyntax functions  ,3
513413,Provide guidance best practices for mentoring a project, We have traditionally avoided specifying how mentors should engage with their projects  I believe thI d like to establish some guidance in the form of best practices for mentors  We probably have some information captured in this area What forms of engagement have you found that work  ,3
263536,ClassAccessor method processAccessorMethods fails to override accessor for virtual method  when method is also declared in superclass   MappedSuperclass , Build ID  1 0 2Steps To Reproduce Note  The issue really isn t the primary key  but rather the way virtual methods are handled when building class accessors  1  Create an abstract class  entity  with  MappedSuperclass annotation  named AbstractUser2  Create a field userId and getter setter3  Annotate getUserId   with  Column name  USR ID  4  Do not add  Id to the method5  Create a concrete class called User extends AbstractUser6  Add  Entity and  Table and  AttributeOverride userId with persistable false  updatable false7   Override getUserId     return super getUserId       8  Annotate concrete  virtual  method getUserId   with  Column and  Id9  Persist More information a  This may not be a problem perhaps it works as designed  Regardless  I traced it down to the ClassAccessor class in org eclipse persistence internal jpa metadata accessors classes package b  Defined under method           protected void processAccessorMethods       if  metadataMethod isValidPersistenceMethod getDescriptor     amp  amp    getDescriptor   hasAccessorFor metadataMethod getAttributeName      processAccessor buildAccessor metadataMethod                  c  The  issue  is that accessors are being built first for the superclass AbstractUser   now the order is not necessarly the issue  but rather whenit comes to the concrete class  User  it skips the processAccessor  buildAccessor  metadataMethod     call  Reason  getUserId   has already been built when it walked the declaredMethods for the superclass  d  As a result   Id field is never read  despite it being the  concrete  class e  So  since user class has a virtual method getUserId    should it not be treated as such  overriding the existing super method  along with its annotations e  Especially if  AttributeOverride has been placed on the User entity   like   AttributeOverride name    userId   column    Column name    USR ID   insertable   false  updatable   false                                  Exception Description  Entity class  class ca domain base model view CurrentUser  has no primary key specified  It should define either an  Id   EmbeddedId or an  IdClass  If you have defined PK using any of these annotations then please make sure thjava 1338 java 473 java 409 doPrivileged Native Method java 380 java 264 java 222 java 261 java 185 java 164 java 269     35 more                                    ,3
326141,Building SWT package fails on target replace64 with java lang StringIndexOutOfBoundsException  start  gt  length  , Hello I m running a Eclipse 3 6  Helios  IDE on Mac with 64 bit VM and the coupled ant version 1 7 1 Now I tried to build the swt package in the following steps A  checking them out via Anonymous CVS access   pserver   cvsroot eclipseaccording the description of   checked out TRUNK All steps work fine  additionally I also follwed the notes according to B  Now according point 4  in  I started running Ant from the context menu But then the build stops because of the  java lang StringIndexOutOfBoundsException In Bugzilla I looked for similar occurences and I found the  thMaybe this might help you Besides checking out Trunk I tried some other Branches like v3655 or R3 6maintenance branch but all resulted in the same error Below are the output of Ant log and an extract of  metadata  log file Buildfile   Users ralfschukey Desktop SW eclipse workspace org eclipse swt cocoa macosx x86 64 build xmlproperties init build jars properties init  dot        delete  Deleting directory  Users ralfschukey Desktop SW eclipse workspace org eclipse swt cocoa macosx x86 64 temp folder  dot bin        mkdir  Created dir   Users ralfschukey Desktop SW eclipse workspace org eclipse swt cocoa macosx x86 64 temp folder  dot bincopy cocoa src        delete  Deleting directory  Users ralfschukey Desktop SW eclipse workspace org eclipse swt cocoa macosx x86 64 temp folder  dot src         copy  Copying 764 files to  Users ralfschukey Desktop SW eclipse workspace org eclipse swt cocoa macosx x86 64 temp folder  dot srccopy translationfiles is64          echo  Is64 truereplace64          echo  Converting java files to 64 bitBUILD FAILED Users ralfschukey Desktop SW eclipse workspace org eclipse swt buildFragment xml 95  The following error occurred while executing this line  Users ralfschukey Desktop SW eclipse workspace org eclipse swt buildFragment xml 74  The following error occurred while executing this line  Users ralfschukey Desktop SW eclipse workspace org eclipse swt buildFragment xml 197  The following error occurred while executing this line  Users ralfschukey Desktop SW eclipse workspace org eclipse swt buildFragment xml 423  java lang StringIndexOutOfBoundsException  start  gt  length  Total time  2 secondsextracts from  log   file  Users ralfschukey Desktop SW eclipse workspace org eclipse swt buildFragment xml 74  The following error occurred while executing this line  Users ralfschukey Desktop SW eclipse workspace org eclipse swt buildFragment xml 197  The following error occurred while executing this line  Users ralfschukey Desktop SW eclipse workspace org eclipse swt buildFragment xml 423  java lang StringIndexOutOfBoundsException  start  gt  length  java 508 java 418 java 105 java 288 invoke Unknown Source java 25 java 597 java 106 java 348 java 357 java 385 java 1337 java 38 java 30 java 1189 java 416 java 105 java 288 invoke Unknown Source java 25 java 597 java 106 java 348 java 357 java 385 java 1337 java 1306 java 41 java 32 java 1189 java 662 java 495 invoke0 Native Method java 39 java 25 java 597 java 378 java 298 java 637 Caused by   Users ralfschukey Desktop SW eclipse workspace org eclipse swt buildFragment xml 197  The following error occurred while executing this line  Users ralfschukey Desktop SW eclipse workspace org eclipse swt buildFragment xml 423  java lang StringIndexOutOfBoundsException  start  gt  length  java 508        Configuration Details   Product  Eclipse 1 3 0 20100617 0521  org eclipse epp package jee product Installed Features  org eclipse platform 3 6 0 v20100602 9gF78GpqFt6trOGhL60z0oEx3fz JKNwxPY ,3
421613,Provide Serverplatform for TomEE,   is gaining momentum as lightweight opensource app server  It has transaction support  so it should be relatively easy to integrate it fully with EclipseLink Please provide a server platform for easy configuration Note  Transaction manager is located in java comp env comp TransactionManager ,3
242759,Adapters should be provided to Tigerstripe to generate SML models,  ,3
512364,Templates   Enhance Renaming Action, Example template json      rename     template     0   1   2    params     packageName    projectName    fileName        ,3
457166,MOXyJsonProvider does not support empty input, According to the following question on Stack Overflow   MOXyJsonProvider will throw the following exception if it is passed no content to parse ailed to execute  javax ws rs WebApplicationException  javax xml bind UnmarshalException   with linked exception   Exception  EclipseLink 25004   Eclipse Persistence Services   2 6 0 v20141224 924f6b4   org eclipse persistence exceptions XMLMarshalException Exception Description  An error occurred unmarshalling the document Internal Exception  javax json stream JsonParsingException  Invalid token EOF  72 more ,3
305027,EclipseLink does not support loading the persistence xml file using the JarRsrcLoader, Build Identifier  20090920 1017JPA Project th Reproducible  AlwaysSteps to Reproduce 1  Create a JPA project in Eclipse2  Export project as a runnable jar 3  Run the application using the command java  jar  lt name gt  jar ,3
366328,Semantic File System  WebDAV content provider improvements, Build Identifier  Version  3 7 1 Build id  M20110909 1335  latest SFS plugin downloaded I ve written a patch to improve WebDAV content provider for the Semantic File System Improvements List   Wizard follows permanently moved paths and warning of temporarily moved paths  useful when the user forget the final slash for a WebDAV collection path    Date was not correct  due to month count th  Correctly manage and create WebDAV collections  directories    Added the ability to delete resources in repository  files and collections    Right management   Synchronization mechanism widely improved  works for collections too    Improved error messages for synchronization  lock  unlock  create and delete  It gives also helpful hints to resolve the problem   Some other corrections Reproducible  Always ,3
513555,Provide a mechanism so that a faillng services can report back through the  validation  form header, An example scenario   I defined a service which for instance do an HTTP request and I bind it to a button in the property view  When the request fails the transaction will be rollbacked but I have no way to inform the user besides opening a popup or a message dialog directly from the service implementation WhAnother use case   createFromString failed for some reason  for instance the user mistyped a specific format   the transaction is rollbacked but the user has no feedback about why it got rollbacked  ,3
332952,Perf  Spring Insight   support and guidelines for SE in memory db performance, We need to support users of EclipseLink th ,3
428392,Provide Feature for JDT User Library with RMF core on the classpath , We do have scenarios where ReqIF files are processed with MWE or Xpand Xtend  For some of these  it is necessary  thManually adding Eclipse Bundles to the classpath is annonying  because you have to provide the full path to the eclipse installation We do have an Eclipse plugin thWe would be willing to contribute that  Is that of interest  ,3
515241,org xbill dns bundle used by DNS SD provider may be incompatible with Java 9, FYI  the org eclipse ecf provider dnssd  1 2 100 v20160823 2221  bundle in the Oxygen M6 repository contains a reference to org xbill 2 0 8  which has been added to Orbit ages ago  with CQ 4551  and which receives some complaints by jdeps org xbill dns 2 0 8 v201112050911 jar   gt   Library Java JavaVirtualMachines jdk1 8 0 111 jdk Contents Home jre lib rt jar   org xbill DNS spi DNSJavaNameServiceDescriptor  org xbill dns 2 0 8 v201112050911 jar         gt  sun net spi nameservice NameService                JDK internal API  rt jar         gt  sun net spi nameservice NameServiceDescriptor      JDK internal API  rt jar Not sure whether this is a code path actually exercised by org eclipse ecf provider dnssd  though FWIW  the latest version  2 1 8  from  1  still elicits the same warning  1   lt  ,3
487774, Compare  Help the user identify files that have not changed and were commented,  ,3
366971,Parsing    of Python code throws exceptions and completion doesn t work, Build Identifier  Eclipse Build id  20110916 0149  Dynamic Languages Toolkit   Core Frameworks4 0 0 201111171103org eclipse dltk core feature groupEclipse org  When starting nightly build of DLTK Python IDE  I get a lot of backtraces on stderr and no symbol  methods  completion in the IDE Reproducible  AlwaysSteps to Reproduce 1 start Eclipse2 open Python file3  lt Ctrl gt   lt space gt  ,3
513168,Feature and provider name left to default fo rorg eclipse datatools enablement ibm feature, Feature listThey are left to providerName and pluginName ,3
281096,Table Tree custom draw events are sent for columns outside of viewport, 3 5  only happens on win32  start with Snippet230  change its columnCount from 3 to 30  and put a println in the PaintItem listener to print the item and column index for received events  run the snippet  observe that   the first 8 columns are in the viewport    gt  but PaintItem events are received for all 30 columns    gt  every touch of a scrollbar causes this as well    gt  also happens for MeasureItem and EraseItem listeners ,3
201506,try   except   else   finally construct not supported, fixes the pproblemBuild ID  I20070625 1500Steps To Reproduce The folloowing construct must be parsed normally but it is not try passexcept passfinally passMore information  ,3
