259569,easy way call OSGi plug APIs outside OSGi company produces software development tools static analysis tools Often tools invoked command line Eclipse GUI sometimes must invoked direct Java calls existing java systems build systems web servers etc existing systems hundreds times larger simple tools impose requirements work would like tools use OSGi internally OSGi greSo expose plug APIs outside world Remember APIs use OSGi internally load plug ins Options Allow client instantiate API classes directly using JARs Problem defining class loader OSGi bundle class loader means loading plug ins work Platform getExtensionRegistry work unless loaded class loader Persuade customers structure part code IApplication run th Add mechanism EclipseStarter similar classes ask IExtensionRegistry similar could called inside outside Eclipse meaning clients could instantiate APIs using class loaders Yet APIs still able load plug ins Add API client APIs declare user given plugin package within OSGi get class loader fiddled thThe closest come class run Runnable access OSGi plug APIs described Example customer code might look like package com macrobug testOutside import com macrobug osgiWrapper OsgiWrapper import com macrobug testinside IResults import com macrobug testinside MyAPI public class Main public static String resultsHolder public static void main String args try OsgiWrapper runInOsgi MyRunnable class getName Users adriantaylor Desktop testInsideExport eclipse com macrobug testinside System println Results holder resultsHolder catch Exception e e printStackTrace public static class MyRunnable implements Runnable public void run MyAPI myapi new MyAPI IResults results myapi doFirstApi call plug Uses plug ins implementation resultsHolder results getResults example com macrobug testinside name package contained within perfectly normal OSGi plug contains MyAPI IResults classes used turn uses plug ins Users adriantaylor Desktop testInsideExport eclipse location exported Eclipse installation contains plug others Everything clever done OsgiWrapper class got three monster hacks summary fabricates asks th Finally forces thThe complete code Note th package com macrobug osgiWrapper import java io ByteArrayInputStream import java io ByteArrayOutputStream import java io File import java io FileInputStream import java io FileNotFoundException import java io IOException import java io InputStream import java io OutputStream import java io OutputStreamWriter import java io Writer import java util ArrayList import java util Collection import java util jar JarOutputStream import java util zip ZipEntry import org eclipse core runtime adaptor EclipseStarter import org osgi framework Bundle import org osgi framework BundleContext Class take name runnable run access certain OSGi APIs contents file hereby released public domain Note th author adriantaylor public class OsgiWrapper Run given Runnable class loader access certain APIs defined OSGi Eclipse plug ins param classNameWeMustLoad name Runnable get using lt tt gt MyRunnable class getName lt tt gt Runnable instantiated programmatically must public public zero argument constructor code within plug executed using link ClassLoader access APIs OSGi plug well code lt p gt Currently Runnable must found class path inside JAR file work Runnable JAR file using wacky link ClassLoader param installDirectory directory installation Eclipse found contains required plug ins param packages list packages wish import Eclipse plug ins Currently first made available throws Exception kinds things go wrong SuppressWarnings unchecked public static void runInOsgi String runnableClassName String installDirectory String packages throws Exception Set OSGI System setProperty eclipse application com macrobug osgiWrapper plugin DynamicApplication System setProperty osgi configuration area installDirectory configuration System setProperty osgi install area file installDirectory System setProperty osgi framework file installDirectory plugins findOsgiPluginName new File installDirectory plugins BundleContext ctx EclipseStarter startup new String null Fabricate fake Eclipse plug asks access desired packages actually construct binary JAR content plug dynamic plug contains IApplication run start Eclipse simply pass ClassLoader back us use Bundle b ctx installBundle com macrobug osgiWrapper plugin createDynamicPlugin packages b start Start Eclipse run IApplication return ClassLoader ClassLoader osgiInnerClassLoader ClassLoader EclipseStarter run null create hybrid class loader search classes OSGi plug ins falling back existing class loader ClassLoader l new OsgiMungedClassLoader osgiInnerClassLoader OsgiWrapper class getClassLoader runnableClassName Install context class loader case anybody actually cares Thread currentThread setContextClassLoader l Finally ask new class loader load Runnable Class lt extends Runnable gt c Class lt extends Runnable gt l loadClass runnableClassName run Runnable r c newInstance Anything Runnable done context class loader able load use APIs OSGi plug r run Find OSGi core plug th param directory plug directory return name OSGi plug throws FileNotFoundException seem exist private static String findOsgiPluginName File directory throws FileNotFoundException String directory list startsWith org eclipse osgi return throw new FileNotFoundException Unable find org eclipse osgi plugin Return InputStream contains dynamic plug param packages packages plug import return InputStream plug read throws IOException something goes wrong private static InputStream createDynamicPlugin String packages throws IOException ByteArrayOutputStream baos new ByteArrayOutputStream writePlugin packages baos byte pluginBytes baos toByteArray return new ByteArrayInputStream pluginBytes 0 pluginBytes length Write dynamic plug OutputStream used write file test purposes param packages packages plug import param baos output stream throws IOException case problem private static void writePlugin String packages OutputStream baos throws IOException Error JarOutputStream jos new JarOutputStream baos try putDirEntry META INF jos ZipEntry mf new ZipEntry META INF MANIFEST MF jos putNextEntry mf Writer w new OutputStreamWriter jos w write Manifest Version 1 0 n w write Bundle ManifestVersion 2 n w write Bundle Name Plugin Plug n w write Bundle SymbolicName com macrobug osgiWrapper plugin singleton true n w write Bundle Version 1 0 0 n w write Bundle Vendor MACROBUG n w write Bundle RequiredExecutionEnvironment J2SE 1 5 n w write Require Bundle org eclipse core runtime bundle version 3 4 0 n w write Import Package packages 0 n w flush jos closeEntry ZipEntry xml new ZipEntry plugin xml jos putNextEntry xml w new OutputStreamWriter jos w write lt xml version 1 0 encoding UTF 8 gt n lt eclipse version 3 2 gt n lt plugin gt n lt extension n id DynamicApplication n name DynamicApplication n point org eclipse core runtime applications gt n lt application n cardinality singleton global n thread main n visible true gt n lt run n class com macrobug osgiwrapper plugin DynamicApplication gt n lt run gt n lt application gt n lt extension gt n lt plugin gt n w flush jos closeEntry putDirEntry com jos putDirEntry com macrobug jos putDirEntry com macrobug osgiwrapper jos putDirEntry com macrobug osgiwrapper plugin jos ZipEntry clz new ZipEntry com macrobug osgiwrapper plugin DynamicApplication class jos putNextEntry clz following line refers resource byte code package com macrobug osgiwrapper plugin import org eclipse equinox app IApplication import org eclipse equinox app IApplicationContext public class DynamicApplication implements IApplication public Object start IApplicationContext context throws Exception return getClass getClassLoader public void stop InputStream OsgiWrapper class getResourceAsStream DynamicApplication bin null throw new IOException Unable getResourceAsStream int oneByte oneByte read 1 jos write oneByte jos closeEntry finally jos close Small utility method create directory JAR private static void putDirEntry String string JarOutputStream jos throws IOException ZipEntry direntry new ZipEntry string jos putNextEntry direntry Class loader able pull classes either inside world OSGi plug ins outside also special explicit handling certain class passed classNameWeMustLoad always defined class even readily available class loaders appears way force Java ask class loader wants load classes must actually lt em gt defining lt em gt class loader Runnable merely lt em gt initiating lt em gt class loader insufficient author adriantaylor private static class OsgiMungedClassLoader extends ClassLoader private ClassLoader osgiClassLoader private ClassLoader realWorldClassLoader private String classNameWeMustLoad private Collection lt File gt dirs Constructor param osgiInnerClassLoader class loader forcibly extracted OSGi used load APIs OSGi plug ins param classLoader class loader real outside world used load classes nothing OSGi param classNameWeMustLoad name class must explicitly definitely load even available elsewhere public OsgiMungedClassLoader ClassLoader osgiInnerClassLoader ClassLoader classLoader String classNameWeMustLoad dirs makeDirs osgiClassLoader osgiInnerClassLoader realWorldClassLoader classLoader classNameWeMustLoad classNameWeMustLoad private static Collection lt File gt makeDirs ArrayList lt File gt urls new ArrayList lt File gt StringBuffer current new StringBuffer String System getProperty java class path int 0 lt length charAt File pathSeparatorChar urls add new File current toString current new StringBuffer else current append charAt urls add new File current toString return urls non Javadoc see java lang ClassLoader loadClass java lang String Load class asked load Runnable always load even available one class loaders hack choice simply must load order recorded defining class loader classes loads requested via us pass onto OSGi class loader public Class lt gt loadClass String name throws ClassNotFoundException classNameWeMustLoad equals name String binname name replaceAll binname binname class File f dirs try f isDirectory File classfile new File f binname classfile canRead byte bytes new byte int classfile length 2 FileInputStream fis new FileInputStream classfile try int numRead fis read bytes return defineClass name bytes 0 numRead finally fis close catch IOException e throw new Error Unable find class name searching binname within dirs toString runnable see whether class available OSGi class loader access Eclipse OSGi APIs interested go back outside class loader try Class lt gt c osgiClassLoader loadClass name c null return c catch ClassNotFoundException e return realWorldClassLoader loadClass name purpose bug ask OSGi Equinox get mechanism fulfils need load questions anyone reading bug 1 completely different way achieve objectives 2 example client instantiates APIs directly using class loader like use Platform getExtensionRegistry similar load OSGi plug ins Even though plug since loaded using normal class loader schemes seems logically sensible allows OSGi used parts systems without whole thing modularised way 3 forced stick hacks better ways achieve parts 4 example way retrospectively change class loader used Java class load classes could simply retro fit hybrid class loader class without mess force instantiating Runnable loading Runnable hugely fragile imposes restrictions upon way outside code structured 5 way ask current ClassLoader instantiate Runnable ensure JVM marks definining 6 nicer way squeeze OSGi classloader OSGi without fake plug 7 main purpose bug could sort less horrible mechanism fulfil purpose added OSGi Equinox Eclipse better still could equivalent Platform getExtensionRegistry added called outside OSGi ,3
414663,IDE fails load Mac update installed eclipse jee kepler RC3 macosx cocoa x86 64 starts fine Subsequently perform check updates updates auto detect epp package jee 2 0 0 20130613 5030Which load eclipse start ,3
282344,p2 P2 recognize Bundles installed IDE OSGI way Neil Bundle View Install Bundles running IDE works well installed Bundles shown Plug registry View also listed Bundles System Plug registry exploring Installation Details gt Configuration Bundles listed P2 IU Configuration Maybe reason thShouldn P2 listen new Bundles installed using BundleContext installBundle hood create IU ,3
426108,EFacet Model Editor safe changes change model editor marked dirty save seems store changes however never make efacet file Could hint ENTRY org eclipse emf facet efacet core 2 0 2014 01 20 12 29 04 745 MESSAGE result FacetManagerContext getOverrideCandidateFeatures empty baseFeature platform plugin org eclipse emf facet efacet examples library core library efacet book BookExt bookCover message sent org eclipse emf facet efacet core 0 4 0 201312171230 STACK 0org eclipse emf facet util core Logger LogStackTracejava 116 java 54 java 259 java 142 java 98 java 262 java 248 java 499 java 109 java 233 java 382 java 370 java 160 java 140 java 60 java 123 java 33 java 16 java 34 java 884 java 651 java 292 java 288 java 230 java 84 java 4171 java 1467 java 1490 java 1475 java 1244 java 166 java 749 java 161 java 5565 objc msgSendSuper Native Method java 4949 java 5327 objc msgSend Native Method java 94 java 3647 java 1122 java 332 java 1006 java 146 java 611 java 332 java 565 java 150 java 125 java 196 java 109 java 80 java 372 java 226 invoke0 Native Method java 57 java 43 java 606 java 636 java 591 java 1450 ,3
544908,CDO genmodel currupted emf cdo installed java lang ArrayStoreException org eclipse emf cdo ecore impl EStringToStringMapEntryImpl Cloned 544907 CDO genmodel currupted emf cdo installed java lang ArrayStoreException org eclipse emf cdo ecore impl EStringToStringMapEntryImplStep reproduce 1 Eclipse CDO installed take plugin org eclipse papyrus infra properties2 Open file Properties genmodel get 4 errors file see attachment exception errors java lang ArrayStoreException org eclipse emf cdo ecore impl EStringToStringMapEntryImpljava 118 java 417 java 325 java 309 java 377 java 1 java 1173 java 2710 java 2700 java 2221 java 2089 java 151 java 1868 java 1048 java 82 java 1026 java 720 java 190 startElement Unknown Source emptyElement Unknown Source scanStartElement Unknown Source next Unknown Source next Unknown Source scanDocument Unknown Source parse Unknown Source parse Unknown Source parse Unknown Source parse Unknown Source parse Unknown Source parse Unknown Source java 175 java 261 java 1563 java 1342 java 259 java 274 java 406 java 220 java 209 java 269 java 1477 java 206 java 161 java 60 java 348 java 698 java 685 java 9732 java 633 java 130 java 78 java 780 java 644 java 1158 java 351 java 156 java 102 java 367 invoke0 Native Method invoke Unknown Source invoke Unknown Source invoke Unknown Source java 58 java 1001 java 966 java 139 java 411 java 333 java 193 java 108 java 77 java 59 java 132 java 1015 java 675 java 781 java 752 java 746 java 45 java 730 java 107 java 38 java 236 java 147 java 4580 java 219 java 38 java 205 java 203 java 1 java 233 java 151 java 132 java 75 java 44 java 55 java 63 java 424 java 177 java 641 java 605 java 791 java 404 java 1240 java 3317 java 3216 java 72 java 3213 java 3177 java 326 java 183 java 89 java 4131 java 1055 java 3944 java 3547 java 1173 java 339 java 1062 java 156 java 636 java 339 java 563 java 151 java 155 java 203 java 137 java 107 java 400 java 255 invoke0 Native Method invoke Unknown Source invoke Unknown Source invoke Unknown Source java 659 java 595 java 1501 java 1474 ,3
457018,DS Provide debugging command unresolved component references Patch SCRCommandProviderIf using services via component framework often desirable debug dependency chains components development runtime components get enabled various reasons sometimes hard analyze whTherefor propose extend SCRCommandProvider recursively resolve component depenencies list candidate implementations associated states command applied patch cc debugging component dependencies Note debugging command limited component definitions programmatically registered services found However beneficial component definitions widely used Note2 extensions probably required cases immediate attributes set unset components th ,3
255851,Consider moving ee files jars org eclipse osgi Currently osgi folder org eclipse osgi ee stub jars OSGi EE min version 1 1 1 2 foundation 1 1 EE also contains ee files configuring jars execution environments Eclipse consider moving files jars project checked separately org eclipse osgi files generally useful others force check org eclipse osgi get ,3
151470,server provide infrastructure facilitate building war file part graduation server side work need see product war file explore possibility plugin customSteps ,3
517265,Description Committers Package Website outdated Eclemma added committers packgage via description package seen download homepage accurate Package suited development Eclipse perhaps Package suited development Eclipse think Marketplace Client really worth mentioning goodies well think ,3
240708,Metadata view area feature description support HTML commented discusses need expose metadata th Ideally form ,3
314756,Browser Browser freezes setText full dump taken believe problem addition Eclipse freezing whenusing content assist seems free hover object method Iam running Eclipse 3 5 1 build ID 20090920 1017 Windows XP havetried Eclipse 3 3 well problem exists problem onlyoccurs connected internet Main thread full dump attached main prio 6 tid 0x00a56800 nid 0xc8c runnable 0x0013e000 java lang Thread State RUNNABLEVtblCall Native Method java 64 java 487 java 450 java 956 java 949 java 318 java 1170 java 1139 java 418 java 533 java 1120 java 1110 java 517 java 462 java 342 locked lt 0x0abf0068 gt org eclipse jface text contentassist AdditionalInfoController 10 java 35 java 134 locked lt 0x0abf5068 gt org eclipse swt widgets RunnableLock java 3855 java 3476 java 2405 java 2369 java 2221 java 500 java 332 java 493 java 149 java 113 java 194 java 110 java 79 java 368 java 179 invoke0 Native Method invoke Unknown Source invoke Unknown Source invoke Unknown Source java 559 java 514 java 1311 ,3
382339,Hide empty compartments Hi hide empty flag compartments would useful automatically hide compartments thRalph ,3
495225,APT generate import statements generated types generate many types know thAs noted recent commit load Buck project Eclipse 4 6 0RC2 choose Project gt Clean select Buck still get broken build due compilation errors files generated apt generated folder Alphabetically first error apt generated com facebook buck android AndroidPackageableCollection java complains two unknown types BuildTarget BuildConfigFields However files exist Eclipse even takes cmd click names AndroidPackageableCollection java apt generated com facebook buck model BuildTarget java apt generated com facebook buck rules coercer BuildConfigFields javaThe issue thNote th ,3
296879,fails start simple service User Agent Mozilla 5 0 Windows U Windows NT 5 1 en US AppleWebKit 532 0 KHTML like Gecko Chrome 3 0 195 33 Safari 532 0Build Identifier 20090920 1017I implemented simple xtn point org eclipse equinox http registry servlets run get following errorosgi gt Persistence bundle starting Persistence bundle started ProviderTracker New service detected ProviderTracker Added service org eclipse persistence jpa osgi PersistenceProviderOSGiWorkbench yet availableWorkbench yet availableWorkbench yet availableWorkbench yet availableWorkbench yet availableWorkbench yet availableWorkbench yet availableWorkbench yet availablethe http server never gets started one plugin workspace Reproducible AlwaysSteps Reproduce Followed tutorial step stephere plugin xml file lt xml version 1 0 encoding UTF 8 gt lt eclipse version 3 4 gt lt plugin gt lt extension point org eclipse equinox http registry servlets gt lt servlet class com ibm example HelloServlet alias hello gt lt extension gt lt plugin gt MANIFEST MF file Manifest Version 1 0Bundle ManifestVersion 2Bundle Name ExampleBundle SymbolicName com ibm example singleton trueBundle Version 1 0 0 qualifierBundle Vendor IBMBundle RequiredExecutionEnvironment JavaSE 1 6Require Bundle javax servlet bundle version 2 5 0 org eclipse equinox http registry bundle version 1 0 200 works older version tried 3 2 2 ,3
292062,Provide way dynamically introspect SWT port info User Agent Mozilla 5 0 Windows U Windows NT 5 1 en US rv 1 9 1 3 Gecko 20090824 Firefox 3 5 3Build Identifier 3 6M2It difficult deploy standalone applications multiple platforms need per platform launchers ship right libs right platforms etc would nice class SWT thThis would convenient build intelligent launchers could example list content known directory SWT Jars located would detect one use probably using dedicated class loader Reproducible AlwaysSteps Reproduce Currently way get information ,3
181958,Provide user preference tag sorting palette ,3
148805,Allow specify priority ContributionItemProvider ,3
425626,memory leak DiagramRulerProvider project use gmf get memory leak issue found thEven DiagramEventBroker use weakhashmap store listener key guide also referenced value listener released resource unload way remove listener guides added NotificationListener init ,3
513531,Make constructServiceProviderURI method public Currently constructServiceProviderURI method generated automatically private static method thThe adaptor developer might need create SP URIs inside adaptor consistently purposes providing OSLC responses adaptor used test proposed change ended 1 making constructServiceProviderURI method provider public2 defining interface ServiceProviderUriConstructor single method thDo think create patch least 1 possibly somehow adapted 2 ,3
206778,Provide model oriented Outline View Provide model elements oriented Outline View instead graphical elements oriented view tree representation behaves EMF Tree structure editor Outline View also reflects available diagrams user may activate Diagram double clicking Properties View synchronized Outline View selecting element outline view properties displayed Properties View possible synchronized Outline View contents editor contents Link editor button available views useful retrieve element model features available Ecore Diagram Component proposal ,3
543449,Add Learn navigation bar Eclipse IDE Please see example Eclipse IDEDownload gt Learn moreDocumentationGetting Started SupportHow ContributeIDE ToolsNewcomer Forum ,3
263028,Printing centered labels inside nodes geoshape editor sample file Build ID M20080911 1700Steps Reproduce 1 Open geoshape diagram file attachment corresponding geoshape sample editor 2 Print observe delta shown attachments label centered anymore printed information ,3
376076,operation Provide Operation query profile running instance user trying find version feature thIt would easier users method operation factory th ,3
311114,WPE palette hide empty tag libraries default ,3
271794,XXXSheetLabelProvider invalid text icon design elements Build ID I20090313 0100Steps Reproduce 1 Open Ecore Diagram Editor 2 Create Note Select created Note3 Open properties view Header properties view contains information package note ,3
447105,connect JDT headless service including provider via RabbitMQ ,3
149165,Guide GMFMap Creation wizard standard size Invoke new wizard Choose Graphican Modeling Framework Guide GMFMap Creation press next gt size wizard changed Guide GMFMap Creation wizard standard wizard size ,3
351824,Hide selection ShapeNodeEditPart showing connections edges links properly undo reproduce following Ecore diagram editor GMF editor connections 1 Create two classes B 2 Create inheritance link B e gt B 3 Hide B hide separately right click Filter gt Hide selection 4 Ctrl z undo two times Bug inheritance connection link edge appear Closing opening editor fix Solution Instead using org eclipse gmf runtime diagram core util ViewUtil get Target Source ConnectionsConnectingVisibleViews View org eclipse gmf runtime diagram ui editparts ShapeNodeEditPart getModel Target Source Connections one useorg eclipse gmf runtime diagram core util ViewUtil get Target Source Connections View issues using method ,3
293850,Add REPL view Scheme Perspective Add command line REPL th ,3
364080,Provide Maven index EclipseLink Maven repository Build Identifier Providing Maven index EclipseLink Maven repository would make easier clients Eclipse m2e well proxying repo managers like Nexus know available Maven repo process using official Eclipse Nexus instance taking quite time would greTo produce Maven index Maven indexer used could scheduled execute per day example Reproducible Always ,3
149429,possible specify whether empty string written domain model user provides emty string label Open diagram Create node label Enter text via direct edit Remove text via direct edit set label text empty string gt domain model file specifies empty string string attribute value possible specify tooling models value null name domain model xml ,3
299868,Scheme Rename Scheme Package Explorer far tell packages scheme right Would make sense rename Scheme Package Explorer view something appropriate perhaps something along lines Scheme Project Explorer ,3
