353257,dependency circle cdt core cdt managedbuilder core Build Identifier activator classes cdt core CCorePlugin cdt managedbuilder core ManagedBuilderCorePlugin load start handling one thread using class type cdt core plugin another one using type cdt managedbuilder core 2 threads end dependency loop equinox detects class loaded breaks loop 5 seconds end see thI actually see starting eclipse normally using test runner CCorePlugin start behavior loading managed builder introduced order address delay loading problem ManagedBuilderCorePlugin class needs stuff implemented cdt core Reproducible SometimesSteps Reproduce provide call stacks easily however code using cdt core cdt managedbuild core custom threads hope call stacks eclipse log file shows problem clearly enough needed try create custom test One case Worker 4 activating org eclipse cdt managedbuilder core see ManagedBuilderCorePlugin start main thread activating org eclipse cdt core see CCorePlugin start Full threads Thread Worker 4 Suspended owns org eclipse core internal variables StringVariableManager id 50 owns java lang Class lt gt com freescale startup RseInitializer id 51 waiting java lang Object id 49 java lang Object wait long line available native method org eclipse osgi framework internal core BundleHost org eclipse osgi framework internal core AbstractBundle beginStateChange line 1085 org eclipse osgi framework internal core BundleHost org eclipse osgi framework internal core AbstractBundle start int line 282 org eclipse osgi framework util SecureAction start org osgi framework Bundle int line 417 org eclipse osgi internal loader BundleLoader setLazyTrigger line 276 org eclipse core runtime internal adaptor EclipseLazyStarter postFindLocalClass java lang String java lang Class org eclipse osgi baseadaptor loader ClasspathManager line 106 org eclipse osgi baseadaptor loader ClasspathManager findLocalClass java lang String line 453 org eclipse osgi internal baseadaptor DefaultClassLoader findLocalClass java lang String line 216 org eclipse osgi internal loader BundleLoader findLocalClass java lang String line 404 org eclipse osgi internal loader SingleSourcePackage loadClass java lang String line 33 org eclipse osgi internal loader BundleLoader findClassInternal java lang String boolean java lang ClassLoader line 477 org eclipse osgi internal loader BundleLoader findClass java lang String boolean line 433 org eclipse osgi internal loader BundleLoader findClass java lang String line 421 org eclipse osgi internal baseadaptor DefaultClassLoader loadClass java lang String boolean line 107 org eclipse osgi internal baseadaptor DefaultClassLoader java lang ClassLoader loadClass java lang String line 248 org eclipse cdt managedbuilder internal buildmodel BuildStateManager startup line 146 org eclipse cdt managedbuilder core ManagedBuilderCorePlugin start org osgi framework BundleContext line 108 org eclipse osgi framework internal core BundleContextImpl 1 run line 783 java security AccessController doPrivileged java security PrivilegedExceptionAction lt gt line available native method org eclipse osgi framework internal core BundleContextImpl startActivator org osgi framework BundleActivator line 774 org eclipse osgi framework internal core BundleContextImpl start line 755 org eclipse osgi framework internal core BundleHost startWorker int line 370 org eclipse osgi framework internal core BundleHost org eclipse osgi framework internal core AbstractBundle start int line 284 org eclipse osgi framework util SecureAction start org osgi framework Bundle int line 417 org eclipse osgi internal loader BundleLoader setLazyTrigger line 276 org eclipse core runtime internal adaptor EclipseLazyStarter postFindLocalClass java lang String java lang Class org eclipse osgi baseadaptor loader ClasspathManager line 106 org eclipse osgi baseadaptor loader ClasspathManager findLocalClass java lang String line 453 org eclipse osgi internal baseadaptor DefaultClassLoader findLocalClass java lang String line 216 org eclipse osgi internal loader BundleLoader findLocalClass java lang String line 404 org eclipse osgi internal loader SingleSourcePackage loadClass java lang String line 33 org eclipse osgi internal loader BundleLoader findClassInternal java lang String boolean java lang ClassLoader line 477 org eclipse osgi internal loader BundleLoader findClass java lang String boolean line 433 org eclipse osgi internal loader BundleLoader findClass java lang String line 421 org eclipse osgi internal baseadaptor DefaultClassLoader loadClass java lang String boolean line 107 org eclipse osgi internal baseadaptor DefaultClassLoader java lang ClassLoader loadClass java lang String line 248 java lang Class lt gt getDeclaredConstructors0 boolean line available native method java lang Class lt gt privateGetDeclaredConstructors boolean line 2389 java lang Class lt gt getConstructor0 java lang Class int line 2699 java lang Class lt gt newInstance0 line 326 java lang Class lt gt newInstance line 308 org eclipse core internal registry osgi EquinoxRegistryStrategy org eclipse core internal registry osgi RegistryStrategyOSGI createExecutableExtension org eclipse core runtime spi RegistryContributor java lang String java lang String line 184 org eclipse core internal registry ExtensionRegistry createExecutableExtension org eclipse core runtime spi RegistryContributor java lang String java lang String line 904 org eclipse core internal registry ConfigurationElement createExecutableExtension java lang String line 243 org eclipse core internal registry ConfigurationElementHandle createExecutableExtension java lang String line 55 org eclipse core internal variables StringVariableManager loadVariableProviders line 252 org eclipse core internal variables StringVariableManager initialize line 210 org eclipse core internal variables StringVariableManager getDynamicVariable java lang String line 452 com freescale cdt debug cw core CWPlugin getRuntimePath line 192 com freescale cdt debug cw core CWPlugin inRuntimeWorkbench line 175 com freescale cdt debug cw core CWPlugin getCWBinPath line 150 com freescale cdt debug cw core CWPlugin start org osgi framework BundleContext line 268 org eclipse osgi framework internal core BundleContextImpl 1 run line 783 java security AccessController doPrivileged java security PrivilegedExceptionAction lt gt line available native method org eclipse osgi framework internal core BundleContextImpl startActivator org osgi framework BundleActivator line 774 org eclipse osgi framework internal core BundleContextImpl start line 755 org eclipse osgi framework internal core BundleHost startWorker int line 370 org eclipse osgi framework internal core BundleHost org eclipse osgi framework internal core AbstractBundle start int line 284 org eclipse osgi framework util SecureAction start org osgi framework Bundle int line 417 org eclipse osgi internal loader BundleLoader setLazyTrigger line 276 org eclipse core runtime internal adaptor EclipseLazyStarter postFindLocalClass java lang String java lang Class org eclipse osgi baseadaptor loader ClasspathManager line 106 org eclipse osgi baseadaptor loader ClasspathManager findLocalClass java lang String line 453 org eclipse osgi internal baseadaptor DefaultClassLoader findLocalClass java lang String line 216 org eclipse osgi internal loader BundleLoader findLocalClass java lang String line 404 org eclipse osgi internal loader SingleSourcePackage loadClass java lang String line 33 org eclipse osgi internal loader BundleLoader findClassInternal java lang String boolean java lang ClassLoader line 477 org eclipse osgi internal loader BundleLoader findClass java lang String boolean line 433 org eclipse osgi internal loader BundleLoader findClass java lang String line 421 org eclipse osgi internal baseadaptor DefaultClassLoader loadClass java lang String boolean line 107 org eclipse osgi internal baseadaptor DefaultClassLoader java lang ClassLoader loadClass java lang String line 248 com freescale startup RseInitializer initRseHooks line 71 com freescale startup StartupPlugin start org osgi framework BundleContext line 54 org eclipse osgi framework internal core BundleContextImpl 1 run line 783 java security AccessController doPrivileged java security PrivilegedExceptionAction lt gt line available native method org eclipse osgi framework internal core BundleContextImpl startActivator org osgi framework BundleActivator line 774 org eclipse osgi framework internal core BundleContextImpl start line 755 org eclipse osgi framework internal core BundleHost startWorker int line 370 org eclipse osgi framework internal core BundleHost org eclipse osgi framework internal core AbstractBundle start int line 284 org eclipse osgi framework util SecureAction start org osgi framework Bundle int line 417 org eclipse osgi internal loader BundleLoader setLazyTrigger line 276 org eclipse core runtime internal adaptor EclipseLazyStarter postFindLocalClass java lang String java lang Class org eclipse osgi baseadaptor loader ClasspathManager line 106 org eclipse osgi baseadaptor loader ClasspathManager findLocalClass java lang String line 453 org eclipse osgi internal baseadaptor DefaultClassLoader findLocalClass java lang String line 216 org eclipse osgi internal loader BundleLoader findLocalClass java lang String line 404 org eclipse osgi internal loader BundleLoader findClassInternal java lang String boolean java lang ClassLoader line 480 org eclipse osgi internal loader BundleLoader findClass java lang String boolean line 433 org eclipse osgi internal loader BundleLoader findClass java lang String line 421 org eclipse osgi internal baseadaptor DefaultClassLoader loadClass java lang String boolean line 107 org eclipse osgi internal baseadaptor DefaultClassLoader java lang ClassLoader loadClass java lang String line 248 org eclipse osgi internal loader BundleLoader loadClass java lang String line 349 org eclipse osgi framework internal core BundleHost loadClass java lang String boolean line 232 org eclipse osgi framework internal core BundleHost org eclipse osgi framework internal core AbstractBundle loadClass java lang String line 1197 Thread main Suspended owns org eclipse cdt internal core settings model CProjectDescriptionManager id 53 owns java lang Class lt gt org eclipse cdt internal core settings model CProjectDescriptionManager id 54 owns org eclipse swt widgets RunnableLock id 55 waiting java lang Object id 52 java lang Object wait long line available native method org eclipse osgi framework internal core BundleHost org eclipse osgi framework internal core AbstractBundle beginStateChange line 1085 org eclipse osgi framework internal core BundleHost org eclipse osgi framework internal core AbstractBundle start int line 282 org eclipse osgi framework util SecureAction start org osgi framework Bundle int line 417 org eclipse osgi internal loader BundleLoader setLazyTrigger line 276 org eclipse core runtime internal adaptor EclipseLazyStarter postFindLocalClass java lang String java lang Class org eclipse osgi baseadaptor loader ClasspathManager line 106 org eclipse osgi baseadaptor loader ClasspathManager findLocalClass java lang String line 453 org eclipse osgi internal baseadaptor DefaultClassLoader findLocalClass java lang String line 216 org eclipse osgi internal loader BundleLoader findLocalClass java lang String line 404 org eclipse osgi internal loader BundleLoader findClassInternal java lang String boolean java lang ClassLoader line 480 org eclipse osgi internal loader BundleLoader findClass java lang String boolean line 433 org eclipse osgi internal loader BundleLoader findClass java lang String line 421 org eclipse osgi internal baseadaptor DefaultClassLoader loadClass java lang String boolean line 107 org eclipse osgi internal baseadaptor DefaultClassLoader java lang ClassLoader loadClass java lang String line 248 java lang Class lt gt getDeclaredConstructors0 boolean line available native method java lang Class lt gt privateGetDeclaredConstructors boolean line 2389 java lang Class lt gt getConstructor0 java lang Class int line 2699 java lang Class lt gt newInstance0 line 326 java lang Class lt gt newInstance line 308 org eclipse core internal registry osgi EquinoxRegistryStrategy org eclipse core internal registry osgi RegistryStrategyOSGI createExecutableExtension org eclipse core runtime spi RegistryContributor java lang String java lang String line 184 org eclipse core internal registry ExtensionRegistry createExecutableExtension org eclipse core runtime spi RegistryContributor java lang String java lang String line 904 org eclipse core internal registry ConfigurationElement createExecutableExtension java lang String line 243 org eclipse core internal registry ConfigurationElementHandle createExecutableExtension java lang String line 55 org eclipse cdt internal core settings model CConfigurationDataProviderDescriptor createProvider org eclipse core runtime IExtension line 101 org eclipse cdt internal core settings model CConfigurationDataProviderDescriptor lt init gt org eclipse core runtime IExtension line 55 org eclipse cdt internal core settings model CProjectDescriptionManager initProviderInfo line 1197 org eclipse cdt internal core settings model CProjectDescriptionManager getInstance line 275 org eclipse cdt core CCorePlugin start org osgi framework BundleContext line 318 org eclipse osgi framework internal core BundleContextImpl 1 run line 783 java security AccessController doPrivileged java security PrivilegedExceptionAction lt gt line available native method org eclipse osgi framework internal core BundleContextImpl startActivator org osgi framework BundleActivator line 774 org eclipse osgi framework internal core BundleContextImpl start line 755 org eclipse osgi framework internal core BundleHost startWorker int line 370 org eclipse osgi framework internal core BundleHost org eclipse osgi framework internal core AbstractBundle start int line 284 org eclipse osgi framework util SecureAction start org osgi framework Bundle int line 417 org eclipse osgi internal loader BundleLoader setLazyTrigger line 276 org eclipse core runtime internal adaptor EclipseLazyStarter postFindLocalClass java lang String java lang Class org eclipse osgi baseadaptor loader ClasspathManager line 106 org eclipse osgi baseadaptor loader ClasspathManager findLocalClass java lang String line 453 org eclipse osgi internal baseadaptor DefaultClassLoader findLocalClass java lang String line 216 org eclipse osgi internal loader BundleLoader findLocalClass java lang String line 404 org eclipse osgi internal loader SingleSourcePackage loadClass java lang String line 33 org eclipse osgi internal loader BundleLoader findClassInternal java lang String boolean java lang ClassLoader line 477 org eclipse osgi internal loader BundleLoader findClass java lang String boolean line 433 org eclipse osgi internal loader BundleLoader findClass java lang String line 421 org eclipse osgi internal baseadaptor DefaultClassLoader loadClass java lang String boolean line 107 org eclipse osgi internal baseadaptor DefaultClassLoader java lang ClassLoader loadClass java lang String line 248 com freescale core ide pathMapping StartupListeners execute line available local variables unavailable com freescale core ide pathMapping StartupListeners 1 runInUIThread org eclipse core runtime IProgressMonitor line available org eclipse ui progress UIJob 1 run line 96 org eclipse swt widgets RunnableLock run line 35 org eclipse ui internal UISynchronizer org eclipse swt widgets Synchronizer runAsyncMessages boolean boolean line 154 org eclipse swt widgets Display runAsyncMessages boolean boolean line 4056 org eclipse swt widgets Display readAndDispatch boolean line 3671 org eclipse ui internal Workbench runEventLoop org eclipse jface window Window IExceptionHandler org eclipse swt widgets Display line 2640 org eclipse ui internal Workbench runUI line 2604 org eclipse ui internal Workbench access 4 org eclipse ui internal Workbench line 2438 org eclipse ui internal Workbench 7 run line 671 org eclipse core databinding observable Realm runWithDefault org eclipse core databinding observable Realm java lang Runnable line 332 org eclipse ui internal Workbench createAndRunWorkbench org eclipse swt widgets Display org eclipse ui application WorkbenchAdvisor line 664 org eclipse ui PlatformUI createAndRunWorkbench org eclipse swt widgets Display org eclipse ui application WorkbenchAdvisor line 149 org eclipse ui internal ide application IDEApplication start org eclipse equinox app IApplicationContext line 115 com freescale morpho buildtools unittest TestRunner start org eclipse equinox app IApplicationContext line 217 org eclipse equinox internal app EclipseAppHandle run java lang Object line 196 org eclipse equinox internal app MainApplicationLauncher run java lang Object line 32 org eclipse core runtime internal adaptor EclipseAppLauncher runApplication java lang Object line 110 org eclipse core runtime internal adaptor EclipseAppLauncher start java lang Object line 79 org eclipse core runtime adaptor EclipseStarter run java lang Object line 369 org eclipse core runtime adaptor EclipseStarter run java lang String java lang Runnable line 179 sun reflect NativeMethodAccessorImpl invoke0 java lang reflect Method java lang Object java lang Object line available native method sun reflect NativeMethodAccessorImpl invoke java lang Object java lang Object line 39 sun reflect DelegatingMethodAccessorImpl invoke java lang Object java lang Object line 25 java lang reflect Method invoke java lang Object java lang Object line 597 org eclipse equinox launcher Main invokeFramework java lang String java net URL line 620 org eclipse equinox launcher Main basicRun java lang String line 575 org eclipse equinox launcher Main run java lang String line 1408 ,3
238081,patch provided PE Windows Parser CDT 4 return global variables Build ID M20080221 1800Steps Reproduce 1 Go Project gt Properties gt C C Build gt Settings gt Binary parsers tab PE Windows Parser selected 2 Debug binary program exe th org eclipse cdt debug core src org eclipse cdt debug internal core model CDebugTarget java method public IGlobalVariableDescriptor getGlobals match ICDITarget instance ICDITarget2 3 Variables view open context menu select Add Global Variables 4 Notice thMore information Checking source code org eclipse cdt core src org eclipse cdt utils coff parser PEBinaryObect java notice problem parser filters symbol table looking symbol type field e type tries keepDT PTR 01 pointer TDT FCN 10 function returning TDT ARY 11 array TWhile works function entries symbol table working variables global variables pointers arrays fact gcc sets variables symbol table typeDT NON 00 derived typeFiltering DT NON well weak zero value lot invalid entries pass order variables added filter storage class field e sclass symbol following types C EXT 2 External public symbol covers globals externsC STAT 3 static private symbolwe add list Patch provided ,3
444745,Breakpoint actions property page hide unsupported actions ,3
294054,Vala support PRETTY PLEASE ,3
287107,Linked Source Project NullpointerException NewClassCodeGenerator try use projectfile generated CMake separate build files source CMake puts source folder another project linked build one work create new Class via Wizard get error message stating error creating type errorlog contains following info stacktrace eclipse buildId I20090611 1540java version 1 6 0 0java vendor Sun Microsystems Inc BootLoader constants OS linux ARCH x86 64 WS gtk NL de DECommand line arguments os linux ws gtk arch x86 64ErrorWed Aug 19 19 03 04 CEST 2009Errorjava lang reflect InvocationTargetExceptionjava 477 java 372 java 944 java 107 java 70 java 752 java 373 java 624 java 228 java 84 java 1176 java 3493 java 3112 java 825 java 801 java 98 java 498 java 584 java 501 java 411 java 84 java 1176 java 3493 java 3112 java 2405 java 2369 java 2221 java 500 java 332 java 493 java 149 java 113 java 194 java 110 java 79 java 368 java 179 invoke0 Native Method java 57 java 43 java 616 java 559 java 514 java 1311 java 1287 Caused java lang NullPointerExceptionjava 179 java 1921 java 1867 java 60 java 100 java 35 java 338 java 603 java 1800 java 1234 java 63 java 464 44 ,3
548084,NullpointerException Double Clicking gcda File one project issue double clicking gcda file generated g using Eclipse CDT build another project double clicked gcda file got following metadata log ENTRY org eclipse jface 4 2 2019 06 09 20 32 48 458 MESSAGE Problems occurred invoking code plug org eclipse jface STACK 0java lang NullPointerExceptionjava 117 java 5504 java 72 java 5498 java 3309 java 3216 java 72 java 3213 java 3177 java 3167 java 566 java 521 java 103 java 100 java 219 java 183 java 49 java 853 java 45 java 47 java 176 java 850 java 1165 java 454 java 276 java 271 java 311 java 89 java 5663 java 1386 java 4931 java 4472 java 1173 java 339 java 1062 java 156 java 636 java 339 java 563 java 151 java 155 java 203 java 137 java 107 java 400 java 255 invoke0 Native Method java 62 java 43 java 498 java 659 java 595 java 1501 java 1474 scrolled saw tried open binary file another project ENTRY org eclipse cdt core 4 0 2019 06 09 20 32 48 457 MESSAGE Error TSCTimeRecorder Debug TSCTimeRecorder file directory STACK 0java io FileNotFoundException TSCTimeRecorder Debug TSCTimeRecorder file directory open0 Native Method java 316 java 243 java 124 java 30 java 683 java 703 java 948 java 150 java 59 java 45 java 616 java 595 java 430 java 374 java 499 java 117 java 5504 java 72 java 5498 java 3309 java 3216 java 72 java 3213 java 3177 java 3167 java 566 java 521 java 103 java 100 java 219 java 183 java 49 java 853 java 45 java 47 java 176 java 850 java 1165 java 454 java 276 java 271 java 311 java 89 java 5663 java 1386 java 4931 java 4472 java 1173 java 339 java 1062 java 156 java 636 java 339 java 563 java 151 java 155 java 203 java 137 java 107 java 400 java 255 invoke0 Native Method java 62 java 43 java 498 java 659 java 595 java 1501 java 1474 Idea ,3
550632,Download page tells visitors Install favorite desktop IDE packages contains right column FUJITSU picture small Get Eclipse IDE 2019 06 box inviting visitors download box displays following sentence understanding Eclipse sentence makes sense convinced th ,3
487468,reports provide repository reports tests maven plugins lost track ultimately would good provide maven plugin Tycho builds could run right repository created see mostly one plugin th would see output reports going subdirectory repository would self contained perhaps directory named reports peer features plugins reports would index html file along another directory reporeports report files could go ,3
300011,XLC Compiler property offer file folder property XLC Compiler property filtered File Folder properties think makes much sense thought introduced rather rudely accompanied NPE Open file properties Select observe XLC C Compiler tab Switch C C Build tab Change something example Exclude resource build Press OK comes NPE java lang NullPointerExceptionjava 34 java 161 java 964 java 42 java 49 java 175 java 944 java 453 java 233 java 624 java 228 java 84 java 1050 java 3931 java 3524 java 825 java 801 java 157 java 498 java 119 java 476 java 508 java 169 java 470 java 824 java 880 java 569 java 510 java 125 java 84 java 1240 java 1049 java 1074 java 1059 java 1100 java 1096 java 2430 java 4611 java 4027 java 5838 java 4678 DispatchMessageW Native Method java 2437 java 3522 java 2407 java 2371 java 2220 java 500 java 332 java 493 java 149 java 113 java 194 java 110 java 79 java 367 java 179 invoke0 Native Method invoke Unknown Source invoke Unknown Source invoke Unknown Source java 611 java 566 java 1363 java 1339 ,3
335614,NPE getUniqueIdentifier Build Identifier cdt7 0 1 ok cdt6 0 2 Hi get error described run code using cdt7 0 1 code works ok running cdt6 0 2 backtrace follows java lang NoClassDefFoundError org eclipse cdt managedbuilder internal dataprovider ConfigurationDataProvider java 2747 java 2992 java 379 java 376 java 66 java 404 java 350 java 184 java 123 java 116 java 451 java 348 java 260 java 141 java 416 java 142 java 127 java 2035 java 2959 java 583 java 147 java 414 java 240 java 416 java 398 java 2731 java 2992 java 2947 Reproducible Always ,3
441878,Deadlock debugging Start eclipse gt F11 gt close aplication gt deadlock gt Threaddump jvisualvmWhen debug Makefile project GLFW OpenGL application eclipse IDE freezes close application Sometimes mostly application crashes startup first debugging session returns without hanging happens eclipse never hang debugging sessions restart IDE using Eclipse 4 3 2 3fc20 java 1 7 0 openjdk 1 7 0 65 2 5 1 3 fc20 x86 64 also using eclipse perforce prject Imported perforce problem occurs since 3 months bound specific version Also reproduce C projects ,3
244614,Run CTF JUnit Runner GUI Eclipse IDE Build ID 3 4 0Steps Reproduce information would nice configure Corona Test Framework launch th ,3
102292,Progress information window hides Name Conflict window found bug pasting file directory obviouslyresults name conflict name conflict window shows alright however modal UNDER Progress Information window programthen appears frozen Solution Display name conflict window Progress information window System Information Eclipse 3 1 GCJ CDTFedora core 4 x86 ,3
